id_review,caption,relative_date,retrieval_date,rating,username,n_review_user,n_photo_user,url_user
ChZDSUhNMG9nS0VJQ0FnSUREN1p5Y0FnEAE,We came to see an exhibit about fragrances and the history of them. It was such a unique and immersive experience! The building is also beautiful so be sure to give yourself time to roam.,8 months ago,2024-12-28 15:08:35.919327,5.0,Nathan Bilancio,115,https://www.google.com/maps/contrib/103999002359118772238/reviews?hl=en-GB
ChZDSUhNMG9nS0VJQ0FnSUNwNXItNmJBEAE,"The building alone is worth the visit. The temporary exhibitions (Palestine, Jean Genet) were brilliant, with lots of information to read.  It seems both exhibitions were mixed with the permanent ones. With signage not always clear (should we take the stairs or lift...), it was sometimes confusing. Not a problem since everything was great, but a bit annoying at times.  The bookstore has lots of choices to deepen the subjects...",a year ago,2024-12-28 15:08:35.919327,5.0,Raoul Jean-Ray P.,144,https://www.google.com/maps/contrib/114978694285466726490/reviews?hl=en-GB
ChZDSUhNMG9nS0VJQ0FnSURoanNDUENnEAE,"Really liked the temporary exhibitions, especially the one about Samarkand textiles and jewelry. The permanent exhibition seems to have interesting exhibits, but lack storyline or proper explanations, so it's not as educational and enjoyable as it could have been.",a year ago,2024-12-28 15:08:35.919327,4.0,Viktoria Korzhova,101,https://www.google.com/maps/contrib/100784981548658319987/reviews?hl=en-GB
ChdDSUhNMG9nS0VJQ0FnSUNscUxfTW1RRRAB,"The name of the building is L'Institut du Monde Arabe. It is an extraordinary edifice by architect Jean Nouvel.  The exhibitions inside and outside are thrilling and exceptional. The store is filled with a wide range of books of poetry, protest images in Iran, Persepolis, novels, and catalogues. You will also find an array of glass ware and ceramics for kitchen and dining , as well as jewellery. One exhibition concerns Palestine with a video of Mamoud Darwich reading his poetry, works of Jean Genet and artworks on loan from the Museum of Palestine located in east Jerusalem. Another exhibit concerns Perfume with actual scents to inhale, as well as a sensual womanist video with haunting V O of intimate scenes in a hamam.",a year ago,2024-12-28 15:08:35.920327,5.0,Frances Charteris,201,https://www.google.com/maps/contrib/118098543776852913572/reviews?hl=en-GB
ChZDSUhNMG9nS0VJQ0FnSUN5NUtTaVVBEAE,"Overall a great place to be as there’s plenty of history there like the ancient sculpture of god “Al-Lat” (Photo attached). You can also view Paris from the top of this building which is free to access but the view is not as good as from Montmartre. The architecture of the building is very interesting because there are metallic motifs on the building making a facade (inspired from Arab culture) that move like a camera’s diaphragm to control the amount of light coming in. Plus, you gotta be very careful once inside specially near the open artefacts, art pieces and installations.",a year ago,2024-12-28 15:08:35.920327,5.0,Shakir Ali Khan,44,https://www.google.com/maps/contrib/115994484916657787008/reviews?hl=en-GB
ChdDSUhNMG9nS0VJQ0FnSURYbmZQLTdRRRAB,"Never go here! They are RACISTS! Horrible experience. Staffs in the front desk and restaurant are very RUDE. They refused us to enter! I’m Asian and my friend has white skin. When we arrived at 1:50pm (the website shows it close at 2:30pm), the white male staff told us they were full. However, it didn’t! The website showed we could even reserve for 2:00 and 2:15! We went to the ground floor and told the front desk what happened. They were extremely RUDE!! At first they even said it didn’t relate them, go ask the restaurant! After I explained that the whole institution should communicate to make sure all the visitors have nice experience, and the staffs in the restaurant are RACISTS, she simply said yes contemptuously without helping anything. I really regret that I’ve paid for the tickets, visited the exhibitions, bought many souvenirs! Terrible racist institution! Don’t go!",a month ago,2024-12-28 15:08:35.920327,1.0,Jingwei,0,https://www.google.com/maps/contrib/101720473561723510456/reviews?hl=en-GB
ChZDSUhNMG9nS0VJQ0FnSURNa2M2aVZBEAE,"Quite an amazing institution for anyone interested in discovering the greatness and splendor of the classical Arab World as well as the mystery of the Orient. Visited on the occasion of the Al-'Ulâ exhibition, where one learns about the rich history of the Arabic peninsula.  On 28-MAY-2024 visited the extraordinary exhibition on the work of French, Algerian-at-heart, painter Etienne Dinet. Absolutely stunning work and excellent exhibition.",2 months ago,2024-12-28 15:08:35.924329,5.0,Alexandre Papanastassiou,338,https://www.google.com/maps/contrib/105567958319270794513/reviews?hl=en-GB
ChZDSUhNMG9nS0VJQ0FnSUR4aXJ6S0ZnEAE,"A beautiful exhibition “On the roads of Samarkand, marvels of silk and gold.” A unique exhibits of hundreds of pieces of splendour crafting, around the 20th century. for the first time shown outside museums in Uzbekistan. Glad I didn’t miss it.",a year ago,2024-12-28 15:08:35.924329,4.0,Karry B,68,https://www.google.com/maps/contrib/108761634009102144895/reviews?hl=en-GB
ChdDSUhNMG9nS0VJQ0FnSUN3dXBMN3Z3RRAB,"A very nice place to visit while in Paris, to know a bit about the arabic culture, tradition and some other things from that part of the world! the architecture of the building is wonderful, a mixture between the arabic one and the modern one, really a great mixture, the facade of glass reflecting the sun's rays and allowing to it to light the rooms, no need to electricity!",6 years ago,2024-12-28 15:08:35.924329,5.0,MED DAVID,210,https://www.google.com/maps/contrib/100414002447968803137/reviews?hl=en
ChdDSUhNMG9nS0VJQ0FnSUMtcTRPRzJRRRAB,Very rare and courageous exhibition about LGBTQI+ at the Arab World Institute that shows a set of various young international artists who decided to represent their vision of the Gay world. The exhibition at the IMA are always very well documented and you will learn a lot what ever you will see.,2 years ago,2024-12-28 15:08:35.925329,4.0,Brice Pissard,285,https://www.google.com/maps/contrib/104645388123572958003/reviews?hl=en
ChdDSUhNMG9nS0VJQ0FnSUQ3bXJMaF93RRAB,The place is well worth the visit and the roof top restaurant is amazing,4 months ago,2024-12-28 15:08:35.925329,5.0,George Faswa,27,https://www.google.com/maps/contrib/104094211296109253867/reviews?hl=en
ChZDSUhNMG9nS0VJQ0FnSUR3bUpDaVd3EAE,"The architecture of the building is very interesting, with Arabic geometric motifs all around. And you could take the lift to the 9th floor to have a panoramic view of the Seine and the Notre-Dame, for free! Good for a quick visit if you are not interested in the exhibitions inside the Centre.",6 years ago,2024-12-28 15:08:35.925329,3.0,覃羿彬,483,https://www.google.com/maps/contrib/116500596331649178670/reviews?hl=en
ChdDSUhNMG9nS0VJQ0FnSUQ2dmVTT3JBRRAB,"Interesting facade for those interested in architecture. I believe interesting exhibitions, however unfortunately I haven't seen them. But nice view from the top (free entrance as of 2021) over Notre Dame and part of Paris.",3 years ago,2024-12-28 15:08:35.926329,5.0,Karol Lubiejewski,177,https://www.google.com/maps/contrib/112252533423937721460/reviews?hl=en
ChdDSUhNMG9nS0VJQ0FnSUMxMXRPdmtBRRAB,"L’institut du Monde Arab has clearly had better days :-( maintenance is clearly an issue, the upper deck has not been cleaned for ages, cigarettes buts everywhere, well do not take the stairs… they are rather dirty…. So long…. Very disappointing, the store even more so… the elevator lettering has had better days… while the entry tickets are not that cheap but that is not the issue….",11 months ago,2024-12-28 15:08:35.926329,2.0,Selma Turki,95,https://www.google.com/maps/contrib/101992082921156395494/reviews?hl=en
ChdDSUhNMG9nS0VJQ0FnSUNka0pmQmp3RRAB,"Unique institution: a library open to all visitors, exhibition space, gift shop, restaurant.",10 months ago,2024-12-28 15:08:35.926329,5.0,Drago Indjic,925,https://www.google.com/maps/contrib/114416295367143707423/reviews?hl=en
ChZDSUhNMG9nS0VJQ0FnSUQ4bUllNmNnEAE,Customer experience 💙💙💙 Service 💙💙💙 Location 💙💙💙 Very good museum about arabic art and history with temporary and permanent collections. You can also enjoy the rooftop on top of the building,4 years ago,2024-12-28 15:08:35.926329,4.0,Cédric (KDRIC),"1,735",https://www.google.com/maps/contrib/115466470045389771674/reviews?hl=en
ChZDSUhNMG9nS0VJQ0FnSURteFlMY2R3EAE,"This was when I first saw Zaha Hadid's work, and I can't help but fall in love with it ever since.  “There are 360 degrees, so why stick to one?”  “I have always appreciated those who dare to experiment with materials and proportions.”  “You really have to have a goal. The goal posts might shift, but you should have a goal. Know what it is you want to find out.”",2 years ago,2024-12-28 15:08:35.927330,5.0,龐德,186,https://www.google.com/maps/contrib/117065198691515267466/reviews?hl=en
ChdDSUhNMG9nS0VJQ0FnSUN3MUxUT3NBRRAB,"Didn’t get in to the display. I was there just for the building. And it looked great. You can take the elevator to the top floor for free, and walk along the inside of the buildings shell",6 years ago,2024-12-28 15:08:35.927330,4.0,Moran Ben Hur,433,https://www.google.com/maps/contrib/116110174678870103507/reviews?hl=en
ChZDSUhNMG9nS0VJQ0FnSURxNEotZmJREAE,One of my favourite places in Paris. The architecture is another great work of Jean Nouvel with the famous mousharabiya on its façade It has always very rich exhibitions from the arab and islamic world. The terrace has a breathtaking view of Paris and Notre Dame. Noura the Lebanese restaurant on the last floor is always a good idea if you are craving taboulé and kebbé Highly recommended,3 years ago,2024-12-28 15:08:40.198972,5.0,Zena,39,https://www.google.com/maps/contrib/113084328260367363848/reviews?hl=en
ChdDSUhNMG9nS0VJQ0FnSURSNXFqcXp3RRAB,Great architecture and exhibitions. Nice views from rooftop terrasse.,a year ago,2024-12-28 15:08:40.198972,5.0,Antoine Bonnet,380,https://www.google.com/maps/contrib/109617264383197303163/reviews?hl=en
ChZDSUhNMG9nS0VJQ0FnSUNUNHVmMVNnEAE,"We enjoyed the visit, and you can go to the rooftop to have look over the Paris. Also the most beautiful toilets in a public space :)",7 months ago,2024-12-28 15:08:40.198972,4.0,Marcel van Leeuwen,30,https://www.google.com/maps/contrib/111847575925368853253/reviews?hl=en
ChdDSUhNMG9nS0VJQ0FnSUR3aHUyRWpBRRAB,"The free entry to the top is great, it gives you the best view of the Notre Dame. Sadly I hadn't had enough time to check the entire place out but from what I can tell it's definitely worth visiting.",6 years ago,2024-12-28 15:08:40.199972,5.0,Vanessa Aders,46,https://www.google.com/maps/contrib/102676313791518842449/reviews?hl=en
ChdDSUhNMG9nS0VJQ0FnSUNhM1BMQnNRRRAB,Beautiful grounds and exposition. A great place to gain more cultural knowledge.,3 years ago,2024-12-28 15:08:40.199972,5.0,Deborah Albin,168,https://www.google.com/maps/contrib/106785295186726378587/reviews?hl=en
ChdDSUhNMG9nS0VJQ0FnSUNOcmM2UDRBRRAB,"The staff here just showed me the Arab hospitality. They gave me such a detailed intro of the building and where everything is. The rooftop view is amazing (it looks like a restaurant but visitors can pass by) the exhibition is sadly a bit rundown, I wish they could get more funding",11 months ago,2024-12-28 15:08:40.199972,5.0,Marissa Li,94,https://www.google.com/maps/contrib/112029854986350865266/reviews?hl=en
ChdDSUhNMG9nS0VJQ0FnSUQ4bGFyeDNRRRAB,institut du monde arabe (The Arab World Institute) - is an organization founded in Paris in 1980 by 18 Arab countries with France to research and share information about the Arab world and its cultural and spiritual values.,4 years ago,2024-12-28 15:08:40.199972,5.0,Medical And Tourism,276,https://www.google.com/maps/contrib/112164799694817784337/reviews?hl=en
ChZDSUhNMG9nS0VJQ0FnSURYMGV5ckNBEAE,"Very bad organization, and people are very rude like they do not like non religious people, not recommend rather visit a local museum",2 months ago,2024-12-28 15:08:40.200972,1.0,COS MOVILIDAD,38,https://www.google.com/maps/contrib/110475662312016208366/reviews?hl=en
ChZDSUhNMG9nS0VJQ0FnSURKOE42TlVnEAE,"Not nearly as interesting as it used to be 20 years ago. A lot of the explanation and background has changed, it used to lead you through the history and development of trade and mathematics and writing and religion, but now seems to lean heavily on contemporary politics without again explaining some of the landscape. Level -2 in particular misses out on the chance to explain the division. Still possibly worth a visit and some of the photography is very thought provoking. But seems to have lost some of it's now basic educational aspects. Very random. You head to the 9th floor for the view for free if you like.",a year ago,2024-12-28 15:08:40.203974,3.0,Adrian Tompkins,446,https://www.google.com/maps/contrib/103950604397403669036/reviews?hl=en
ChZDSUhNMG9nS0VJQ0FnSURoOHI3RlB3EAE,Really nice and interesting place. Helped me understand a lot about Muslims and Arab countries. Really nice and interesting videos too. The permanent exposition is free for less than 26 years old. And the biotique is really nice and big with great products at a relatively low price!  I would recommend anyone to go with someone who knows about Arabic culture so they can further explain and clear doubts if you have any,a year ago,2024-12-28 15:08:40.203974,5.0,Kevin Galbe,99,https://www.google.com/maps/contrib/104290793147303578925/reviews?hl=en
ChZDSUhNMG9nS0VJQ0FnSUMzeU1LSVZBEAE,such a lovely place.  only remark is that some things should be in English too.,a month ago,2024-12-28 15:08:44.488390,5.0,Dominik Matišić,22,https://www.google.com/maps/contrib/102322301935856454519/reviews?hl=en
ChdDSUhNMG9nS0VJQ0FnSUNRcGZEQ2d3RRAB,"Interesting exhibition, the provided information could be more detailed.",2 years ago,2024-12-28 15:08:44.488390,4.0,Michel Disdero,186,https://www.google.com/maps/contrib/103639654346187944747/reviews?hl=en
ChdDSUhNMG9nS0VJQ0FnSUMxX1BTcTNnRRAB,A work of art. Stupendous architecture and a wealth of interesting knowledge. It has peaceful and serene environment but I mostly love the garden for tea and food.,a year ago,2024-12-28 15:08:44.488390,5.0,sharin elkholy,0,https://www.google.com/maps/contrib/108132518456128178917/reviews?hl=en
ChdDSUhNMG9nS0VJQ0FnSURVaHQ3QnN3RRAB,"Nice library/museum on the Arab world, with a beautiful view on the rooftop.",5 years ago,2024-12-28 15:08:44.488390,4.0,Anas Belhaj,63,https://www.google.com/maps/contrib/117759874155454011175/reviews?hl=en
ChZDSUhNMG9nS0VJQ0FnSUNKeXBPOUt3EAE,"The main exhibition was disappointingly generic and chaotic. Only a few main descriptions are in English, rest only in french. I had really high hopes to learn something new about this rich and complex word but I didn't. Just very general, boring statements accompanied with poor collection, with no story or explanation behind. Moreover, the building is very dirty and badly organized.",a year ago,2024-12-28 15:08:44.489390,2.0,Barbara Bełza,25,https://www.google.com/maps/contrib/116850892073300501783/reviews?hl=en
ChdDSUhNMG9nS0VJQ0FnSUNoME9ma2pBRRAB,"Beautiful buildings. I saw Samarcande, Baya and Habibi. They're short, very interesting, very different exhibitions. In 5 hours you'll spend a nice day at the museum. The food is correct. Going to the bathroom is more tricky, very unusual for a museum.",a year ago,2024-12-28 15:08:44.489390,4.0,sylvie shand,182,https://www.google.com/maps/contrib/106398997122208404470/reviews?hl=en
ChdDSUhNMG9nS0VJQ0FnSURuaHMtZXd3RRAB,Very interesting,2 months ago,2024-12-28 15:08:44.489390,5.0,Viktoriia,87,https://www.google.com/maps/contrib/116846818728134521945/reviews?hl=en
ChdDSUhNMG9nS0VJQ0FnSUNPM0lQZTVBRRAB,"I was really looking forward to visiting here, and was disappointed. We visited the two special exhibitions (each concerning Algeria, to mark 60 years) and the main exhibition. All felt low on information, and I felt I learned nothing new. The information provided was superficial, at the level I would expect from a geography or religious study textbook targeting children. The display of information was frustrating (Often yellow text on white background, poorly lit and at knee height, or else dark text on a clear background which was hard to read and obscured the objects). It would be great to see a group of visionary curators turn this interesting space into a real opportunity to educate and surprise.",2 years ago,2024-12-28 15:08:44.489390,2.0,Dani Quinn,144,https://www.google.com/maps/contrib/104338551337439049424/reviews?hl=en
ChdDSUhNMG9nS0VJQ0FnSURRX1pfMDZnRRAB,"This is a comprehensive museum about the origins of Islam, as well as Judaism and Christianity. The museum has excellent temporary exhibits from showcasing an original Oriental Express train to Hip Hop. The architecture of the building is both striking and functional. The mechanical plates on the windows are mechanized to let in specific amounts of light based on either the user or the general audience. This is also one of the hidden rooftops in Paris that you can get a good view of the city, and it's free! Just take the elevator up to the top floor. To see the rest of the museum you need to pay the entrance fee, but it's worth it. There is also a very nice restaurant on the top floor to enjoy lunch or dinner.",9 years ago,2024-12-28 15:08:44.490391,4.0,Holly Foxcroft,372,https://www.google.com/maps/contrib/104878894499420346272/reviews?hl=en
ChZDSUhNMG9nS0VJQ0FnSURCa2ZQeER3EAE,"Excellent exhibition, but a very poor museum experience. From the long and inefficient line at the entrance, the antipathetic staff, there was no place to leave the coat-it was full..... & The cafeteria was terrible.",a year ago,2024-12-28 15:08:44.490391,1.0,Anat Kisch,0,https://www.google.com/maps/contrib/106633502389886535292/reviews?hl=en
