id_review,caption,relative_date,retrieval_date,rating,username,n_review_user,n_photo_user,url_user
ChdDSUhNMG9nS0VJQ0FnSUM5dzlxUWdBRRAB,"You don't need to pay anything to enter here. Near this place is Chateau Vincennes, a really big castle. Unfortunately when i visited this area the place was closed, but i could walk in the woods.  This area is really big, and has a lot to offer, especially on the other side, you will find Lac Daumesnil. You won't regret going there.",10 months ago,2025-01-24 14:21:37.832525,5.0,Alessandro Stefan,404,https://www.google.com/maps/contrib/107599905881571271824/reviews?hl=en-GB
ChdDSUhNMG9nS0VJQ0FnSUQ3ODd5cjNRRRAB,"Optimal for walking, biking, jogging and ... during the day. At night there is another business on = not to recommend ...",4 months ago,2025-01-24 14:21:37.833525,4.0,Michael Volkmar,355,https://www.google.com/maps/contrib/112241467065903466517/reviews?hl=en-GB
ChdDSUhNMG9nS0VJQ0FnSUNYNS1YTTh3RRAB,"Beautiful place to run and walk, surrounded by water, birds, ducks and nature.",3 months ago,2025-01-24 14:21:37.833525,5.0,Clara Tomé,73,https://www.google.com/maps/contrib/108824821067433099492/reviews?hl=en-GB
ChZDSUhNMG9nS0VJQ0FnSURSby02NVBBEAE,"A must go, you see many peacocks. The entrance is near the zoo. Just come by metro or tram. no need to take bus. Has a big lake, where you can rent a boat and raw. In spring is so beautiful, there are white flowers that look like snow on the ground. Calm place to relax, walk and enjoy the sun. Google maps directions are not that accurate, but you will find it easy.",a year ago,2025-01-24 14:21:37.834528,5.0,Clau Zone,183,https://www.google.com/maps/contrib/102430877966078861597/reviews?hl=en-GB
ChZDSUhNMG9nS0VJQ0FnSURqdnZpZk1BEAE,"My fave jardin/ parc in 20th eme in Paris. It’s totally free to enter, you can do almost anything you want, jogging, walking, running whether you alone or in a group. Visit the arboretum the river just sitting down alone to contemplate your life, reading a book, kissing a with your lover. But please keep it beautiful as it is. I’m just running here circling the park and it turned out to my half marathon run.",8 months ago,2025-01-24 14:21:37.834528,5.0,Putri Dumadi,732,https://www.google.com/maps/contrib/104270468737476868971/reviews?hl=en-GB
ChZDSUhNMG9nS0VJQ0FnSUNuN0k3ak13EAE,"Bois de Vincennes, located on the eastern edge of Paris, is one of the largest green spaces in the city, offering a stunning retreat from the urban hustle. Often referred to as the “lungs of Paris,” this expansive park covers nearly 2,500 acres, making it a haven for nature lovers, joggers, cyclists, and families looking to relax outdoors.  The park’s diverse landscapes range from sprawling meadows and thick woodlands to picturesque lakes, creating a variety of ecosystems that are home to numerous bird species and wildlife. One of the highlights is the Lac Daumesnil, where visitors can rent boats and float peacefully, surrounded by lush greenery. The Parc Floral is another must-see, especially in spring and summer when the vibrant flower displays are in full bloom. For those interested in history, the Château de Vincennes, a medieval fortress located at the park’s edge, adds a touch of cultural charm.  Bois de Vincennes is well-equipped with paths for biking and walking, making it an ideal spot for those looking to stay active. There’s also a small zoo, the Parc Zoologique de Paris, and an equestrian center for horseback riding enthusiasts. The park’s peaceful atmosphere and size make it feel like a natural escape, despite being just a short metro ride from central Paris.  The park hosts various events throughout the year, from concerts to festivals, adding a lively cultural element to the natural surroundings. Whether you’re after a peaceful walk, a scenic picnic, or just some fresh air, Bois de Vincennes offers something for everyone, blending the tranquility of nature with the charm of Paris.",4 months ago,2025-01-24 14:21:37.835527,5.0,Payel Khan,234,https://www.google.com/maps/contrib/106370737945171979010/reviews?hl=en-GB
ChdDSUhNMG9nS0VJQ0FnSURwdS1tTGlBRRAB,"Very big and lively park. Jogging, picnic, doing sports, cycling, zoo park etc you can do everything here. Also if you like to study botanics, there are different kinds of parks.",a year ago,2025-01-24 14:21:37.836526,5.0,Munkhkhuslen Bayarbat,60,https://www.google.com/maps/contrib/101445190303011304279/reviews?hl=en-GB
ChZDSUhNMG9nS0VJQ0FnSUNKN29qNVhREAE,"Beautiful park, very big, lots of sitting areas, perfect for picnics or just relaxing.. lots of swans and ducks, recommended for all ages",a year ago,2025-01-24 14:21:37.837526,5.0,מגנטים ענבר איזנמן Inbar Eisenman Imagnetim,14,https://www.google.com/maps/contrib/103299666940901023512/reviews?hl=en-GB
ChZDSUhNMG9nS0VJQ0FnSUNGdExLakJ3EAE,"i would advise against going to this park right now. usually it's pretty and fun, but now there's some construction going on and the bridge is closed off. also a lot of people. but the view is nice",a year ago,2025-01-24 14:21:37.837526,4.0,A W,14,https://www.google.com/maps/contrib/109306298844842843800/reviews?hl=en
ChdDSUhNMG9nS0VJQ0FnSUNkaFByaTB3RRAB,"Great afternoon watching le trot (Harness rating). A great pizza from Tony, fantastic view of the racing, beautiful horses made a lovely day out even tho the weather was full and wet.",11 months ago,2025-01-24 14:21:37.837526,5.0,Kevin Gray,42,https://www.google.com/maps/contrib/103257320824943670839/reviews?hl=en
ChdDSUhNMG9nS0VJQ0FnSUNPNGJ5M2xRRRAB,"What a great place, almost in the middle of the city! ❤️  The park is really really big! Inside is a huge lake with ducks, swans and geese and peacocks!  The place is great not only for sport but also for relaxing. Especially that grass looks like a carpet!  It's definitely one of my favourite places in Vincennes!",2 years ago,2025-01-24 14:21:37.838528,5.0,Pan Marcin,591,https://www.google.com/maps/contrib/106376151862295070526/reviews?hl=en
ChdDSUhNMG9nS0VJQ0FnSUQ4MS1PN3dRRRAB,"Beautiful and huge park on the outskirts of Paris. Visited in August 2020 and not much grass to sit on (lots of dryness around here). Nevertheless, with the lake and endless options of things to do, it's a well equipped and accessible hang out place, which is also great for a run. Not much paved roads, so take.it into consideration when bringing a stroller.",4 years ago,2025-01-24 14:21:37.839527,4.0,Ido Naim,432,https://www.google.com/maps/contrib/109568637979502243256/reviews?hl=en
ChZDSUhNMG9nS0VJQ0FnSURKMGRpSldBEAE,"If you live or are visiting nearby, I highly recommend running or riding through the Vincennes Woods. It’s a beautiful escape from the city with tall trees and winding trails. If you want to get lost in nature, this is the place. If you want to find the city again, just use your GPS. 😊 …",a year ago,2025-01-24 14:21:37.839527,5.0,Bernice Puleng,13,https://www.google.com/maps/contrib/107943450245907873748/reviews?hl=en
ChZDSUhNMG9nS0VJQ0FnSUQwX2VIZWNREAE,It's very big and beautiful.  There are lots of picnic spots. The flower gardens are pretty and huge place for the kids of all ages to play. Highly recommended,2 years ago,2025-01-24 14:21:37.840526,4.0,Nafisa Colombowala,200,https://www.google.com/maps/contrib/108236793062822768133/reviews?hl=en
ChdDSUhNMG9nS0VJQ0FnSUNfX3EyT3lBRRAB,"The best park you can visit in Paris. You need to take time for a walk, you can see so many  birds species.",a week ago,2025-01-24 14:21:37.840526,5.0,Pop Ioana Andreea,0,https://www.google.com/maps/contrib/115664527460620284142/reviews?hl=en
ChZDSUhNMG9nS0VJQ0FnSUR4Nzg3U0RREAE,Lovely peaceful green setting in Paris. Second year on the run visiting Porte Doree and this park is a lovely place to unwind after visiting the many busy Paris landmarks. Great to see an albino Peacock on this visit to the park too.,a year ago,2025-01-24 14:21:37.841526,4.0,Kevin Worthington,27,https://www.google.com/maps/contrib/103492230634475637974/reviews?hl=en
ChdDSUhNMG9nS0VJQ0FnSUNIczRiZXRnRRAB,Beautiful place to hanging out with friend,4 months ago,2025-01-24 14:21:37.841526,5.0,MH Nguyen,122,https://www.google.com/maps/contrib/114518257268296747390/reviews?hl=en
ChdDSUhNMG9nS0VJQ0FnSURKaTRqUWxRRRAB,"Best Park in/around Paris area. Picnic area for families and naturist area, also for those interested in horse riding, cycling and tennis.",a year ago,2025-01-24 14:21:37.842527,5.0,Jordi,11,https://www.google.com/maps/contrib/108353791647936097683/reviews?hl=en
ChdDSUhNMG9nS0VJQ0FnSUN1ejY3dS1nRRAB,"Amazing park, it has everything, calm and quiet corners, big promenades to walk, bike, or run. It also has places for the velib bikes a coffee shop/cantine to drink something by the lake. It is so clean and taken care of that you get away from the city in the best way",2 years ago,2025-01-24 14:21:42.032311,5.0,Stavroula Kagiamanidou,209,https://www.google.com/maps/contrib/113199355321998351963/reviews?hl=en
ChdDSUhNMG9nS0VJQ0FnSUNnNmFQLXVRRRAB,"Spectacular park on the eastern edge of Paris. Lovely landscaped scenery everywhere, well-tended gravel walkways (with four scenic artificial lakes), gardens, a zoo, a chateau, a temple, room to roam (it's the largest public park in the city). Fantastic history, if you care to look it up. Easy access from three Metro stops. A treasure.",7 years ago,2025-01-24 14:21:42.033313,5.0,Allen Parsons,288,https://www.google.com/maps/contrib/109620968297062870708/reviews?hl=en
ChdDSUhNMG9nS0VJQ0FnSUNxMEozbXBnRRAB,"Beautiful, serene, massive and just absolutely amazing. The place is huge! You can play sports, have a picnic, go into the woods and walk and breathe the fresh air. You can sunbathe, you can practically do whatever your heart desires. This place is so big that you don’t have to worry about it getting too crowded. You can find multiple spots where you can have your complete privacy. Just a great place!  So GREEN!!",3 years ago,2025-01-24 14:21:42.033313,5.0,Zara Khan,260,https://www.google.com/maps/contrib/115495910268212250391/reviews?hl=en
ChdDSUhNMG9nS0VJQ0FnSURhN3JyU3ZBRRAB,This place is highly recommended to people who likes sports and nature. If you want to be in harmony with nature come to this place. The only negative aspect here is that you can notice that people who walk with their dogs are not responsible for what their pets do.,3 years ago,2025-01-24 14:21:42.034312,5.0,Jose Miguel Menendez Sanchez,121,https://www.google.com/maps/contrib/110744061481780921280/reviews?hl=en
ChdDSUhNMG9nS0VJQ0FnSUNEaWVqeHNRRRAB,I really love this area! So does my dog! I usually take him to the rugby field next to the triangle that’s falsely called Polygon and we enjoy the nature.,9 months ago,2025-01-24 14:21:42.035323,5.0,Leo Novel,56,https://www.google.com/maps/contrib/118027736104290374898/reviews?hl=en
ChZDSUhNMG9nS0VJQ0FnSUMwdHItQWJREAE,"This park is beautiful with lots of flowers and different exhibits including a bonsai room, Jurassic room, and other spots like 2 cafe's and overall a tranquil environment. The bathrooms are clean and well organized as well as the rest of the park.",5 years ago,2025-01-24 14:21:42.035323,5.0,Alexandra VanZile,52,https://www.google.com/maps/contrib/108559056634967162456/reviews?hl=en
ChZDSUhNMG9nS0VJQ0FnSURxMElHRkZBEAE,"Lovely place to go for a walk, have a picnic with friends or tide your bike for hours. So peaceful yet full of life. I love it 😻 …",3 years ago,2025-01-24 14:21:42.036321,5.0,Daniela Telehuz,336,https://www.google.com/maps/contrib/111862047223684267277/reviews?hl=en
ChZDSUhNMG9nS0VJQ0FnSUMxMHZDVlVnEAE,The place was a nice park to jog/walk around. Very refreshing! Not too many big cities offer escapes like this one! Definitely recommend to visit.,a year ago,2025-01-24 14:21:42.036321,5.0,Fazli Shermatov,28,https://www.google.com/maps/contrib/104169462389206998672/reviews?hl=en
ChZDSUhNMG9nS0VJQ0FnSURpLWJ6UlNnEAE,"Beautiful place, very big so perfect to walk, do some sport, picnic, or just chill. Easy to get by metro line 1 or RER A (stop château de Vincennes), line 6 (stop Daumesnil) or line 8 (stop liberté) these two if you want to go to Daumesnil's Lake  There's another lake named Minimes which I prefer since it is more quiet and less crowded.  I recommend to visit also the city's garden (parc floral). It's beautiful and the entrance fee is 2 or 3 euros (it's free from October to Mars). In August - September they have a Dahlias exposition : totally worth it.",4 years ago,2025-01-24 14:21:42.037311,5.0,Lina Gomez,234,https://www.google.com/maps/contrib/109140238452999998039/reviews?hl=en
ChdDSUhNMG9nS0VJQ0FnSURXanA3Q193RRAB,"Huge park, if you like nature and lots of walk or exercise (running/jogging) you would love this place.  Probably the biggest one not very far from Paris. Really enjoyed the walk for few hours here. Great place for walking, running, relaxation, outdoor activities. I would revisit if I have chance again for sure.",2 years ago,2025-01-24 14:21:42.037311,5.0,Süksön Niyom,15,https://www.google.com/maps/contrib/118340949113512780896/reviews?hl=en
ChZDSUhNMG9nS0VJQ0FnSUNYaHQ3Mkt3EAE,Splendid view.. Boating is must .,3 months ago,2025-01-24 14:21:46.218124,5.0,B Sharma,8,https://www.google.com/maps/contrib/116114534211374656548/reviews?hl=en
ChZDSUhNMG9nS0VJQ0FnSUR3OHIza2Z3EAE,Huge Park with a few beautiful lakes. The thing that makes it different is tgat you xan actually take a row boat in the lake.. Which is a lot of fun and a hreat exercise.  The park also has a circus but not always opertaional.. And a botanical garden which I didn't get the chance to visit since the park was so big.  Very relaxing place to spend an afternoon.,6 years ago,2025-01-24 14:21:46.219126,5.0,Dr. Mohamed Tarek,54,https://www.google.com/maps/contrib/102548713218477754579/reviews?hl=en
ChdDSUhNMG9nS0VJQ0FnSUNKaV9Dc3JBRRAB,The zoo animals were hiding...the tropical house was great...more like a park than a place to see animals.,a year ago,2025-01-24 14:21:46.220125,5.0,Zane Innus,113,https://www.google.com/maps/contrib/107734042172106042988/reviews?hl=en
ChdDSUhNMG9nS0VJQ0FnSURBcUtXdnBBRRAB,"I visited this park twice during my morning runs, while visiting Paris. What a special place this is!! It has a quite large pond and, in the mornings, it's quite a calm and relaxing spot. Lot's of fellow runners too.",6 years ago,2025-01-24 14:21:46.220125,5.0,Luis Machado,66,https://www.google.com/maps/contrib/114795385835963693935/reviews?hl=en
ChZDSUhNMG9nS0VJQ0FnSURSXzZIak53EAE,It's a beautiful park. I recommend visiting it and walking through it alone or with company,a year ago,2025-01-24 14:21:46.221125,5.0,monta dz,7,https://www.google.com/maps/contrib/105351455206772821034/reviews?hl=en
ChZDSUhNMG9nS0VJQ0FnSUNvMzRiX2RBEAE,"Superb place for spending whole day soaking good sun and enjoying the lovely views of a pond, greenery and nature at it's best.  These gardens are adjoining the Paris zoo. There is a fantastic play area for the kids with lots of space , zip line , sand pit, slides and swing set. We had a good picnic and plan to visit again too.",5 years ago,2025-01-24 14:21:46.221125,5.0,pragya pant,106,https://www.google.com/maps/contrib/105985921747305319326/reviews?hl=en
ChdDSUhNMG9nS0VJQ0FnSUN1LWNxNG9RRRAB,"Bois de Vincennes park was located directly across the street from my favorite hotel I stay in while in Paris (MOTEL ONE) and is quite large and NON TOURISTY! Incredible views everywhere and there is a BUDDHIST TEMPLE and zoo in the park along with waterways to do some boating.It is certainly a great place to spend an afternoon! I visit this park everytime I'm in Paris....highly recommended. Kirk Regalia Lauderdale by the Sea,  Florida U.S.A.",2 years ago,2025-01-24 14:21:46.222126,5.0,Kirk Regalia,72,https://www.google.com/maps/contrib/106495589772153677523/reviews?hl=en
ChZDSUhNMG9nS0VJQ0FnSUMyMDhTd1BREAE,"A big, beautiful and amazing park, suitable for families to picnic, for child and the best for sport and running. There is an outstanding lake inside with docks, geese and swans.",2 years ago,2025-01-24 14:21:46.223125,5.0,Pooyan Parnian,108,https://www.google.com/maps/contrib/115081276880670994125/reviews?hl=en
ChdDSUhNMG9nS0VJQ0FnSUNnMXVHdW9nRRAB,"Weather you're walking, boating, camping or just feeding the birds and ducks around the park, for me is one of the best parks in Paris!",6 years ago,2025-01-24 14:21:46.223125,5.0,JAI ROSE,64,https://www.google.com/maps/contrib/110344055255721660824/reviews?hl=en
ChdDSUhNMG9nS0VJQ0FnSURDenFHTmpnRRAB,"Best park ever eastside Paris! Zoo, lake, trail running, hill, wooden boat, birds.... Have a break come and relax here",4 years ago,2025-01-24 14:21:46.224124,5.0,Jacques Try,31,https://www.google.com/maps/contrib/107187919861208917431/reviews?hl=en
