id_review,caption,relative_date,retrieval_date,rating,username,n_review_user,n_photo_user,url_user
ChZDSUhNMG9nS0VJQ0FnSUNyNlppY05REAE,Beautiful and serene church. Not a touristy place so the serenity is kept. We didn’t go during a mass so the place was quiet and so peaceful. The place is also accessible and is very near some tourist places such as the Notre Dame.  No ticket required,5 months ago,2024-12-27 20:11:49.970321,4.0,Arlene Nicdao,44,https://www.google.com/maps/contrib/115716867527058407358/reviews?hl=en-GB
ChZDSUhNMG9nS0VJQ0FnSUNnbk9iOFF3EAE,The church community is wonderful. You can feel their joy for the Lord in the mass. The mission of the church is to bring more prayer to the city there are three prayer services a day. The beautiful music during these services are worth attending. A beautiful welcoming church. If there just to look the art is amazing.,6 years ago,2024-12-27 20:11:49.970321,5.0,Terry Persson,191,https://www.google.com/maps/contrib/116314759164130704183/reviews?hl=en-GB
ChZDSUhNMG9nS0VJQ0FnSUNlay1HTVRREAE,"Great Church to visit, architecture  and art work is excellent. Very helpful lady in the church showing you the colourful reflections on the floor from the stain glassed  windows and their religious interpretation (Thank You again) Always great places to visit for History,  Architecture and Art.",2 years ago,2024-12-27 20:11:49.971321,4.0,Alan Holmes,257,https://www.google.com/maps/contrib/111846642945939525602/reviews?hl=en-GB
ChdDSUhNMG9nS0VJQ0FnSUM5MUxYSzd3RRAB,"A very interesting combination of Baroque style (the facade) and the Gothic styles (the interior and the altar apse). It was restored in the last years. It is an amazing well preserved church. Madame de Maintenon's first husband, the French poet and humanist, the crippled Scaron, had the honor of being buried here. He was a regular of the Marais Salon. The stain glasses, the statues, the Gothic vaults, evrything is nice Definitely worth a visit. Don't miss this marvel of Gothic architecture!",3 months ago,2024-12-27 20:11:49.971321,5.0,Ramona Rorvik (Art-Tour),142,https://www.google.com/maps/contrib/102334480885492840566/reviews?hl=en-GB
ChZDSUhNMG9nS0VJQ0FnSUNRZ2M3b1lnEAE,if you are religious...if you are catholic..i highly recommend this beautiful monastic Catholic church.... really beatifull....gragorian chant...traditional mass... silence prayers...woow...amazing experience....,5 years ago,2024-12-27 20:11:49.971321,5.0,Karikalan Emmanuel,109,https://www.google.com/maps/contrib/107854295302595101113/reviews?hl=en-GB
ChdDSUhNMG9nS0VJQ0FnSUMwMTdicDh3RRAB,While strolling along the River Seine and decided to walk further into the Marais district and came upon Place Saint-Gervais just east of Hotel de Ville which I just walked past.. this church as I just read was built 1494 and 1657.. there is stained glass from the 16th century... I sat for some time just moving my vision from one special sculpture to the ceilings and then back to the stained glass..,5 years ago,2024-12-27 20:11:49.971321,5.0,Michael Moriarity,608,https://www.google.com/maps/contrib/103627068312063255859/reviews?hl=en-GB
ChZDSUhNMG9nS0VJQ0FnSUQzNnFUQUxBEAE,Lovely church and quiet,a month ago,2024-12-27 20:11:49.972322,5.0,Salanieta Laqai,78,https://www.google.com/maps/contrib/113927643317137899374/reviews?hl=en-GB
ChZDSUhNMG9nS0VJQ0FnSUNZMHRMaVhBEAE,"Nice quiet place in the heart of a loud, busy city. Even if you’re not praying, it’s nice to sit inside and enjoy the silence. In the afternoon, the sun really lights up the gorgeous windows.",5 years ago,2024-12-27 20:11:49.973322,5.0,Bernard Burch,38,https://www.google.com/maps/contrib/104592233745125323947/reviews?hl=en-GB
ChdDSUhNMG9nS0VJQ0FnSUNjbWVqTWdBRRAB,Yet another example of impressive architecture and artwork all in the same. Such a peaceful and inviting place for prayer.,4 years ago,2024-12-27 20:11:49.973322,5.0,The Simple Travels,418,https://www.google.com/maps/contrib/102946059501539280073/reviews?hl=en
ChdDSUhNMG9nS0VJQ0FnSUNHajZHTzB3RRAB,"I truly love and appreciate looking at all the churches in France. So much beauty in all the stained glass windows, wood work, paintings and sculptures. So much history! I highly recommend stop by and admire this beauty!🙌 #Paris …",2 years ago,2024-12-27 20:11:49.973322,5.0,Alma Gonzalez,165,https://www.google.com/maps/contrib/108113214010773743958/reviews?hl=en
ChZDSUhNMG9nS0VJQ0FnSUNWNV91X1hREAE,"I found this church by chance while wandering around Paris. One of the things I liked most about the churches of Paris is the stained glass windows, painted in an attractive way.  Apart from the churches that tourists visit most of the time, the Gothic-style church of Saint-Gervais-Saint-Brôté is worth a visit as it is located near the town hall.  Construction of the church began in 1494, and it took about 150 years to build.",a year ago,2024-12-27 20:11:49.974322,5.0,Mohammad Ayoub,230,https://www.google.com/maps/contrib/102613109672441235778/reviews?hl=en
ChZDSUhNMG9nS0VJQ0FnSUQzOE96cEhnEAE,Beautiful and uniquely decorated church,a month ago,2024-12-27 20:11:49.974322,5.0,Olivier Languepin,34,https://www.google.com/maps/contrib/104200070486520551148/reviews?hl=en
ChdDSUhNMG9nS0VJQ0FnSURPNWNPMTJnRRAB,Always spiritual place love it,2 years ago,2024-12-27 20:11:49.974322,5.0,DJ Bob06,99,https://www.google.com/maps/contrib/104277656272809151254/reviews?hl=en
ChZDSUhNMG9nS0VJQ0FnSUNMMmRHWVF3EAE,"Nice looking church, worth the visit.",6 months ago,2024-12-27 20:11:49.974322,5.0,JMEK,12,https://www.google.com/maps/contrib/117453545720387847409/reviews?hl=en
ChdDSUhNMG9nS0VJQ0FnSUNnM3VTZ2d3RRAB,"On a long walk though the area, we approached the church from the back and realized it was one we had never before visited. We entered and spotted a handful of sisters in their grey and white habits as well as a number of worshippers on their knees with their foreheads to the stone floor, praying. As we walked quietly through the church, we realized the sisters and several monks were preparing for a service. We sat at the back of the church as the dozen or so members of the orders began singing. It was hard to believe that the music was not recorded, but that they were singing a capella. Although not religious, we were entranced by the 20 minutes or so of the service that we watch.",8 years ago,2024-12-27 20:11:49.975322,5.0,Yi Jian,226,https://www.google.com/maps/contrib/107720693328277357629/reviews?hl=en
ChZDSUhNMG9nS0VJQ0FnSURocDdXeWV3EAE,"Huge church, under renovation, but still very impressive. The question is: who would sit through a mass with no back support?",a year ago,2024-12-27 20:11:49.975322,3.0,Michael Thompson,252,https://www.google.com/maps/contrib/115479440532507657297/reviews?hl=en
ChdDSUhNMG9nS0VJQ0FnSURqOXFUdnVnRRAB,"Beautiful church, very quiet and peaceful.",7 months ago,2024-12-27 20:11:49.975322,5.0,Elena O'Donnell,25,https://www.google.com/maps/contrib/113056522965521985379/reviews?hl=en
ChZDSUhNMG9nS0VJQ0FnSURZalAtV2J3EAE,"I was lucky to have gone before there was any construction on it, I had to chance to see this amazing piece of work. I didn't go in, but the view it more than enough to enjoy. It is extremely crowded in the area as well",5 years ago,2024-12-27 20:11:49.975322,5.0,Paul Truelove,6,https://www.google.com/maps/contrib/103972249551286513394/reviews?hl=en
ChdDSUhNMG9nS0VJQ0FnSURNM2F1V193RRAB,There were a homeless man who insistently asked for money and followed all over the church,4 years ago,2024-12-27 20:11:54.130924,3.0,Veronika Liberova,65,https://www.google.com/maps/contrib/101977497744214306298/reviews?hl=en
ChZDSUhNMG9nS0VJQ0FnSURBeE5lLU9nEAE,"From a musical point of view, this church is a must-see (and must HEAR), because the pipe organ is the very instrument upon which members of the famous Couperin family of composers played from 1600 until the 1820s. The vast majority of the stops, and their associated pipework, are original from the 17th and 18th century, with only four using new pipework from the modern era.  Because of restorations which, necessarily, took place after the time of the Couperins, the instrument is not exactly the same as it was in the Baroque era: but the sounds you will hear when the instrument are played are highly authentic. This will give performers and listeners a good insight into the performance practice necessary to play Couperin, and other French Early music, in authentic style.  The staff in this church were friendly on the occasion of my recent visit.",8 years ago,2024-12-27 20:11:54.131924,4.0,John Warburton,457,https://www.google.com/maps/contrib/106144388905866253482/reviews?hl=en
ChdDSUhNMG9nS0VJQ0FnSUM0cHVEcG5nRRAB,"The church of Saint-Gervais is impressive. Is one of the last churches of Paris where you can see a nuns comunity. Is important to see their gothich arches. I usually enter for the façade and go out with the small door of the absis, using it like a corridor. See my videos on YouTube to discover more aboit Paris: Art is life - Gerard Vidal",5 years ago,2024-12-27 20:11:54.131924,5.0,Gerard Vidal,35,https://www.google.com/maps/contrib/112504097793141735827/reviews?hl=en
ChdDSUhNMG9nS0VJQ0FnSUNha3FyVnZRRRAB,Very nice church apart from the beautifull interior it is ideal to have a quite moment in the busy city and have a moment of prayer.,3 years ago,2024-12-27 20:11:54.131924,5.0,Jan Dinneweth,492,https://www.google.com/maps/contrib/114201848736373836835/reviews?hl=en
ChdDSUhNMG9nS0VJQ0FnSURHbTd1VjNRRRAB,"A very charming church, very beautiful, I recommend visiting it and enjoying the colors and lights , and The paintings are so beautiful",3 years ago,2024-12-27 20:11:54.131924,5.0,maan Obed,311,https://www.google.com/maps/contrib/117211754624701104987/reviews?hl=en
ChZDSUhNMG9nS0VJQ0FnSUNZemZpN05BEAE,3 months in Paris. Regular visitor to this beautiful church. Quite contemplating spiritual.,5 years ago,2024-12-27 20:11:54.132924,5.0,Ruth Nesbit,6,https://www.google.com/maps/contrib/103696555543676489646/reviews?hl=en
ChZDSUhNMG9nS0VJQ0FnSURnN091WGJREAE,"An exceptional ancient temple filled with history, peace and a look that brings you back in time 500 years.",7 years ago,2024-12-27 20:11:54.132924,5.0,Sebastian Di Mateo,756,https://www.google.com/maps/contrib/116684094276519796138/reviews?hl=en
ChdDSUhNMG9nS0VJQ0FnSURJanREVzh3RRAB,Super cool inside ! I'm not religious but had a good time there !,5 years ago,2024-12-27 20:11:54.132924,5.0,Frederico Quintão,319,https://www.google.com/maps/contrib/106346103000894582144/reviews?hl=en
ChZDSUhNMG9nS0VJQ0FnSURZdF9lVVh3EAE,A GREAT place to visit: some pieces of art are really one of a kind,5 years ago,2024-12-27 20:11:54.133925,4.0,Jeff H,569,https://www.google.com/maps/contrib/117699564573858478597/reviews?hl=en
ChZDSUhNMG9nS0VJQ0FnSUNSa1pmc1JBEAE,wonderful church that is home to the Communauté Jerusalem,a year ago,2024-12-27 20:11:54.133925,5.0,Matt Senger,62,https://www.google.com/maps/contrib/108997896624198874316/reviews?hl=en
ChZDSUhNMG9nS0VJQ0FnSUNBa3FMOFRBEAE,Beautiful service. The sisters sang the whole mass a capella like angels.,8 years ago,2024-12-27 20:11:58.278284,5.0,Seana McGee,0,https://www.google.com/maps/contrib/107180591787642167185/reviews?hl=en
ChdDSUhNMG9nS0VJQ0FnSURZOUszbThRRRAB,A holy and welcoming place. Very peaceful!,5 years ago,2024-12-27 20:11:58.278284,5.0,Janet Bex,0,https://www.google.com/maps/contrib/108226577924375760836/reviews?hl=en
ChdDSUhNMG9nS0VJQ0FnSUQyNXEzZm9RRRAB,Linda,2 years ago,2024-12-27 20:11:58.278284,5.0,Mary Padilla,824,https://www.google.com/maps/contrib/115776376896353975197/reviews?hl=en
ChdDSUhNMG9nS0VJQ0FnSUNhNkp6eF9RRRAB,Free to visit. A stunning cathedral,3 years ago,2024-12-27 20:11:58.278284,5.0,Ann V,70,https://www.google.com/maps/contrib/117032390472391323044/reviews?hl=en
ChZDSUhNMG9nS0VJQ0FnSURHak11dEFnEAE,"Nice church, a fast visit.",3 years ago,2024-12-27 20:11:58.279285,4.0,jaqsbcn,"1,012",https://www.google.com/maps/contrib/108887492167641192465/reviews?hl=en
ChZDSUhNMG9nS0VJQ0FnSURrMEpuU2NBEAE,"In disrepair, surrounding by construction. Whatever it's past glory, nothing remains.",5 years ago,2024-12-27 20:11:58.279285,1.0,Shane Clifton,39,https://www.google.com/maps/contrib/107154088211527859300/reviews?hl=en
ChZDSUhNMG9nS0VJQ0FnSUQ2MGNmZlh3EAE,Well light at night that shows a nice facade,3 years ago,2024-12-27 20:11:58.279285,4.0,ahmedabbas25,320,https://www.google.com/maps/contrib/112291913267848067287/reviews?hl=en
ChdDSUhNMG9nS0VJQ0FnSUQwalB2N25RRRAB,It's a very special church,5 years ago,2024-12-27 20:11:58.279285,5.0,Milagros Jimenez,10,https://www.google.com/maps/contrib/118414506100311043649/reviews?hl=en
ChZDSUhNMG9nS0VJQ0FnSURhbk43blpBEAE,Incredible!,3 years ago,2024-12-27 20:11:58.279285,5.0,joseph euler,50,https://www.google.com/maps/contrib/101403839014232489421/reviews?hl=en
ChZDSUhNMG9nS0VJQ0FnSUR5MWVxUk53EAE,Beautiful church.,3 years ago,2024-12-27 20:11:58.280285,5.0,Sérgio Gonçalves,635,https://www.google.com/maps/contrib/106789731291449375789/reviews?hl=en
