id_review,caption,relative_date,retrieval_date,rating,username,n_review_user,n_photo_user,url_user
ChZDSUhNMG9nS0VJQ0FnSUNOM3JiemNBEAE,"Regularly offers temporary exhibitions (free), for dates find out on their site.",a month ago,2025-03-15 22:05:36.996308,4.0,Thierry Girard,989,https://www.google.com/maps/contrib/100981567033985110977/reviews?hl=en-US
ChdDSUhNMG9nS0VJQ0FnSUQ2M2NXdGhRRRAB,"A place certainly a little outdated but in an exceptional setting which allows you to come and see small temporary exhibitions, often free  The facade of the building is very beautiful  Presence of toilets in the building with free access  I recommend going there quickly",3 years ago,2025-03-15 22:05:36.997308,4.0,B2n,603,https://www.google.com/maps/contrib/109909738321282924114/reviews?hl=en-US
ChdDSUhNMG9nS0VJQ0FnSUNfLXVYLXFRRRAB,"Great setting, but new website has become almost impossible to use. And above all, obviously, no more telephone switchboards exist and systematically refer to the Web...",2 months ago,2025-03-15 22:05:36.998408,1.0,Martin Ange Manouvrier,0,https://www.google.com/maps/contrib/114178469072325329138/reviews?hl=en-US
ChZDSUhNMG9nS0VJQ0FnSUN2Nk5pWENBEAE,"Defense Historical Service. I confirm, you just need to change the order of the words. The reception was so deplorable that it was historic. In their defenses, they do not understand the concept of service.",3 months ago,2025-03-15 22:05:36.998425,1.0,Julien Cuny,10,https://www.google.com/maps/contrib/106106923652717268075/reviews?hl=en-US
ChdDSUhNMG9nS0VJQ0FnSUR2d3BqNDJBRRAB,"I spoke with three people, and all three gave me conflicting information. In the end, the archivist was unaccommodating and extremely haughty.",2 months ago,2025-03-15 22:05:36.999426,1.0,Mars Project,0,https://www.google.com/maps/contrib/103997940486414867301/reviews?hl=en-US
ChdDSUhNMG9nS0VJQ0FnSUNuLVlqZHBBRRAB,"Thank you to those who have the heavy task of preserving and therefore bringing to life with such care the memory of our heroes. The great human quality of the collaborators of the historical Defense service that I was able to meet today in the Louis Bravo to you, shadow resistance fighters.",5 months ago,2025-03-15 22:05:37.000426,5.0,B. C.,63,https://www.google.com/maps/contrib/112326111243871676766/reviews?hl=en-US
ChZDSUhNMG9nS0VJQ0FnSUROazVlM1NnEAE,"Your site, which was so functional a few years ago, has become a gas factory! I'm still looking for the maquis directory in GR 19P, which previously took me a few seconds! And that's all I'm talking about...",a year ago,2025-03-15 22:05:37.000426,1.0,Nicole Menetrier,0,https://www.google.com/maps/contrib/113268290430415202649/reviews?hl=en-US
ChdDSUhNMG9nS0VJQ0FnSUNqX3FfVmhBRRAB,"Good morning I tried without success to search for the file of one of my ancestors, an officer under the empire. It is impossible for me to find the archive number and no one to answer the phone and no email address...It's a bit lamentable! M Chaze",10 months ago,2025-03-15 22:05:37.001426,1.0,sci39ruedebrest,0,https://www.google.com/maps/contrib/105888381162765910634/reviews?hl=en-US
ChdDSUhNMG9nS0VJQ0FnSUQ4MC03d3h3RRAB,"An essential archive for working on the military history of France. The procedure for making an appointment is simple; Online inventories are accessible and allow you to prepare your work sessions. The welcome on site is pleasant. The reading room is large, pleasant and well lit. As for the staff, they are welcoming, competent and helpful.",4 years ago,2025-03-15 22:05:37.001426,5.0,Olivier Joseph,171,https://www.google.com/maps/contrib/111840261496685320885/reviews?hl=en
ChdDSUhNMG9nS0VJQ0FnSUNidXVfWHJ3RRAB,Trying to contact a manager of this shd service or my loved one who works there and left a little while ago. We manage to get no one.,7 months ago,2025-03-15 22:05:37.002425,1.0,Aurelie Froger,28,https://www.google.com/maps/contrib/103748929629019461976/reviews?hl=en
ChZDSUhNMG9nS0VJQ0FnSUNDeTVhWWZnEAE,"always so complicated to get a date, you have to arm yourself with monstrous patience to get access to the boxes. At this rate the request for ratings has time to enter the national archives before we can go on site",4 years ago,2025-03-15 22:05:37.002425,1.0,Leo f,0,https://www.google.com/maps/contrib/108977748505595731322/reviews?hl=en
ChZDSUhNMG9nS0VJQ0FnSURBOU51NUV3EAE,Very warm welcome. Total availability of competent and smiling staff (for a Saturday morning ;)). And an impeccable reading room for research work.,7 years ago,2025-03-15 22:05:37.003426,4.0,hasni jeridi,16,https://www.google.com/maps/contrib/113767480906257504846/reviews?hl=en
ChZDSUhNMG9nS0VJQ0FnSUNJOWYyLWNnEAE,"Faced with recurring problems concerning access to documents, the following steps should be taken: Referral to the Commission for Access to Administrative Documents for requests for access to public documents (theoretically freely communicable)... Then, despite the positive opinion of the Commission for Access to Administrative Documents, a new refusal leading to a contentious appeal to the Paris Administrative Court. The established procedure is simple: Request - Refusal = Cada followed by an Opinion (if favorable) new request - Refusal = Administrative Tribunal as part of a procedure in excess of power. Furthermore, for current malfunctions, a report to the Inspector General of the Armed Forces and the Controller General of the Armed Forces must be made. Elsewhere, an alert via the reporting platform of the Court of Auditors",2 years ago,2025-03-15 22:05:37.004426,1.0,Gael gael35,0,https://www.google.com/maps/contrib/115176599362970289963/reviews?hl=en
ChZDSUhNMG9nS0VJQ0FnSUNvM3VfREN3EAE,"Place steeped in history, interesting for carrying out research. A little lost at first, especially on how to consult the boxes.",6 years ago,2025-03-15 22:05:37.004426,4.0,Théophile Lephay,46,https://www.google.com/maps/contrib/106734679980934123893/reviews?hl=en
ChZDSUhNMG9nS0VJQ0FnSUQ2azRhYWRREAE,Exhibition on 100 years of the Mobile Gendarmerie which closes on a Saturday afternoon at 3 p.m.!!! The SHD always equal to itself!!!,3 years ago,2025-03-15 22:05:37.005426,1.0,Gérard Manvussa,0,https://www.google.com/maps/contrib/116267495317176641516/reviews?hl=en
ChZDSUhNMG9nS0VJQ0FnSUMxbElUaGVREAE,Always a pleasure to meet the team again. Thank you!,a year ago,2025-03-15 22:05:37.005426,5.0,Class Fab,10,https://www.google.com/maps/contrib/102512666887995243103/reviews?hl=en
ChZDSUhNMG9nS0VJQ0FnSUNSLThqVVZBEAE,Unable to connect to the site to reserve the documents!!!!!,a year ago,2025-03-15 22:05:37.006427,2.0,Anne Mariotti,0,https://www.google.com/maps/contrib/113653669832854760566/reviews?hl=en
ChdDSUhNMG9nS0VJQ0FnSURRM2IzX2tnRRAB,Efficient service; you just need to follow the -very clear- procedures indicated on the SHD website,7 years ago,2025-03-15 22:05:37.006427,5.0,Bernard ZELLER,0,https://www.google.com/maps/contrib/108927872774301068420/reviews?hl=en
ChdDSUhNMG9nS0VJQ0FnSUNCNXJXdnF3RRAB,Very competent team at the service of the public. Magnificent buildings!,2 years ago,2025-03-15 22:05:41.155479,5.0,Jessica Mallard,0,https://www.google.com/maps/contrib/111525327788306492187/reviews?hl=en
ChdDSUhNMG9nS0VJQ0FnSUQtdjlLU2xRRRAB,"Top, superb places between the 17th century pavilions and the Middle Ages dungeon.",2 years ago,2025-03-15 22:05:41.155838,4.0,Sylvain Gaïo,524,https://www.google.com/maps/contrib/116022990781692601028/reviews?hl=en
ChZDSUhNMG9nS0VJQ0FnSUN4dzkzTkJBEAE,A wealth of information for history and genealogy enthusiasts and professionals,a year ago,2025-03-15 22:05:41.156852,5.0,"Pascal LIEGEOIS (Chok, Calum, Chok66)",48,https://www.google.com/maps/contrib/102325034777630341783/reviews?hl=en
ChZDSUhNMG9nS0VJQ0FnSURVeTVIaFFnEAE,Exhibition of the day,5 years ago,2025-03-15 22:05:41.156852,3.0,jc jc,377,https://www.google.com/maps/contrib/105243499832744772118/reviews?hl=en
ChZDSUhNMG9nS0VJQ0FnSURTa3RlckhBEAE,File well received and well loaded. Thank you very much,4 years ago,2025-03-15 22:05:41.157850,5.0,Master Chief,0,https://www.google.com/maps/contrib/117090198571223862511/reviews?hl=en
ChZDSUhNMG9nS0VJQ0FnSUQ4OWE3LUFREAE,Impressive and full of history(s),4 years ago,2025-03-15 22:05:41.157850,4.0,Jean-Charles Fischer,113,https://www.google.com/maps/contrib/112492071691271225075/reviews?hl=en
ChZDSUhNMG9nS0VJQ0FnSUNvcFpuekNREAE,Perfectly correct and efficient welcome,6 years ago,2025-03-15 22:05:41.158850,5.0,Gilles ARNAL,0,https://www.google.com/maps/contrib/109657522851932251888/reviews?hl=en
ChZDSUhNMG9nS0VJQ0FnSURldl9hN0JBEAE,beautiful place,2 years ago,2025-03-15 22:05:41.158850,5.0,Mohamed Faisal Mukhtar,94,https://www.google.com/maps/contrib/113507548680065301313/reviews?hl=en
ChZDSUhNMG9nS0VJQ0FnSURNeXJxQURREAE,The reception and accessibility of sources.,5 years ago,2025-03-15 22:05:41.159850,5.0,Naïm Halidi,1,https://www.google.com/maps/contrib/109795117389318468108/reviews?hl=en
ChZDSUhNMG9nS0VJQ0FnSUNzOXJ2NENBEAE,This is my workplace,5 years ago,2025-03-15 22:05:41.159850,4.0,keumar Mouty,15,https://www.google.com/maps/contrib/108235595521203415986/reviews?hl=en
ChZDSUhNMG9nS0VJQ0FnSUNDbDdpeEN3EAE,A place full of history,4 years ago,2025-03-15 22:05:45.303880,5.0,Thomas Gabin,27,https://www.google.com/maps/contrib/107721405508636414847/reviews?hl=en
ChdDSUhNMG9nS0VJQ0FnSUNnaHFDZW5nRRAB,staff at the top.,6 years ago,2025-03-15 22:05:45.303880,5.0,bruno perrot,1,https://www.google.com/maps/contrib/109786829760171786714/reviews?hl=en
ChZDSUhNMG9nS0VJQ0FnSURENXN6bkh3EAE,,11 months ago,2025-03-15 22:05:45.304881,5.0,Va voir ailleurs Si j'y suis,161,https://www.google.com/maps/contrib/100985489480605033653/reviews?hl=en
ChZDSUhNMG9nS0VJQ0FnSUMxLWNhREN3EAE,,a year ago,2025-03-15 22:05:45.305879,5.0,Matthieu Scheidbach,68,https://www.google.com/maps/contrib/112893135055672343360/reviews?hl=en
ChZDSUhNMG9nS0VJQ0FnSURKMWJPZEhnEAE,,a year ago,2025-03-15 22:05:45.305879,5.0,Francisco Sócrates Quintanar García,46,https://www.google.com/maps/contrib/100678311855878918039/reviews?hl=en
ChZDSUhNMG9nS0VJQ0FnSUQtdmE2MVdnEAE,,2 years ago,2025-03-15 22:05:45.306880,2.0,Killer Soft,2,https://www.google.com/maps/contrib/118216816625205685499/reviews?hl=en
ChZDSUhNMG9nS0VJQ0FnSUMtelA3bFJREAE,,2 years ago,2025-03-15 22:05:45.306880,5.0,Myriam M,2,https://www.google.com/maps/contrib/112770119297861853249/reviews?hl=en
ChZDSUhNMG9nS0VJQ0FnSUR1bnJMQk53EAE,,2 years ago,2025-03-15 22:05:45.307880,5.0,thelordash11,52,https://www.google.com/maps/contrib/115195592697620773839/reviews?hl=en
ChZDSUhNMG9nS0VJQ0FnSUNPNG9MbGNBEAE,,2 years ago,2025-03-15 22:05:45.307880,5.0,Antoine Egret,47,https://www.google.com/maps/contrib/106975402338541506800/reviews?hl=en
ChdDSUhNMG9nS0VJQ0FnSURHLU12SzZRRRAB,,3 years ago,2025-03-15 22:05:45.308967,5.0,Irene Maria Szarf,4,https://www.google.com/maps/contrib/113217895336505905876/reviews?hl=en
