id_review,caption,relative_date,retrieval_date,rating,username,n_review_user,n_photo_user,url_user
ChdDSUhNMG9nS0VJQ0FnSURELTk3bi1RRRAB,Very nice and interesting cultural site. Sculptures are very different and artists have a lot of different approaches. Free entrance. Nice personnel.,11 months ago,2025-03-15 22:29:29.147518,5.0,Leon Ardo,239,https://www.google.com/maps/contrib/118164683649308428013/reviews?hl=en-US
ChdDSUhNMG9nS0VJQ0FnSURPcU1UeGt3RRAB,"This place a very cool art center! I went there during “Cinétique: La Sculture en Mouvement” exhibition, and it was awesome. Although the exhibition space wasn’t very big, it was worth visiting. Moreover, it was free. The info was only available in French.",2 years ago,2025-03-15 22:29:29.148628,5.0,Rachel M,256,https://www.google.com/maps/contrib/115874459062831922459/reviews?hl=en-US
ChdDSUhNMG9nS0VJQ0FnSURGbXJqTGtRRRAB,Touching the earth exhibition: including works of ceramics. Great.,a year ago,2025-03-15 22:29:29.149649,5.0,Aysis Koshy,20,https://www.google.com/maps/contrib/104956151177396646439/reviews?hl=en-US
ChdDSUhNMG9nS0VJQ0FnSUREXzZTdTVRRRAB,"Really nice, fantastic and full of fantasy and poetry !!",10 months ago,2025-03-15 22:29:29.150751,5.0,Julien TANGUY,150,https://www.google.com/maps/contrib/105589027467580205696/reviews?hl=en-US
ChZDSUhNMG9nS0VJQ0FnSUNKbktLZ09nEAE,Beautiful exhibition space with calming & charming gardens. The exhibition shows are just as amazing and enjoyable. Definitely recommended!,a year ago,2025-03-15 22:29:29.150751,5.0,xingman cheng,0,https://www.google.com/maps/contrib/101642102865038816130/reviews?hl=en-US
ChZDSUhNMG9nS0VJQ0FnSURvcEtEclBBEAE,"Beautiful place, free entrance, interesting artworks",6 years ago,2025-03-15 22:29:29.151434,5.0,Niels Dupic,2,https://www.google.com/maps/contrib/108827690231594760358/reviews?hl=en-US
ChZDSUhNMG9nS0VJQ0FnSURSME8tTEdnEAE,Absolutely magic place 🙌 …,a year ago,2025-03-15 22:29:29.151434,5.0,Oleksandra Fastovets,21,https://www.google.com/maps/contrib/103032516794556298210/reviews?hl=en-US
ChZDSUhNMG9nS0VJQ0FnSUQyNS0yRWNBEAE,little but interesting exposition of art in motion,2 years ago,2025-03-15 22:29:29.152447,5.0,Piero Mazzonzelli,402,https://www.google.com/maps/contrib/108442350118578028745/reviews?hl=en-US
ChdDSUhNMG9nS0VJQ0FnSUM0dWJEZmx3RRAB,Cool hidden spot in rue monte-cristo. Worth a visit!,5 years ago,2025-03-15 22:29:29.152447,5.0,R D,342,https://www.google.com/maps/contrib/100524107614878156859/reviews?hl=en
ChdDSUhNMG9nS0VJQ0FnSUNUazlUS3RnRRAB,Short but awesome,9 months ago,2025-03-15 22:29:29.153445,5.0,Hossam El Morabity,0,https://www.google.com/maps/contrib/115474764293656643879/reviews?hl=en
ChZDSUhNMG9nS0VJQ0FnSUMzd19fQlJREAE,Super expo,4 months ago,2025-03-15 22:29:29.154445,5.0,Asya,23,https://www.google.com/maps/contrib/109645967516849713800/reviews?hl=en
ChdDSUhNMG9nS0VJQ0FnSUNQc1lPc3BRRRAB,"Very beautiful exhibition space. The staff is very friendly, and there are lockers to store your belongings. The free exhibition was superb!",3 months ago,2025-03-15 22:29:29.154445,5.0,Nina Bourgeois,43,https://www.google.com/maps/contrib/106342346866118683180/reviews?hl=en
ChZDSUhNMG9nS0VJQ0FnSURYMnUybEhREAE,"700 m from the Alexandre Dumas metro station (L2), this superb space dedicated to the promotion of contemporary sculpture is to be discovered: a free place and open to all. Until 15.12.2024, the exhibition ""Imaginary worlds"" is being held there (strange animals, forest, palm beach, etc. await you). An incredible and astonishing visit guaranteed!",4 months ago,2025-03-15 22:29:29.155449,5.0,Claude C.,138,https://www.google.com/maps/contrib/113056476438676300089/reviews?hl=en
ChZDSUhNMG9nS0VJQ0FnSUNIMjlPYkR3EAE,"Second time going there, and still just as interesting. The works on display are truly out of another world. The places are perfectly arranged. The free nature of this foundation is pleasant. Please note there is no elevator but a small staircase with a ramp that is still accessible",6 months ago,2025-03-15 22:29:29.155449,5.0,Mélody Mennini,5,https://www.google.com/maps/contrib/100162028488910023857/reviews?hl=en
ChZDSUhNMG9nS0VJQ0FnSUNINzc3MlhBEAE,"This exhibition space is just great. It's free. The staff are lovely. There is even a quiz available for younger children. The quality of the exhibition during our visit was impeccable, it was very interesting.",6 months ago,2025-03-15 22:29:29.156579,5.0,Our little family,106,https://www.google.com/maps/contrib/106507209626317427502/reviews?hl=en
ChZDSUhNMG9nS0VJQ0FnSUMzaXBEemNREAE,"A very nice place where you will spend some time. The staff is welcoming and attentive, the current exhibition is enriching and the place is very cozy!! You can leave your belongings at the entrance in lockers secured by a code and all you have to do is enjoy the works of art.",4 months ago,2025-03-15 22:29:29.156579,5.0,Lou-Anne Stephan,9,https://www.google.com/maps/contrib/114195715877448602176/reviews?hl=en
ChZDSUhNMG9nS0VJQ0FnSURibFlyRGJREAE,"As I left another place today I wanted to visit but on the door it said closed until August 20 😔 Thank you for your response, I came back and was able to see the exhibition. The welcome is warm and the exhibition is original and poetic.",2 weeks ago,2025-03-15 22:29:29.157580,4.0,Asma Référente,143,https://www.google.com/maps/contrib/107421343510055087156/reviews?hl=en
ChZDSUhNMG9nS0VJQ0FnSURQeUxldU5BEAE,Superb exhibition! The staff is great and ready to explain the works to us.  it was very interesting I recommend!,3 months ago,2025-03-15 22:29:29.157580,5.0,Wassim Zeggane,200,https://www.google.com/maps/contrib/114581959473748451327/reviews?hl=en
ChdDSUhNMG9nS0VJQ0FnSUMzenRQZ3J3RRAB,"A great exhibition venue, the Montecristo space offers exhibitions that are always free and for all ages. Really very easy to access, I recommend",4 months ago,2025-03-15 22:29:33.487800,5.0,Matteo cervera,620,https://www.google.com/maps/contrib/111040164879954682710/reviews?hl=en
ChdDSUhNMG9nS0VJQ0FnSUNId09qd293RRAB,"Always a smiling welcome, the current exhibition is truly full of poetry. People are available to tell the story of the work and the artist. A real pleasure to stroll through the spaces. Free entry",6 months ago,2025-03-15 22:29:33.488600,5.0,Sandrine Van De Velde,202,https://www.google.com/maps/contrib/110229081537762498288/reviews?hl=en
ChZDSUhNMG9nS0VJQ0FnSURYbVlib1ZBEAE,"Superb exhibition, with a warm welcome, lockers to store your belongings and people to tell and explain the works. Perfect for adults and children alike.",4 months ago,2025-03-15 22:29:33.488600,5.0,Emma Jacquin,16,https://www.google.com/maps/contrib/114024920490995089678/reviews?hl=en
ChZDSUhNMG9nS0VJQ0FnSURYNk8yWlRnEAE,Exhibition full of surprise and impressive. The Imaginary Worlds surprised us and we will definitely come back next year for a new exhibition.,4 months ago,2025-03-15 22:29:33.489678,5.0,Tram Anh Nguyen,75,https://www.google.com/maps/contrib/108907927213232509354/reviews?hl=en
ChdDSUhNMG9nS0VJQ0FnSUQ3N2FyZThnRRAB,"Very nice visit last weekend to the Imaginary Worlds exhibition! The Monte Cristo space is large, very well maintained, the works presented are diverse and what's more, the exhibition is free, what more could you ask for?",6 months ago,2025-03-15 22:29:33.490680,5.0,A S,49,https://www.google.com/maps/contrib/108328476745321366050/reviews?hl=en
ChZDSUhNMG9nS0VJQ0FnSUQzeE1fUlZBEAE,"Magnificent place. The exhibition on Imaginary Worlds is poetic, joyful, curious and a must-see. Big crush on La Mare aux Fées by Laurent Debraux.",4 months ago,2025-03-15 22:29:33.490680,5.0,Sandra,16,https://www.google.com/maps/contrib/102657285645910651850/reviews?hl=en
ChZDSUhNMG9nS0VJQ0FnSURYeU1MVVRnEAE,"Very nice experience because a very warm welcome and with a smile… The place is really very nice Imaginary worlds exhibition, really great Don't hesitate",4 months ago,2025-03-15 22:29:33.491680,5.0,Claudia Zanzi,65,https://www.google.com/maps/contrib/102419276106612466621/reviews?hl=en
ChZDSUhNMG9nS0VJQ0FnSUNYbmRPSFdnEAE,Exhibition in an imaginary world.. The place itself is very nice.. Free exhibition which is worth a look,4 months ago,2025-03-15 22:29:33.491680,4.0,Nadège Chnt,10,https://www.google.com/maps/contrib/103917093312839902749/reviews?hl=en
ChdDSUhNMG9nS0VJQ0FnSUN2cV9mVXN3RRAB,Exhibitions of contemporary sculptures. Always a beautiful scenography. Quite a few OpArt works in the foundation's collection. A place that democratizes art and free exhibitions. What can I say other than a big thank you?,3 months ago,2025-03-15 22:29:33.492679,5.0,Bertrand Robion,134,https://www.google.com/maps/contrib/117191427942835533826/reviews?hl=en
ChdDSUhNMG9nS0VJQ0FnSUMtN3Zlbml3RRAB,"Exhibition on kinetics! Visit on 2 levels, Very interesting with the work of different artists! I came back to visit the exhibition on Imaginary Worlds, I discovered some beautiful works..",4 months ago,2025-03-15 22:29:33.492679,5.0,flo sav,453,https://www.google.com/maps/contrib/104186867984924686153/reviews?hl=en
ChdDSUhNMG9nS0VJQ0FnSUQzaGFhZXBnRRAB,"Very nice cultural place, lots of works with artisanal qualities.",3 months ago,2025-03-15 22:29:37.823061,5.0,apo,16,https://www.google.com/maps/contrib/106374015935575194010/reviews?hl=en
ChZDSUhNMG9nS0VJQ0FnSURqeC1iVUZBEAE,"The Monte Cristo space is a pleasant exhibition space to visit, carte blanche is always fantastic. I like to go back regularly. Entrance is free.",10 months ago,2025-03-15 22:29:37.824062,5.0,Prisca juste,15,https://www.google.com/maps/contrib/110838234067157768390/reviews?hl=en
ChZDSUhNMG9nS0VJQ0FnSURIalpXbWFnEAE,Nice space with free exhibitions. Very friendly welcome and interesting exhibition,5 months ago,2025-03-15 22:29:37.824062,5.0,Chiara Biscaro,345,https://www.google.com/maps/contrib/107086618939051106410/reviews?hl=en
ChZDSUhNMG9nS0VJQ0FnSUQ1MXFYY1hREAE,Magnificent cultural space! Totally free! With speaker for adults and suitable for children!  Incredible current exhibition and the highlight of the show: the moss people and the sleeping idol directed by K.Simonsson pottery discovery workshop for children too contact them you will have information or on the site,a year ago,2025-03-15 22:29:37.825061,5.0,Collin-Rault Ortega,82,https://www.google.com/maps/contrib/107586505279276853857/reviews?hl=en
ChdDSUhNMG9nS0VJQ0FnSURuN2FXOS13RRAB,"A beautiful place, super polite people. With a magnificent exhibition. Super ☺️",5 months ago,2025-03-15 22:29:37.826061,5.0,Antônio Marcos Dos Santos Se,39,https://www.google.com/maps/contrib/117696391452036456711/reviews?hl=en
ChdDSUhNMG9nS0VJQ0FnSUNUOHQya2pBRRAB,"Superb space which invites you to discover contemporary artists.  Very warm welcome, pleasant and available staff.  We had a great time. We will come back 😊 …",10 months ago,2025-03-15 22:29:37.826061,5.0,Jo B,24,https://www.google.com/maps/contrib/112612886325828522128/reviews?hl=en
ChdDSUhNMG9nS0VJQ0FnSURYazRUcXhBRRAB,"Superb exhibition space, FREE for all!  @lvs.kid",4 months ago,2025-03-15 22:29:37.827158,5.0,LVS,595,https://www.google.com/maps/contrib/109713605886154117998/reviews?hl=en
ChdDSUhNMG9nS0VJQ0FnSUMtd1ppUDhRRRAB,Very beautiful exhibitions! It's nice.  The staff is top notch too! Updated: I returned this year (2023) to the “Touch Earth” exhibition. Still so pleasantly surprised and impressed. It’s a free and particularly interesting exhibition!,a year ago,2025-03-15 22:29:37.827158,5.0,Eline,9,https://www.google.com/maps/contrib/105362534245774142993/reviews?hl=en
ChdDSUhNMG9nS0VJQ0FnSURUc09hc3NBRRAB,A very pleasant place and bigger than expected. Very well received. Visited on the occasion of Museum Night 2025.,9 months ago,2025-03-15 22:29:37.828061,5.0,Jerome Robin,159,https://www.google.com/maps/contrib/116091740516161130388/reviews?hl=en
ChdDSUhNMG9nS0VJQ0FnSUNYOVlQVm9nRRAB,Very nice exhibition. A must do,4 months ago,2025-03-15 22:29:37.828061,4.0,Jean Jacques Montaru,120,https://www.google.com/maps/contrib/109285209334267894017/reviews?hl=en
