id_review,caption,relative_date,retrieval_date,rating,username,n_review_user,n_photo_user,url_user
ChdDSUhNMG9nS0VJQ0FnSURiOU9xTDRRRRAB,"indeed a very lovely square, but i couldn’t find any drinking water fountain as descripted",5 months ago,2025-01-24 11:24:28.673093,4.0,Vanh _Phạm,2,https://www.google.com/maps/contrib/107413931050456640723/reviews?hl=en
ChdDSUhNMG9nS0VJQ0FnSUNKMTdYcjFBRRAB,It's a pretty little park with two fountains and it's pretty. The surroundings are pretty too.,a year ago,2025-01-24 11:24:28.673093,5.0,jg gong,124,https://www.google.com/maps/contrib/116236379898546160103/reviews?hl=en
ChdDSUhNMG9nS0VJQ0FnSURQNXRQRzlBRRAB,Beautiful fountain in a quiet park.,a month ago,2025-01-24 11:24:28.673093,5.0,Herman Van den Bergen,906,https://www.google.com/maps/contrib/114008363835701865378/reviews?hl=en
ChdDSUhNMG9nS0VJQ0FnSUNaeGRhOXB3RRAB,Great beautiful fountain. There is also ping pong (or table tennis) nearby For two dribbles between friends...,a year ago,2025-01-24 11:24:28.673093,5.0,Leonardo Serena,302,https://www.google.com/maps/contrib/114383912814719998911/reviews?hl=en
ChdDSUhNMG9nS0VJQ0FnSUQ1Z09xZDRBRRAB,"Autumnal atmosphere, very beautiful square.",a year ago,2025-01-24 11:24:28.673093,5.0,Andy Capée,17,https://www.google.com/maps/contrib/109000830971514416900/reviews?hl=en
ChZDSUhNMG9nS0VJQ0FnSURIcnByNEdBEAE,,4 months ago,2025-01-24 11:24:28.673093,4.0,Cyril Garnier,84,https://www.google.com/maps/contrib/101377321544942560605/reviews?hl=en
ChdDSUhNMG9nS0VJQ0FnSURaNHRxbHdBRRAB,,a year ago,2025-01-24 11:24:28.673093,5.0,P. A.,14,https://www.google.com/maps/contrib/104749709767293215380/reviews?hl=en
 after party in Paris,a year ago,2025-01-24 11:24:00.247860,5.0,Thomas G,0,https://www.google.com/maps/contrib/101170096495827818031/reviews?hl=en
