id_review,caption,relative_date,retrieval_date,rating,username,n_review_user,n_photo_user,url_user
ChZDSUhNMG9nS0VJQ0FnSUQzOU1xLURnEAE,"Here today visiting for the Chantal Ackerman Exhibition, which was excellent. Interesting to see the films reworked in a different way. Fascinating to also see the texts, documents & early shorts.",4 months ago,2025-03-15 22:45:28.977966,5.0,Peter Bromley,386,https://www.google.com/maps/contrib/110021899846808177236/reviews?hl=en-US
ChZDSUhNMG9nS0VJQ0FnTUNRaHR1cktnEAE,Their exhibitions show top-notch photo and moving image art.,a week ago,2025-03-15 22:45:28.978967,5.0,Shana Garr,12,https://www.google.com/maps/contrib/100987355842601748776/reviews?hl=en-US
ChdDSUhNMG9nS0VJQ0FnSUN4OU9YLTVnRRAB,"The first time I came here, I went to see a movie in the basement and was surprised why there was a museum here that I didn't know so I went back again.  This time I came for the Thomas Demand exhibition.  You can buy tickets inside the museum (buy directly with the staff or buy on the machine).  You can also make an appointment in advance.  I see this as more of a gallery than a museum, also not too crowded so it is very quiet.",a year ago,2025-03-15 22:45:28.979969,4.0,Rachel Ngn,266,https://www.google.com/maps/contrib/105015594814354595492/reviews?hl=en-US
ChdDSUhNMG9nS0VJQ0FnTURBazVQbTJnRRAB,Beautiful photo exhibit !,a month ago,2025-03-15 22:45:28.979969,5.0,Anna Elisabeth,26,https://www.google.com/maps/contrib/114195301936698463531/reviews?hl=en-US
ChdDSUhNMG9nS0VJQ0FnSUNHLVA2SThRRRAB,Nice sized arts centre (I did not take photos of the actual exhibition). It’s two floors and well conceived. The area around is very nice to walk around and enjoy a view of the Eiffel Tower and other Parisian attractions.,3 years ago,2025-03-15 22:45:28.981036,5.0,R,104,https://www.google.com/maps/contrib/101635430509071052118/reviews?hl=en-US
ChZDSUhNMG9nS0VJQ0FnSURVLXJQZkpREAE,"The space itself isn't that extraordinary to look at from the outside but read up on the fascinating history. I visited the Sally Mann show which was wonderful. The galleries are a bit compact so try and go early or late to avoid the crowds. Nice bookstore too and when the weather is good, the cafe outside is nice.",5 years ago,2025-03-15 22:45:28.981036,5.0,Mohamed Somji,112,https://www.google.com/maps/contrib/111165244813476332076/reviews?hl=en-US
ChZDSUhNMG9nS0VJQ0FnSURweVAyWUFREAE,Amazing photography gallery. It’s open ‘til 9pm on a Tuesday. Which leaves you enough time to watch the sunset over Place de Concord in the summer ☀️🌇,a year ago,2025-03-15 22:45:28.982039,5.0,Helen Stergios,54,https://www.google.com/maps/contrib/111482064417627773245/reviews?hl=en-US
ChdDSUhNMG9nS0VJQ0FnSUNmcHN5eHhBRRAB,"One of my favorite little museums in Paris, especially if you like photography. Exhibits aren’t always photography but often enough.",2 months ago,2025-03-15 22:45:28.983038,5.0,Philippa Pham Hughes,598,https://www.google.com/maps/contrib/116167761350844690214/reviews?hl=en-US
ChZDSUhNMG9nS0VJQ0FnSUNabV96SFZ3EAE,"It is a magnificent building. During my stay in Paris, there was a photography exhibition by Frank Horvat. He was a photographer who lived and worked in France. He is best known for his fashion photography. Horvat's oeuvre includes a very wide range of photographs.",a year ago,2025-03-15 22:45:28.983038,5.0,Bogdan Marcelan,941,https://www.google.com/maps/contrib/100552965636459416082/reviews?hl=en
ChZDSUhNMG9nS0VJQ0FnSUNVaDUtOUVREAE,"I'm afraid I done much like the style of monochrome photography now featured in the exhibits. However, it is a great venue and others may like the darkish themes. The cafe is well-done Japanese... strangely appropriate.",5 years ago,2025-03-15 22:45:28.984038,3.0,Lee Shipley,971,https://www.google.com/maps/contrib/107907103156404754313/reviews?hl=en
ChdDSUhNMG9nS0VJQ0FnSUQwaWRXbzN3RRAB,"Consistantly amazing shows, especially well curated exhibitions beautifully showcased around the time of Paris Photo. I have yet to see a less than impactful, unique, beautifully executed exhibition there in all these years.",5 years ago,2025-03-15 22:45:28.984038,5.0,Kerimcan Guleryuz,81,https://www.google.com/maps/contrib/102186712101250439150/reviews?hl=en
ChdDSUhNMG9nS0VJQ0FnSUNfaS12T2hRRRAB,"I was visiting for a Chantal Akerman exhibition which was curated pretty nicely, I really enjoyed it, good work",a month ago,2025-03-15 22:45:28.985038,5.0,Mage Craft,4,https://www.google.com/maps/contrib/113651458849543022426/reviews?hl=en
ChdDSUhNMG9nS0VJQ0FnSURoX0xQTGdBRRAB,Wonderfully designed interior to a classic building. The exhibition on Demand (the photographer not the verb) was fascinating.,2 years ago,2025-03-15 22:45:28.985038,5.0,tylaar haran,105,https://www.google.com/maps/contrib/115645238385819742394/reviews?hl=en
ChdDSUhNMG9nS0VJQ0FnSURYcUxENHZ3RRAB,My favourite art gallery because it always promotes female photographers. Don’t go if you don’t like art or females.,4 months ago,2025-03-15 22:45:28.986159,5.0,Lynden Campbell,30,https://www.google.com/maps/contrib/113177816176075021666/reviews?hl=en
ChZDSUhNMG9nS0VJQ0FnSURobkk3WlpREAE,"Amazing view to the tower, easy to access, no line and beautiful lights during the day!",2 years ago,2025-03-15 22:45:28.986159,5.0,Kseniia Striuk,88,https://www.google.com/maps/contrib/109634193475911866006/reviews?hl=en
ChZDSUhNMG9nS0VJQ0FnSUQzemVTU0d3EAE,They denied me entry because the lady refused to look at my ticket. They accused me of buying a ticket for the previous day even though it clearly said for THAT DAY!,3 months ago,2025-03-15 22:45:28.987160,1.0,Sketch Book,0,https://www.google.com/maps/contrib/105575576369728390386/reviews?hl=en
ChZDSUhNMG9nS0VJQ0FnSURKNl9QdVF3EAE,Paris - An interesting gallery. Went to see the Howat Exhibition. Contemporary art book shop. Worth a visit check on line for current exhibitions.,a year ago,2025-03-15 22:45:28.988160,5.0,Christina Baxter,92,https://www.google.com/maps/contrib/114901463200039781180/reviews?hl=en
ChZDSUhNMG9nS0VJQ0FnSUNzcF95UmVREAE,Great location in the heart of Jardin des Tuileries to see new picture exhibitions,5 years ago,2025-03-15 22:45:28.988160,4.0,Cédric (KDRIC),"1,728",https://www.google.com/maps/contrib/115466470045389771674/reviews?hl=en
ChdDSUhNMG9nS0VJQ0FnSUNYaGNUZnZBRRAB,"A place to be to explore photography. Again, a great experience. Cant wait to visit again",4 months ago,2025-03-15 22:45:33.280495,5.0,K&M K&M,32,https://www.google.com/maps/contrib/114208583429913494361/reviews?hl=en
ChZDSUhNMG9nS0VJQ0FnSURRMW9TWVZBEAE,"Great museum, great terrasse spot in the sun with fantastic Japanese food",6 years ago,2025-03-15 22:45:33.281499,5.0,J B,413,https://www.google.com/maps/contrib/111913130569845115141/reviews?hl=en
ChZDSUhNMG9nS0VJQ0FnSURVNnJ2MmN3EAE,"EXPO SALLY MANN +++ THE PAINS OF THE SOUTH ++ EMMETT FLOATING ++ COLLODIUM ++ GO AND SEE ++ AN ANGEL FOR SALLY MANN  Certainly, Jeu de Paume is one of the finest places in Europe to see expositions of photograph artists. So, Josef Sudek, or André Kertesz some time ago. The current Expo of Sally Mann is - convincingly - of very radical nature. Starting with the early pictures of her three children , amounting today to a kind of miracle, Sally Mann took always a lot of ""insight"" on her. The expo is cut in five ""subject-parts"", and one of the most fascinating are the so called ""Black Water"" pictures,  really ""tirages"" in the old French style. Or, other subject (matter), the battlefields of the South, rough, but wonderful. And then the Little Videos, shown at the expo, Sally Mann with grey hair (she is born in 1951). Collodium Floating on glass plates. This is not an ""easy go"", but 90 minutes at the expo will comfort you a lot. It took me six hours (each time) by train to come and to go, but is was quite a unique occasion (as Josef Sudek earlier). And Sally Mann, also, is a very interesting example that there is a withhold against the simply ""loudspeaking world"". Subtle Pictures of the South ! Congratulation ! After the visit, I was talking to a lot of interested People, in photography. How to sustain ""pain"" is one of the most fundamental subjects you can Encounter, and Sally Mann did very well, also at Jeu de Paume ! Go and see the ""Black Water"" Pictures, and the Battlefields. What an achievement, very honest, South !",5 years ago,2025-03-15 22:45:33.281499,5.0,stefan speyer,"1,822",https://www.google.com/maps/contrib/115692985658975399089/reviews?hl=en
ChdDSUhNMG9nS0VJQ0FnSURSaUwza25BRRAB,"Only went in because I'd time to kill before meeting family but it was excellent. Main exhibition space is wonderful, the Stutter of History exhibition is so good. Staff throughout are friendly and helpful, cafe is good, and there's a well-stocked bookshop. Recommended",a year ago,2025-03-15 22:45:33.285593,5.0,KEN MCKINLAY,191,https://www.google.com/maps/contrib/110713110163153952556/reviews?hl=en
ChdDSUhNMG9nS0VJQ0FnSUNadHJiaHd3RRAB,Extremely well-organized temporary exhibitions on 2 floors. I visited several museums around this time in Paris and I must say the air-conditioning was the best here - not an unimportant value in 35°C. Staff is very kind too.,a year ago,2025-03-15 22:45:33.286588,5.0,Peti,233,https://www.google.com/maps/contrib/113649142818923489162/reviews?hl=en
ChZDSUhNMG9nS0VJQ0FnSUNEeGVmcEtREAE,"Nice museum, not too crowded even on the weekends. I visit regularly and never had to book tickets.",11 months ago,2025-03-15 22:45:33.287588,5.0,Marina Antonova,21,https://www.google.com/maps/contrib/111488403987174791933/reviews?hl=en
ChdDSUhNMG9nS0VJQ0FnSUNKeV9YUHBBRRAB,"Jeu de Paume is a museum located in the Tuileries Garden in Paris, France. The museum is dedicated to photography and contemporary art, with a focus on showcasing experimental and innovative works.  Originally built as a tennis court in the 17th century, the building was later converted into an exhibition space in the 20th century. Today, it serves as a platform for contemporary artists to display their works, particularly in the medium of photography.  The Jeu de Paume museum hosts temporary exhibitions that explore various themes and artistic practices. It features a diverse range of photography, video art, and other forms of contemporary visual arts. The museum often collaborates with international artists and curators, making it a dynamic and engaging cultural institution.  In addition to exhibitions, Jeu de Paume offers educational programs, workshops, and lectures to promote a deeper understanding and appreciation of contemporary art. It also maintains an extensive library and archive, providing resources for researchers, scholars, and art enthusiasts.  Jeu de Paume is a unique and vibrant museum that contributes to the rich cultural landscape of Paris. Its location in the Tuileries Garden makes it easily accessible and offers visitors the opportunity to combine their visit with a leisurely stroll through the beautiful garden.  If you have an interest in contemporary art, photography, or experimental visual arts, a visit to Jeu de Paume is highly recommended. It provides a platform for emerging and established artists to showcase their works and offers a thought-provoking and immersive experience for visitors.",a year ago,2025-03-15 22:45:33.287588,5.0,ChefLaurent DE,625,https://www.google.com/maps/contrib/108476250316059010534/reviews?hl=en
ChZDSUhNMG9nS0VJQ0FnSUNRcU1Ld1lnEAE,"Fantastic photography museum. Exhibitions are always interesting and the program mixes big names in the field & young masters on the rise. The building is very nice, keeping a human-scale size that makes it nice to me. And the library is full of great books...",10 years ago,2025-03-15 22:45:33.288588,5.0,Robin Devillers,46,https://www.google.com/maps/contrib/105820961900337078654/reviews?hl=en
ChdDSUhNMG9nS0VJQ0FnSURteXBhNDh3RRAB,Their expositions are so beautifully curated also it's such a perfect spot in Jardin Tuileries while on your walk in the gardens you could simply stop by the musée for some lovely expos!,3 years ago,2025-03-15 22:45:33.289588,5.0,ishita mishra,241,https://www.google.com/maps/contrib/113342832121520989506/reviews?hl=en
ChdDSUhNMG9nS0VJQ0FnSURVby1MS3hRRRAB,"Very beautiful place and great exhibitions, friendly staff",5 years ago,2025-03-15 22:45:33.289588,5.0,Aya Tarek,27,https://www.google.com/maps/contrib/105296362839578330365/reviews?hl=en
ChZDSUhNMG9nS0VJQ0FnSUNReE5LWldBEAE,"Small. But extremely interesting. Not crowded. Very contemporary and relevant to today's life. Opposite of the Louvre - quite tiny, but you will not see this content in art history books, or anywhere else!",7 years ago,2025-03-15 22:45:37.498818,5.0,Paul Shorey,22,https://www.google.com/maps/contrib/110800572571655772101/reviews?hl=en
ChZDSUhNMG9nS0VJQ0FnSUMyeVp1R1RnEAE,I had a great time being enthralled with art. I've also been very inspired,2 years ago,2025-03-15 22:45:37.499824,5.0,Cammie x,55,https://www.google.com/maps/contrib/103432561402871587440/reviews?hl=en
ChdDSUhNMG9nS0VJQ0FnSUNaNzRLaXpnRRAB,"Ideally located at the Concorde Tuileries garden entrance, a nice cultural pit stop for exhibitions and savory lunch or coffee break at Rose Bakery within the premises.",a year ago,2025-03-15 22:45:37.499824,5.0,Caroline Thomas,15,https://www.google.com/maps/contrib/105463403760668909489/reviews?hl=en
ChdDSUhNMG9nS0VJQ0FnSUN3aFBxQjJ3RRAB,"Yesterday me and my friend tried to go into the museum, he had his travel backpack with him as he was leaving Paris that evening. As we entered the building, the girl at the entrance was already very grumpy. She didn't speak a word in English although my friend told her that he doesn't understand a word in French. Then she told us to put his backpack in one of the safes, which obviously were way to small. So when we bought our tickets we asked if we could take the bag inside, the man already said yes, but then this girl from the entrance came running up to us, and told us, again in a very unfriendly way that it was not possible to take it inside.  Today I visited the museum. I am a big fan of photography, but for the price the collection is very poor. And really not that spectacular. The short films in the top floor are nice, but again really not worth the price.  Fun fact: In the area with the computers are two big safes for baggage that you can lock, and my friend's bag would've definitely fit in there.  Imma just say: where there's a will, there's a way.",7 years ago,2025-03-15 22:45:37.500820,1.0,Sarah Konig,30,https://www.google.com/maps/contrib/106703324590920190975/reviews?hl=en
ChZDSUhNMG9nS0VJQ0FnSUQ1cXRpbUZREAE,"A superb gallery showing modern art, in this case the photography of Julia Margaret Cameron from the 1860s.",a year ago,2025-03-15 22:45:37.501889,4.0,Laurence Target,0,https://www.google.com/maps/contrib/101002171809359042611/reviews?hl=en
ChdDSUhNMG9nS0VJQ0FnSUNBdmViT3d3RRAB,"It is a very good gallery. On the first floor you can find a really cool book shop with photo albums from different collections. I also like the cafe, there you can find some very nice japonese food and deserts, which I really liked.  I highly reccommend this place.)",6 years ago,2025-03-15 22:45:37.501889,5.0,Светлана Гришагина,25,https://www.google.com/maps/contrib/110693273893901564215/reviews?hl=en
ChdDSUhNMG9nS0VJQ0FnSUNBOGJlS2hRRRAB,"While it's an obvious place to go (in every guide book), take care to note what specifically is on display there. I went without noticing the exhibits' details and didn't particularly care for them. Nothing bad about them, but also no standing collection to fall back upon.",6 years ago,2025-03-15 22:45:37.502891,4.0,DH,68,https://www.google.com/maps/contrib/100990017914878160483/reviews?hl=en
ChZDSUhNMG9nS0VJQ0FnSUNvdnJ2eGFREAE,"Outstanding gallery space and consistently good curation of exhibits. The size of the galleries makes for a nicely paced visit. There is a Japanese cafe on-site, which was good for a snack.",6 years ago,2025-03-15 22:45:37.503890,5.0,Patrick Larvie,502,https://www.google.com/maps/contrib/110127577617637949650/reviews?hl=en
ChdDSUhNMG9nS0VJQ0FnSUNZb0o2X3JnRRAB,One of my favourite museums in Paris. There is usually a really well curated photography exhibition and sometimes also video... the location is super nice too.,5 years ago,2025-03-15 22:45:37.503890,5.0,Payal K,162,https://www.google.com/maps/contrib/111274046100981896990/reviews?hl=en
ChdDSUhNMG9nS0VJQ0FnSUNRazVtdV9RRRAB,"The interior is bright. Two large rooms on two floors. Toilets are clean, you can even drop its stuffs in traps code. Provision of informational screens with headphones. Very nice place",10 years ago,2025-03-15 22:45:37.504890,4.0,Nen Nufer,133,https://www.google.com/maps/contrib/111346087677871542027/reviews?hl=en
