id_review,caption,relative_date,retrieval_date,rating,username,n_review_user,n_photo_user,url_user
ChdDSUhNMG9nS0VJQ0FnSURfeXJ6X3VRRRAB,"Not the most popular museum in France (let alone in Paris), but a visit is highly recommended for those who loved history, anthropology, evolution and most of all- the best view on the famous Eiffel Tower! The design of the museum is unique and suitable for kids and families.  We spent about 2 hours in the museum and we recommended at least that for a good experience, if you are short on time, skip some of the regular collection and go to the temporary exposition instead. Those are changing frequently and can be better sometimes. We visited during the exposition on immigration and it was absolutely incredible and eye opening.",a month ago,2025-03-15 22:09:11.466513,4.0,Maayan Dahan,93,https://www.google.com/maps/contrib/101798047121038166428/reviews?hl=en-US
ChZDSUhNMG9nS0VJQ0FnSURYM3JPbGJ3EAE,It's a nice museum next to Trocadéro. It tells about the history of men and where we are heading. Also one of the best places to view the Eiffel tower. You can visit this museum for free if you have the CAF or for a reduced fee if you're a student. You can also see some great preserved animals in there which will definitely amaze you. It's just next to the Eiffel Tower and also it has Welcome written in over 100 languages. The museum also shows a few cultures and fossils of humans from the pre historic era. It also shows the Neanderthal skulls if you're into history of humans and evolution 🧬,4 months ago,2025-03-15 22:09:11.467513,4.0,Rahul Agarwal,254,https://www.google.com/maps/contrib/118183620553811056026/reviews?hl=en-US
ChZDSUhNMG9nS0VJQ0FnSUR2ay1HOFJREAE,"It is a nice museum; however, i would recommend going there if you have kids. It's a fun interactive museum for kids to learn about evolution and the history of humanity but as a grown person it was not extremely interesting for me albeit it was a great experience nonetheless.",2 months ago,2025-03-15 22:09:11.469147,4.0,Rumeysa Durmaz,73,https://www.google.com/maps/contrib/103091349152957180904/reviews?hl=en-US
ChZDSUhNMG9nS0VJQ0FnTURRa0w3bFpBEAE,"Interesting museum, especially for people who like anthropology!",6 days ago,2025-03-15 22:09:11.469147,4.0,Gloria García,31,https://www.google.com/maps/contrib/108048974573435832935/reviews?hl=en-US
ChZDSUhNMG9nS0VJQ0FnSUNQeWZDYWJREAE,The Musée de la Marine is definitly worth a visit. The current exposition on the Vendée Globe a must see,3 months ago,2025-03-15 22:09:11.470145,5.0,Christophe Schaber,41,https://www.google.com/maps/contrib/114801528299347682093/reviews?hl=en-US
ChdDSUhNMG9nS0VJQ0FnSUMzMnZYTWhnRRAB,"My kids’ favourite museum in Paris. Very interesting display of human anatomy, different homo species, brains of various animals, and some fun interactive exhibits of human language. Beautiful view of Eiffel Tower too. Only complaint was that the cafe was very slow, only one girl there to heat up pizza, take orders, and clean the tables. Queued for a good twenty minutes during lunch time on a busy weekend.",4 months ago,2025-03-15 22:09:11.470145,5.0,Yuan Zhao,32,https://www.google.com/maps/contrib/110314639689856596170/reviews?hl=en-US
ChZDSUhNMG9nS0VJQ0FnSUN4eHI3Z2V3EAE,"I enjoyed the temporary exhibition about Lespugue (though thought there could have been more women artists). There were some interesting articles in the permanent exhibition but I personally didn’t love the layout, it felt all chucked in to a big space. There is a great view of the Eiffel Tower from the cafe. I was there on nuit des musées and there was a dance performance where all the (white) dancers were painted black and this made me very uncomfortable (would be a 3 star if not for this).",a year ago,2025-03-15 22:09:11.471145,2.0,Amelia Dellamuro,113,https://www.google.com/maps/contrib/114177431462636356390/reviews?hl=en-US
ChZDSUhNMG9nS0VJQ0FnSUN2b1l2UkVREAE,I visited the Migration exhibition. It was nicely organised place.,3 months ago,2025-03-15 22:09:11.471145,4.0,Loli Sanam,54,https://www.google.com/maps/contrib/105229206758861862821/reviews?hl=en-US
ChZDSUhNMG9nS0VJQ0FnSUQ3MTVEV1ZnEAE,Barely anything was in English and it costs 15 euros. This museum is about “Man” which you probably have the same information as the museum of science back in the states and that’s normally free.,6 months ago,2025-03-15 22:09:15.711660,2.0,Yen B,629,https://www.google.com/maps/contrib/110559252900709017871/reviews?hl=en
ChdDSUhNMG9nS0VJQ0FnSUNYeTgtVTVBRRAB,"The entry fee is 15€ however the museum is very small and there's barely anything to see. The museum claims to have one of the largest collections of prehistoric fossils but there are only very few, completely unidentifiable and very small bone fragments. Basically none of the explanatory texts were translated into English and the museum staff does not care that kids are literally screaming and running around the museum, which given the acoustics, can be heard on all 2 levels of the museum. If you are an adult who's interested in prehistory, this ""museum"" must be averted at all costs. If you're a parent looking for a place to let your kid run free, this is the place for you to come.",4 months ago,2025-03-15 22:09:15.712661,2.0,Jxyz Bxt,27,https://www.google.com/maps/contrib/106726044672824730857/reviews?hl=en
ChZDSUhNMG9nS0VJQ0FnSUR1ek9lN0tREAE,"As far as I know, it was closed for 6 years for renovation works, with President François Hollande reopening it in 2015. I am therefore glad that I had the chance to visit it after the new adaptations.  It is a permanent exhibition, therefore those who plan to visit it either this year or in 5 years, will not miss anything.  The exhibition follows three parts, based on three essential questions: 'Who are we?', 'Where do we come from?'  and 'Where are we heading?'.  I liked the intention of the general scientific commissioner of the Gallery of Man — to create a path, a history, for the visitor to travel.  And that's really what happens: from the human body it makes a leap to a few million years before our era.  And the road ends with a car from the 60s from Dakar, recovered from Senegal.  The one you will probably find animated on the entrance ticket, if they don't change this appearance in the meantime. From the point of view of the historian, the ethnography and anthropology museum and library is supported by the state. The entrance is free for students and pupils, while for adults the ticket price starts from 5€.",2 years ago,2025-03-15 22:09:15.713733,5.0,Arina Bădărău,51,https://www.google.com/maps/contrib/111447697124089562347/reviews?hl=en
ChdDSUhNMG9nS0VJQ0FnSURHcF9ITGtBRRAB,What a lovely museum and surprise to delight the eyes and encourage your curiosity about our origins! We came inside to get out out of the freezing wet cold and this exhibit did not disappoint and we were all very pleasantly surprised! We also had a lovely view of the Eiffel Tower and a great photo opportunity.  There was even a temporary exhibit which included highlights on HipHop Culture (called Sneakers) ... you know this Brooklyn girl was loving that!!,3 years ago,2025-03-15 22:09:15.713733,5.0,Aida,90,https://www.google.com/maps/contrib/110601049752635053556/reviews?hl=en
ChZDSUhNMG9nS0VJQ0FnSURSNnZmTEpnEAE,"Following an enchanting tour of the Eiffel Tower, a visit to the Musée de l'Homme (Museum of Man) seemed like an ideal way to continue exploring the rich cultural landscape of Paris. While the museum offers a fascinating insight into human history and anthropology, certain aspects made the experience slightly less enjoyable.  The museum's exhibits are undeniably intriguing, showcasing various aspects of human evolution, culture, and society. However, one challenge that detracted from the overall experience was the limited availability of English translations for the displays. In contrast to other museums in Paris, which generally provide content in both French and English, the Musée de l'Homme seemed to cater primarily to French-speaking visitors.  This language barrier made it difficult to fully appreciate the depth and significance of the exhibits, leaving non-French speaking guests feeling somewhat excluded from the learning experience. While the visual elements of the displays were still engaging, the lack of accessible information prevented a deeper understanding of the subject matter.  In conclusion, the Musée de l'Homme offers a captivating glimpse into human history and culture, making it a worthwhile stop on a Parisian itinerary. However, the limited availability of English translations may pose a challenge for some visitors. Despite this drawback, the museum still provides an interesting and educational experience for those who are able to navigate the language barrier.",a year ago,2025-03-15 22:09:15.714736,3.0,John L,173,https://www.google.com/maps/contrib/101011381237240173036/reviews?hl=en
ChdDSUhNMG9nS0VJQ0FnSUN0MlBYWjVnRRAB,"An amazing place that shows different aspects of human civilization from our languages, the food, views of death, the rise of urbanization, etc. Highly recommend coming if you find yourself in Paris.  Entrance is also free for students which is amazing.",a year ago,2025-03-15 22:09:15.715735,5.0,Cesar Fabro,11,https://www.google.com/maps/contrib/115308525950742076585/reviews?hl=en
ChdDSUhNMG9nS0VJQ0FnSURSMy16dTh3RRAB,A very nice museum that was renewed and enlarged between 2005 and 2015. It displays in addition to its permanent exposition several temporary ones each year. The one that I visited today was as shown in my pictures: Picasso and the prehistory that is dedicated to the effects of the prehistoric discoveries on Picasso works.,a year ago,2025-03-15 22:09:15.716736,5.0,Bourgeons Taha,724,https://www.google.com/maps/contrib/108561252893137761569/reviews?hl=en
ChZDSUhNMG9nS0VJQ0FnSURYNmFmakp3EAE,Currently an exhibition dedicated to spitting at the world! I recommend it,4 months ago,2025-03-15 22:09:15.717735,5.0,Jacek Trzcinski,152,https://www.google.com/maps/contrib/111687925283830379170/reviews?hl=en
ChZDSUhNMG9nS0VJQ0FnSURYN09pQmN3EAE,Interesting to visit to know more about humanbeing and humanity evolution Has great view on Eiffel tour,4 months ago,2025-03-15 22:09:15.717735,4.0,ih ab,4,https://www.google.com/maps/contrib/108481468576157653807/reviews?hl=en
ChdDSUhNMG9nS0VJQ0FnSUNrallpNjZRRRAB,What an exciting place. First it has a stunningly view on the gardens and the Eiffel Tower. Including from the cafeteria. Then very thought-provoking collections in airy spaces with very confortable sofas if you decide you need a rest. Very recommended.,5 years ago,2025-03-15 22:09:15.718737,5.0,Jean-Paul Audouy,237,https://www.google.com/maps/contrib/110573320363996413935/reviews?hl=en
ChdDSUhNMG9nS0VJQ0FnSUNlbGFPYTZ3RRAB,"Want to experience a unique view of the tour Eiffel? get yourself a ticket to the Galerie de l'Homme. You can learn a lot about quite a few different cultures from around the world in this ethnographic museum, it is interactive and definitely worth visit. Do not miss the part dedicated to languages on the verge of extinction: do not be squeamish, pull the tongues that stick out of the wall and listen to languages and only a handful of people know. At the time of my visit was also present a stunning photographic exhibition by Lekha Singh ""Women Carry the World""  Oh about the tower, go on the 2nd floor, grab one of the sandwiches to the museum cafe (one of the cheapest in Paris, yet delicious!) sit down and enjoy the view.",2 years ago,2025-03-15 22:09:20.010832,4.0,Elisa Amaroli,55,https://www.google.com/maps/contrib/112011327163024669639/reviews?hl=en
ChdDSUhNMG9nS0VJQ0FnSUQ3eExPQWtRRRAB,This was the home base for NBC and the Today Show during the 2024 Summer Olympics in Paris.,6 months ago,2025-03-15 22:09:20.011832,5.0,Cheryl Andrews,21,https://www.google.com/maps/contrib/105861849456889036865/reviews?hl=en
ChZDSUhNMG9nS0VJQ0FnTUNnNmFDSUdnEAE,My 8yr old daughter really enjoyed herself here. We stayed about 2 hours on our way to the Eiffel Tower.,3 weeks ago,2025-03-15 22:09:20.012920,5.0,Tim Purser,15,https://www.google.com/maps/contrib/104663068103689020904/reviews?hl=en
ChZDSUhNMG9nS0VJQ0FnSUQ5X0ltVkZnEAE,"We were pleasantly surprised by this museum, no lines and free admission for under 26 years old, not very busy with tourists but also not all the descriptions were in both French and English.",a year ago,2025-03-15 22:09:20.012920,5.0,Noa Sorbara,26,https://www.google.com/maps/contrib/115864500220700763329/reviews?hl=en
ChdDSUhNMG9nS0VJQ0FnSUQydHJhbmtRRRAB,"Located at the center of Paris, the Home Museum is clean, clear and large space. It's a very good ambiance for the arts expo.",2 years ago,2025-03-15 22:09:20.013921,4.0,Christine GINET,436,https://www.google.com/maps/contrib/114055647648493803955/reviews?hl=en
ChdDSUhNMG9nS0VJQ0FnSUREdjZfcGdnRRAB,Great museum with a cool temporary exhibition on at the moment,10 months ago,2025-03-15 22:09:20.013921,5.0,Fionn Keene O'Connell,250,https://www.google.com/maps/contrib/112671497030617709911/reviews?hl=en
ChZDSUhNMG9nS0VJQ0FnSUQya2E3LUNnEAE,Fascinating anthropology museum. One of my favorite museums in Paris! It also has a good view of the Tour Eiffel.,2 years ago,2025-03-15 22:09:20.014921,5.0,Lance Y,54,https://www.google.com/maps/contrib/102927879287415776612/reviews?hl=en
ChZDSUhNMG9nS0VJQ0FnSURMcXVMZkNnEAE,It's THE view at Eiffel Tower. Better be there at the earliest hours to avoid masses of tourists.,8 months ago,2025-03-15 22:09:20.014921,5.0,mercman,45,https://www.google.com/maps/contrib/115021555280838273004/reviews?hl=en
ChdDSUhNMG9nS0VJQ0FnSUNlbi1ldXpRRRAB,"Smaller than expected, but still very interactive and interesting walk through human civilization's start to how we've evolved and continue evolving. Great for kids and non-French speakers too!",2 years ago,2025-03-15 22:09:20.015921,4.0,Ahmed Murtaza,69,https://www.google.com/maps/contrib/107614781064325427147/reviews?hl=en
ChZDSUhNMG9nS0VJQ0FnSUNod2J5LWZ3EAE,"A bit small compared to other museums but very interesting. Recommended if you don't have much time to visit Paris. *Photo taken from the museum, the view of the Eiffel Tower is beautiful and not many people know about this.",2 years ago,2025-03-15 22:09:20.015921,5.0,Martha Villarreal,15,https://www.google.com/maps/contrib/100304595467914203175/reviews?hl=en
ChdDSUhNMG9nS0VJQ0FnSUQwX0xxTGhnRRAB,"I unfortunately didn't have time wonder around this museum, but I did have a meal on the terrace at restaurant as we had an unusually warm October evening. I can honestly say it was a beautiful evening enhanced by the views of The Eiffel Tower all lit up with lights, the amazing tasting menu, the ambiance and service was very good. I would highly recommend this place to eat.",5 years ago,2025-03-15 22:09:24.305845,5.0,Liza Carr,82,https://www.google.com/maps/contrib/107111955625878688251/reviews?hl=en
ChZDSUhNMG9nS0VJQ0FnTURRNGE2QVpnEAE,Went to see Wax. It did not disappoint.,3 days ago,2025-03-15 22:09:24.306950,5.0,Pamela Maher,33,https://www.google.com/maps/contrib/115626915094851288356/reviews?hl=en
ChdDSUhNMG9nS0VJQ0FnSUNoak4yc3B3RRAB,Lots of information & activities for children to enjoy 🪆🎎🌏Battalion suggestion: improve security system so visitors don’t have to show tickets several times,2 years ago,2025-03-15 22:09:24.307472,4.0,Anne-Jolie,755,https://www.google.com/maps/contrib/104827288249156712763/reviews?hl=en
ChdDSUhNMG9nS0VJQ0FnSUNfdjlELWpRRRAB,I have bowel cancer and a stoma and was rudely refused entry to use a disabled toilet. I had used Google translate to explain.,a month ago,2025-03-15 22:09:24.308461,1.0,Flo Lockhart,0,https://www.google.com/maps/contrib/117214727627898477198/reviews?hl=en
ChdDSUhNMG9nS0VJQ0FnSUNlM0tXXzV3RRAB,Great view and well put together… however hardly any English translations to be seen anywhere. Made for a disappointing experience,2 years ago,2025-03-15 22:09:24.308461,3.0,Vanessa Hebert,105,https://www.google.com/maps/contrib/106333891216160256490/reviews?hl=en
ChdDSUhNMG9nS0VJQ0FnSUNYaFlyNW5BRRAB,Absolutely NOTHING is written in English. Very disappointing. I had to make a complain about it only to find out there was an app that nobody told me about at the beginning,4 months ago,2025-03-15 22:09:24.309462,1.0,Dimitris Diakos Lomnios,47,https://www.google.com/maps/contrib/111511588928779482220/reviews?hl=en
ChZDSUhNMG9nS0VJQ0FnSUNIc2RMbGNnEAE,"Great museum! Very underrated, with good exhibitions about humanity and culture. It's kept in mint condition and the cafeteria has a great view of the Eiffel Tower.",6 months ago,2025-03-15 22:09:24.310462,5.0,Hans,46,https://www.google.com/maps/contrib/118078230121156994364/reviews?hl=en
ChZDSUhNMG9nS0VJQ0FnSUNneTl5aVN3EAE,"Everything and anything you want to know about the human race, it's cultural diversity, it's adaptability, it has everything from crop development to artificial limbs. while we were there they had a special exhibit on the neanderthal. It is a massive place and I don't think you can do it in one day but it's definitely worth the visit.",6 years ago,2025-03-15 22:09:24.310462,5.0,Eliot kamenitz,326,https://www.google.com/maps/contrib/100194085986473438773/reviews?hl=en
ChdDSUhNMG9nS0VJQ0FnSUN4eWRHcHRBRRAB,This is a great museum. There are a lot of interactive features located in the museum. It is nice and clean and the staff is very friendly. The restaurant inside the museum is great as well. Overall it is a fairly priced museum with lots of exhibits.,a year ago,2025-03-15 22:09:24.311462,5.0,Chance Bordine,82,https://www.google.com/maps/contrib/109491135757188998483/reviews?hl=en
ChZDSUhNMG9nS0VJQ0FnSURfdV9xY093EAE,Très gentil One of my fave museum 💖🌠 I like to visite at evening from Ternes,a month ago,2025-03-15 22:09:24.311462,5.0,amour de M,51,https://www.google.com/maps/contrib/114045679335724143408/reviews?hl=en
