id_review,caption,relative_date,retrieval_date,rating,username,n_review_user,n_photo_user,url_user
ChZDSUhNMG9nS0VJQ0FnSUNfN3BxM0RREAE,"I am a Muslim, and we hold great respect for Prophet Jesus and the Blessed Virgin Mary. We accept and revere them deeply. I have visited many churches around the world, but this Holy Mary church is incredibly special and unique. When you focus on it, it feels as though it speaks to you. This statue is truly exceptional, and I highly recommend visiting it with a humble heart. Please like this post so that others may also benefit from experiencing this sacred statue.",a week ago,2025-01-24 13:51:41.538846,5.0,Alireza Karimpour,5,https://www.google.com/maps/contrib/114867853881747230642/reviews?hl=en-GB
ChZDSUhNMG9nS0VJQ0FnSUQ3dE5uZE9nEAE,"Saint-Paul Church in France is a place that I absolutely loved visiting. This historic church, located in the heart of Paris, exudes a timeless and ancient spirit that makes it truly special. The moment I stepped inside, I was captivated by the serene and almost mystical atmosphere. The church's architecture, with its grand arches, detailed carvings, and beautiful stained glass windows, reflects centuries of history and devotion.  What I found most enchanting about Saint-Paul Church is its sense of quiet reverence. Despite being in a bustling city, it feels like a peaceful sanctuary where you can reflect and connect with the past. The aged walls and the soft light filtering through the windows create an ambiance that is both calming and awe-inspiring.  For anyone who appreciates history and architecture, Saint-Paul Church is a hidden gem in Paris. I loved the feeling of stepping back in time and experiencing the deep, ancient soul of this beautiful place.",5 months ago,2025-01-24 13:51:41.539845,5.0,Tammam Hasan,186,https://www.google.com/maps/contrib/104387094933523404650/reviews?hl=en-GB
ChdDSUhNMG9nS0VJQ0FnSUNmMXRtN3JnRRAB,"What do Victor Hugo, Cardinal Richelieu, and Eugène Delacroix have in common? Each has left their mark, in one way or another, on the Paroisse Saint-Paul Saint-Louis—a church that stands as a quiet yet grand testimony to the artistry, history, and faith of Paris. Nestled in the heart of the Marais, this architectural gem whispers stories of revolution, royal patronage, and literary legend. But what makes this church truly remarkable isn’t just its history—it’s the way it seamlessly captures the essence of a changing Paris, both spiritually and artistically.  Constructed between 1627 and 1641 at the behest of Louis XIII, this was the first Parisian church built in the Baroque style, breaking away from the Gothic tradition. Designed by Jesuit architects Étienne Martellange and François Derand, its soaring dome, intricate facade, and monumental proportions were revolutionary for their time. Cardinal Richelieu himself consecrated the church, donating its richly carved wooden doors and celebrating its first mass—a detail that feels appropriately grand for a church of this stature.  Inside, Saint-Paul Saint-Louis dazzles. From its luminous dome to the opulent altar, every inch reflects the Jesuits’ commitment to inspiring awe. Among the treasures hidden within its walls is a painting by Eugène Delacroix, Christ in the Garden of Olives, an evocative masterpiece that adds emotional depth to an already stunning interior. And for literature enthusiasts, this is the very church where Cosette and Marius, from Victor Hugo’s Les Misérables, tied the knot—a fictional wedding, perhaps, but one that adds a touch of romance to its legacy.  The church’s position is also notable. Located on Rue Saint-Antoine, it serves as a spiritual and architectural gateway to the Marais, offering a moment of reflection before plunging into the district’s lively streets, boutiques, and cafes. If you stroll past its stately facade, you may notice its unique clock—a detail that stands out for its understated charm, even if its origins remain shrouded in mystery.  While Saint-Paul Saint-Louis isn’t as internationally renowned as Notre-Dame or Sacré-Cœur, it offers a more intimate experience of Parisian history and devotion. It’s not just a place of worship; it’s a bridge between eras, between art and faith, and between the ordinary and the extraordinary.",3 weeks ago,2025-01-24 13:51:41.540846,4.0,Cláudio Cardona,376,https://www.google.com/maps/contrib/100397911227828972891/reviews?hl=en-GB
ChZDSUhNMG9nS0VJQ0FnSUNQanRxZmNREAE,I visited here recently but I have visited many times over the years as its really lovely and very popular. It's very old but very well kept.,a month ago,2025-01-24 13:51:41.542845,5.0,Brid,441,https://www.google.com/maps/contrib/118364008054074247056/reviews?hl=en-GB
ChdDSUhNMG9nS0VJQ0FnSUNYbjVmNzFnRRAB,"Saint-Paul Saint-Germain is a quaint neighborhood in Paris that beautifully encapsulates the essence of the city’s historic charm. Nestled along the banks of the Seine, this area boasts narrow cobblestone streets lined with art galleries, boutiques, and charming cafes, inviting visitors to explore at a leisurely pace.  One of the highlights of Saint-Paul is the stunning Église Saint-Paul-Saint-Louis, an architectural marvel that showcases intricate Baroque design. The church’s peaceful atmosphere offers a lovely respite from the bustling streets.  The neighborhood is also known for its vibrant food scene, with a variety of restaurants offering everything from classic French cuisine to international dishes. Whether you’re looking for a cozy spot to enjoy a pastry and coffee or a romantic dinner, you’ll find plenty of options to satisfy your cravings.  As you wander through the streets, keep an eye out for the unique shops and hidden courtyards that make this area special. Saint-Paul Saint-Germain is a perfect blend of history, culture, and culinary delights, making it a must-visit destination in Paris.",3 months ago,2025-01-24 13:51:41.543845,5.0,Pamela Baz,101,https://www.google.com/maps/contrib/116284037299896278482/reviews?hl=en-GB
ChZDSUhNMG9nS0VJQ0FnSUNYcU9LbGF3EAE,"This is the church where Cosette and Marius get married, from Victor Hugo's Les Misérables The Saint-Paul Saint-Louis Church Is a really old church that combines French and Italian Baroque architectural styles.",3 months ago,2025-01-24 13:51:41.544847,5.0,Epicurean Explorer,41,https://www.google.com/maps/contrib/107681650897034927559/reviews?hl=en-GB
ChdDSUhNMG9nS0VJQ0FnSUQzNnU3UjhnRRAB,"Nice church, free visiting and as always, amazing architecture.",2 months ago,2025-01-24 13:51:41.544847,4.0,Mike Aoun,"1,023",https://www.google.com/maps/contrib/111919836695870396234/reviews?hl=en-GB
ChZDSUhNMG9nS0VJQ0FnSUNObUlYd01BEAE,Beautiful church. We took the bus which will take you right to the Saint Paul Area. The church closes at 8pm and we arrive at like 7 pm. The patrons or the parishneers were inside mediating and praying. The church has remarkable architecture and arts. We were amazed at her archway and design. You do not have to pay money here except to show respect. We spent about 40 minutes here. I experienced solace while just sitting in this chapel. I loved this place.,a year ago,2025-01-24 13:51:41.545847,5.0,Ravi Lal,572,https://www.google.com/maps/contrib/104111757711220329872/reviews?hl=en-GB
ChZDSUhNMG9nS0VJQ0FnSUQ3d0t2VVFnEAE,"The Parish Church of Saint-Paul of Saint-Louis, known as Paroisse Saint-Paul Saint-Louis, is a significant historical and architectural landmark located in the Le Marais district of Paris. Its construction began in 1627 and was completed in 1641, making it one of the early examples of Baroque architecture in the city.  Originally built as a Jesuit church, it was designed by the architect François Derand. The church showcases an impressive facade with intricate details, including a striking portico supported by columns. Its interior is equally remarkable, featuring a grand nave, beautiful altarpieces, and stunning stained glass windows that depict various biblical scenes.  Throughout its history, the church has played an essential role in the community, serving as a place of worship and a center for religious and cultural activities. It has witnessed significant events in French history, including the French Revolution, during which it was repurposed and later returned to its original function.  In the 19th century, the church underwent extensive renovations and restorations, which enhanced its beauty and preserved its historical significance. Today, the Parish Church of Saint-Paul of Saint-Louis remains an active church and is also a popular destination for tourists and history enthusiasts, admired for its architectural splendor and rich heritage. It stands as a testament to the artistic and spiritual legacy of Paris, reflecting the city's enduring history and culture.",5 months ago,2025-01-24 13:51:41.546845,5.0,King King,256,https://www.google.com/maps/contrib/114313688980766135457/reviews?hl=en
ChdDSUhNMG9nS0VJQ0FnSURqeWJhSjFRRRAB,What a beautiful church of Roman Catholicism builds in 17th century. With eye catching red big door for the entrance and details ornaments in the insides.,8 months ago,2025-01-24 13:51:41.547845,5.0,Putri Dumadi,732,https://www.google.com/maps/contrib/104270468737476868971/reviews?hl=en
ChdDSUhNMG9nS0VJQ0FnSUQyMmJiNDlRRRAB,"A free cathedral to enter, you get a nice example of Baroque architecture in the heart of Paris. The interior is as well designed as the exterior, and shows many classical Baroque features in the architecture and in the art. It’s also never too crowded as it’s one of the minor churches in the city.",2 years ago,2025-01-24 13:51:41.547845,5.0,Irwin Mier,235,https://www.google.com/maps/contrib/108973915719652053415/reviews?hl=en
ChZDSUhNMG9nS0VJQ0FnSUQzNktQTkF3EAE,Built in the 1600s in Baroque fashion. Free admission.,2 months ago,2025-01-24 13:51:41.548845,5.0,ERIC LEE,"1,391",https://www.google.com/maps/contrib/101918989856347363830/reviews?hl=en
ChZDSUhNMG9nS0VJQ0FnSUNCX2RENFNREAE,Catholic Church with amazing architecture. Entry is free here. One of the best place we visit during our visit to Paris.,2 years ago,2025-01-24 13:51:41.548845,5.0,FlightMode,143,https://www.google.com/maps/contrib/112964424304221986322/reviews?hl=en
ChZDSUhNMG9nS0VJQ0FnSUNzeXF6cVd3EAE,"This is one stupendous Church in Paris of stunning Baroque style architecture. The first thing I noticed was the Jesuit façade of the main façade from Rue Saint Antoine and the interior is absolutely breathtaking! I walked here from Gare de l'Est, about fifteen minutes but you can use the Saint Paul Metro line to get here. The single nave is lined with chapels with a very broad transept and a small apse. What's really impressive are the windows that allow natural light to illuminate the interior! Especially the dome above the transept intersection is spectacularly amazing! The organ buffet is a listed national monument and it's spectacular. Absolutely worth visiting this Church and soak in it's history and the unbelievably stupendous interior. Suitable for all ages and backgrounds. Highly recommended.",4 years ago,2025-01-24 13:51:41.549847,5.0,Antoine M,"1,963",https://www.google.com/maps/contrib/113493032279416500253/reviews?hl=en
ChdDSUhNMG9nS0VJQ0FnSUNaMjhuWjJnRRAB,This is very beautiful and magnificent chrch. Sometimes music contents are on. At 7pm they seem to have a misa.,a year ago,2025-01-24 13:51:41.550846,4.0,中尾桶屋,561,https://www.google.com/maps/contrib/116596565912221238027/reviews?hl=en
ChdDSUhNMG9nS0VJQ0FnSUQ1ME5mRHdnRRAB,"We dropped in while touring the neighbour hood, simply to kill time in between activities. And we were awestruck.  I’ve many photos but this was the crux; this is the crux. I stood at its doorway with a settling blanket of serenity, seeing the wisps of smoke swirling in the rays of afternoon sun. The gentle curvatures of the room and the delicate features in the room. It touched me, a non-religious being, in ways that I’ve never imagined.",a year ago,2025-01-24 13:51:41.550846,5.0,yingers11,316,https://www.google.com/maps/contrib/114259562738964506375/reviews?hl=en
ChZDSUhNMG9nS0VJQ0FnSUNvdGV1TUpBEAE,"Église Saint-Paul-Saint-Louis is a nice church situated along Rue Saint Antoine in the Marais Quarter. Designed by Jesuit architects Étienne Martellange and François Derand (1627-41), this is a good attraction to visit if you like seeing historic churches. Opening hours 8am to 8pm daily.  The exterior is an interesting blend of Italian Baroque, French Gothic with Dutch ornamentation from that era. It takes considerable influence from nearby Church of Saint-Gervais-et-Saint-Protais.  The interior is quite attractive as well. Laid out French crucifix plan, the large nave includes high ceiling and is lined with broad columns. The centre altar, apse and inner dome are decorative. Sculptures, paintings, a simple pulpit and other features adorn the walls and floors of the church, providing interesting things to se within Eglise Saint-Paul Saint-Louis during your visit.  In the end, we liked our visit Église Saint-Paul-Saint-Louis. Unfortunately it was rather late in the day, resulting in a rather dark scene within the church. Next time around, we hope to see the interior with more natural light.",5 years ago,2025-01-24 13:51:41.551844,4.0,Brad,"5,578",https://www.google.com/maps/contrib/117832408789555351833/reviews?hl=en
ChdDSUhNMG9nS0VJQ0FnSUQ3djRTVmxnRRAB,"A marvel of French Baroque art, it is the first Jesuit church built in Paris.  Elegant, imposing, a landmark of Paris and the Marais district. Worth a visit.",4 months ago,2025-01-24 13:51:41.552845,5.0,Ramona Rorvik (Art-Tour),142,https://www.google.com/maps/contrib/102334480885492840566/reviews?hl=en
ChZDSUhNMG9nS0VJQ0FnSUNSN2RIM0xREAE,"This is my first visit to a Church with my wife. It is situated in old Paris or South Paris. It is constructed very beautifully. Very neat and clean. Huge space for sitting and is very nicely decorated with statues, pictures, candles, and furniture. Very calm and quiet.",a year ago,2025-01-24 13:51:45.788470,5.0,Ishtiaq Hossain Ornab,178,https://www.google.com/maps/contrib/112422915344788683447/reviews?hl=en
ChdDSUhNMG9nS0VJQ0FnSUNZeVkyQV93RRAB,"Cool, historic church near Le Marais. Happened to stop by on Palm Sunday. Here they use Boxwood branches rather than palms like in the USA. However, there's an insect killing the Boxwoods so now they are looking for a substitute. Beautiful building and neighborhood. Enjoy this area especially on Sunday",5 years ago,2025-01-24 13:51:45.789470,4.0,Carlos Ramirez,597,https://www.google.com/maps/contrib/106877960409409987995/reviews?hl=en
ChZDSUhNMG9nS0VJQ0FnSUNjai1pN1F3EAE,"I noticed it on the way back home from the train station. It was the red door in the night that got my attention. I was able to return in the morning to be able to appreciate the facade of the building. The three statues on the front of the church over the three doors were quite interesting, as was the clock. I didn't have time to go in and admire the interior but the exterior was quite nice to look at.",4 years ago,2025-01-24 13:51:45.790470,4.0,Benedict Uy,"3,575",https://www.google.com/maps/contrib/117720045831313801659/reviews?hl=en
ChdDSUhNMG9nS0VJQ0FnSUN4aGFQU3VnRRAB,Beautiful church.. one of the you must visit when you are on paris,a year ago,2025-01-24 13:51:45.791471,5.0,Vinod Vincent,133,https://www.google.com/maps/contrib/103069109009624008992/reviews?hl=en
ChdDSUhNMG9nS0VJQ0FnSUR4bGRpYWh3RRAB,Found this amazing church during a random stroll in Paris. Its mesmerising.  Worth a visit!,a year ago,2025-01-24 13:51:45.792469,5.0,Gautam Talukdar,29,https://www.google.com/maps/contrib/116032790696384299082/reviews?hl=en
ChZDSUhNMG9nS0VJQ0FnSURaNWZtWE13EAE,"Absolutely beautiful. Must go inside to see the gorgeous architecture and amazing paintings. Hard to believe how they build and painted such detailed art and on the ceiling. They were excellent craftsmen and artist that still amaze us hundreds of years later. Would loved to attended a mass. Beautiful details, I loved it.",a year ago,2025-01-24 13:51:45.792469,5.0,Carrie Sinclair,63,https://www.google.com/maps/contrib/117732807585727892552/reviews?hl=en
ChdDSUhNMG9nS0VJQ0FnSURtb0lYYWpRRRAB,I am always amazed in all church here in france. all i can say how beautiful architecture and decorations ❤️🙏 …,3 years ago,2025-01-24 13:51:45.793470,5.0,Ryan Fernandez,109,https://www.google.com/maps/contrib/116505986936549907711/reviews?hl=en
ChZDSUhNMG9nS0VJQ0FnSUNvLTRLSURBEAE,"Aimlessly walking through the neighborhood.  Wondered in out of curiosity. It is a lovely grand church. With some wonderful religious symbols. It was very quite and cool on a warm autumn day.  If it’s near your destination, or you would like a quiet place to sit, this is a gem of a spot.",5 years ago,2025-01-24 13:51:45.793470,5.0,Danielle Miller,45,https://www.google.com/maps/contrib/102670128585370809052/reviews?hl=en
ChdDSUhNMG9nS0VJQ0FnSURyNmVucTFRRRAB,"Beautiful functioning church in Le Marais. St Paul is open to everyone. Truly serene, peaceful and calm inside with lots of natural lighting.",6 months ago,2025-01-24 13:51:45.794470,5.0,Dexter Cuizon,"1,097",https://www.google.com/maps/contrib/106216696365161561003/reviews?hl=en
ChdDSUhNMG9nS0VJQ0FnSUNjZzR2NXpBRRAB,Amazing beautiful Roman catholic  church in centre of Paris! The church is amazing and decorated with paintings and unique statues!! ⛪❤️👌 …,4 years ago,2025-01-24 13:51:45.795471,5.0,Davide Danti,"1,094",https://www.google.com/maps/contrib/107422949794614056159/reviews?hl=en
ChdDSUhNMG9nS0VJQ0FnSURocXA2bTVRRRAB,Magnificent church - Saint-Paul-Saint-Louis!! Worth a see and a prayer in this wonderful church.,a year ago,2025-01-24 13:51:50.102708,5.0,Augustine Lee,402,https://www.google.com/maps/contrib/113559699115889623478/reviews?hl=en
ChdDSUhNMG9nS0VJQ0FnSUNuNGNyb253RRAB,Beautiful concert at amazing surroundings. Only downside was lack of toilets.,3 months ago,2025-01-24 13:51:50.102708,4.0,Wesley Valdez,44,https://www.google.com/maps/contrib/102985336858308223761/reviews?hl=en
ChdDSUhNMG9nS0VJQ0FnSUR1cmN2eW9nRRAB,Gorgeois boroqie style Catholic church with free public access. Beautiful ornate architecture.,2 years ago,2025-01-24 13:51:50.103717,5.0,Robert Hoffman,227,https://www.google.com/maps/contrib/115836499627594139455/reviews?hl=en
ChdDSUhNMG9nS0VJQ0FnSUNvamRmSi1BRRAB,"Just like all the great old churches, this cathedral is beautiful and majestic.",5 years ago,2025-01-24 13:51:50.104716,5.0,feloor talebi,132,https://www.google.com/maps/contrib/104825684913142935066/reviews?hl=en
ChdDSUhNMG9nS0VJQ0FnSURHcktpR3NnRRAB,One of the most beautiful church’s in Paris,3 years ago,2025-01-24 13:51:50.104716,5.0,Sammyra Ribeiro,52,https://www.google.com/maps/contrib/104141152500337986477/reviews?hl=en
ChdDSUhNMG9nS0VJQ0FnSUR1OC1TNWxBRRAB,Nice church to be visited. Next to paris islands. Street outside church is also great.,2 years ago,2025-01-24 13:51:50.105828,5.0,ashok kumar Yadav,155,https://www.google.com/maps/contrib/100213378093332864415/reviews?hl=en
ChdDSUhNMG9nS0VJQ0FnSURwNnFHZ193RRAB,"The most peaceful and the prettiest Cathedral in Paris. It might've been the massive crowds on the nearby streets at the time but I found myself immediately cool and calm once I entered. Reading the entry pamphlet it has a history of destruction & reconstruction beginning some 1500 years ago. It also has an interesting carving on one of its central pillars; ""République française ou la mort""",a year ago,2025-01-24 13:51:50.106335,5.0,Michael Hickey,243,https://www.google.com/maps/contrib/104353058035350447416/reviews?hl=en
ChdDSUhNMG9nS0VJQ0FnSURsaGNLbzBnRRAB,"Located on rue Saint-Antoine in the Marais quarter of Paris, the church was constructed between 1627 and 1641 by Jesuit architects Étienne Martellange and François Derand. The construction was carried out on the orders of Louis XIII of France.  One of the notable aspects of the church is that it was the first in Paris to deviate entirely from the Gothic architectural style, opting instead for the new Baroque style introduced by the Jesuits.  This departure from the Gothic tradition had a significant impact on the religious architecture in Paris. The Église Saint-Paul-Saint-Louis is known for its Baroque features and interior decorations, contributing to its historical and architectural significance.",a year ago,2025-01-24 13:51:50.106335,5.0,Zongle,502,https://www.google.com/maps/contrib/114183582401218082843/reviews?hl=en
ChdDSUhNMG9nS0VJQ0FnSUROZ1pIU29BRRAB,VERY ELEGANT ! My wife and I stopped by this historic church during our Bike About Tours guided bike tour while we were on vacation in Paris. HISTORIC AREA !,a year ago,2025-01-24 13:51:50.107346,5.0,Seymour Titt,418,https://www.google.com/maps/contrib/116406080367088308135/reviews?hl=en
ChdDSUhNMG9nS0VJQ0FnSUNvNE1pNDNBRRAB,Beautiful design and very easy for tourists to visit. Superb architect and highly recommended to visit.,5 years ago,2025-01-24 13:51:50.108557,5.0,Farooq Mallick,101,https://www.google.com/maps/contrib/111414433019867067051/reviews?hl=en
