id_review,caption,relative_date,retrieval_date,rating,username,n_review_user,n_photo_user,url_user
ChZDSUhNMG9nS0VJQ0FnSUR6aHR6cGNREAE,"Beautiful metro entrance, good place to create a meeting point just outside of the Louvre!",6 months ago,2024-12-27 21:09:23.691083,5.0,Ramona Guitoneau,38,https://www.google.com/maps/contrib/110088169380747044102/reviews?hl=en-GB
ChZDSUhNMG9nS0VJQ0FnSUREbnJ6M2NREAE,Unique and interesting plaza to hanging out with your friends or just going out by yourself.,8 months ago,2024-12-27 21:09:23.691083,5.0,Putri Dumadi,734,https://www.google.com/maps/contrib/104270468737476868971/reviews?hl=en-GB
ChZDSUhNMG9nS0VJQ0FnSUNIdHMtUkt3EAE,Felt like in Brazilian family kitchen The food the atmosphere Everything was perfect And the perfect Caipirinha,3 months ago,2024-12-27 21:09:23.692083,5.0,nicolas demaude,24,https://www.google.com/maps/contrib/118315956009144578635/reviews?hl=en-GB
ChdDSUhNMG9nS0VJQ0FnSURIMHJYazBnRRAB,Unique,3 months ago,2024-12-27 21:09:23.692083,5.0,Mathieu Weiler,0,https://www.google.com/maps/contrib/114405904722664084003/reviews?hl=en-GB
ChZDSUhNMG9nS0VJQ0FnSUM1a2JLUVpREAE,Cute,a year ago,2024-12-27 21:09:23.692083,5.0,Caty Mpeho,124,https://www.google.com/maps/contrib/105622129974467527919/reviews?hl=en-GB
ChZDSUhNMG9nS0VJQ0FnSURIdHNiWkpnEAE,"Arrived there by chance. I think the oldest restaurant in Paris, Le Nemours.",3 months ago,2024-12-27 21:09:23.692083,5.0,Sylvain Portelance,60,https://www.google.com/maps/contrib/108803352191573193195/reviews?hl=en-GB
ChZDSUhNMG9nS0VJQ0FnSUNQNmU2a1R3EAE,"A pretty little place where there are almost always dancers or musicians, something to pass the time pleasantly.",a month ago,2024-12-27 21:09:23.692083,5.0,Manon Batteux,1,https://www.google.com/maps/contrib/101466962263238294476/reviews?hl=en-GB
ChZDSUhNMG9nS0VJQ0FnSUNuaXI2V0pnEAE,The metro entrance is terrible but there is a good atmosphere when there are swingers on Saturdays in front of the French comedy,3 months ago,2024-12-27 21:09:23.693083,5.0,Frank Wolleb,347,https://www.google.com/maps/contrib/111359256269021871110/reviews?hl=en-GB
ChdDSUhNMG9nS0VJQ0FnSURuZ3BLeTZBRRAB,very lively places I advise you to sit on the Nemour terrace for a nice view of the Royal Palace la comedi francaise,2 months ago,2024-12-27 21:09:23.693083,4.0,Miss.lps. 9,0,https://www.google.com/maps/contrib/109252666459103391419/reviews?hl=en
ChZDSUhNMG9nS0VJQ0FnSUREbVpDaklREAE,"Very nice place to wait for the start of a play at the French comedy. You can wait in one of the local cafes, it's very pleasant. In addition, this place is near the Louvres and many shops. Don’t hesitate to take a look!",8 months ago,2024-12-27 21:09:23.693083,4.0,Anaya Vidal-Tourneville,16,https://www.google.com/maps/contrib/111396956354351500944/reviews?hl=en
ChdDSUhNMG9nS0VJQ0FnSURIOXRPd3ZRRRAB,Place to see if you go to Paris. There is notably the famous metro entrance and the French comedy with pillars,3 months ago,2024-12-27 21:09:23.693083,5.0,Vegetarian Around cities,261,https://www.google.com/maps/contrib/114063974825756214771/reviews?hl=en
ChZDSUhNMG9nS0VJQ0FnSURudE52SmVnEAE,A small but very special square between the Louvre and the opera house.,a month ago,2024-12-27 21:09:23.694083,5.0,ΔΗΜΟΣΘΕΝΗΣ ΖΙΟΥΛΑΣ,"1,966",https://www.google.com/maps/contrib/101616779483891019051/reviews?hl=en
ChZDSUhNMG9nS0VJQ0FnSUNGdS1XT0d3EAE,"Very beautiful and original place where it is good to stroll on the terrace of a café or enjoy lindy hop dancers on Sundays with orchestra. Facing the French comedy, a place steeped in history. Don't miss the metro entrance with its multicolored spheres.",a year ago,2024-12-27 21:09:23.694083,5.0,crystèle Gras,54,https://www.google.com/maps/contrib/102240315358914771172/reviews?hl=en
ChdDSUhNMG9nS0VJQ0FnSUMzbjhPMnlBRRAB,Very original Metro mouth,a month ago,2024-12-27 21:09:23.694083,4.0,Les Voyages De Vero,125,https://www.google.com/maps/contrib/106348022629393125407/reviews?hl=en
ChZDSUhNMG9nS0VJQ0FnSUNIcVBUT01REAE,"I attended a tango performance, very evocative",3 months ago,2024-12-27 21:09:23.694083,4.0,gioia tozzi,8,https://www.google.com/maps/contrib/107352198092908283175/reviews?hl=en
ChRDSUhNMG9nS0VJQ0FnSURYOFB4ZxAB,GO LEFT THROUGH THE PILLARS INTO THE GARDEN AND WALK THE ENTIRE CIRCLE,2 months ago,2024-12-27 21:09:23.695083,5.0,Ferry 1948,565,https://www.google.com/maps/contrib/117562622391840782632/reviews?hl=en
ChZDSUhNMG9nS0VJQ0FnSUNKb0xybkN3EAE,"An emblematic place because in front of the French comedy, at the gates of the magnificent garden of the royal palace, and also because it often welcomes groups of dancers. The spirit of Paris is then found here...",a year ago,2024-12-27 21:09:23.695083,5.0,jerome rossignol,58,https://www.google.com/maps/contrib/115051772787763077989/reviews?hl=en
ChdDSUhNMG9nS0VJQ0FnSUQ1d0xmWWl3RRAB,A beautiful square and the outdoor tango experience was truly a splendid moment of my holiday in Paris,a year ago,2024-12-27 21:09:23.695083,5.0,eraldo Marazza,2,https://www.google.com/maps/contrib/116423488290745712736/reviews?hl=en
ChdDSUhNMG9nS0VJQ0FnSUNaamZ5TDh3RRAB,"Besides Othoniel's work, what is of course this place is that it is very lively: theater outings, cafés, often improvised balls.",a year ago,2024-12-27 21:09:28.005374,5.0,Olivier Lemoigne,120,https://www.google.com/maps/contrib/114354078204917958207/reviews?hl=en
ChZDSUhNMG9nS0VJQ0FnSUQ1b3RtWkxnEAE,A beautiful square...,a year ago,2024-12-27 21:09:28.005374,5.0,Atlas,251,https://www.google.com/maps/contrib/102264459565124999505/reviews?hl=en
ChZDSUhNMG9nS0VJQ0FnSURwdGFMMUl3EAE,"A suffix in -ette will most often be a diminutive Ex.: Colette, little glue... not surprising then that we remain glued to this small square which overlooks a metro decorated with Murano glass and the French comedy.. .2 steps from the Louvre, the pyramid and the opera. On summer evenings, there are often dancers who meet there...",a year ago,2024-12-27 21:09:28.005374,5.0,geoffroy Delobette,57,https://www.google.com/maps/contrib/100282439798576485068/reviews?hl=en
ChdDSUhNMG9nS0VJQ0FnSURKb0kzUWt3RRAB,Candlelight evening at the piano with an RNB theme from the 2000s.,a year ago,2024-12-27 21:09:28.006374,5.0,daph ok,12,https://www.google.com/maps/contrib/118433973949813388611/reviews?hl=en
ChdDSUhNMG9nS0VJQ0FnSUQ5anNpV3h3RRAB,Beautiful Parisian square surrounded by Haussmannian buildings. Headquarters of French comedy.,9 months ago,2024-12-27 21:09:28.006374,5.0,Alexandre MASSON,841,https://www.google.com/maps/contrib/111399259647502174150/reviews?hl=en
ChZDSUhNMG9nS0VJQ0FnSUQ5dHEzLVB3EAE,Beautiful lively square,9 months ago,2024-12-27 21:09:28.006374,5.0,MASSON Romain,574,https://www.google.com/maps/contrib/108566308431177101859/reviews?hl=en
ChdDSUhNMG9nS0VJQ0FnSUNsOXBTUDJBRRAB,Ideal place to dance the Lindy on Saturday afternoon and follow up with a play at the Comédie Française,a year ago,2024-12-27 21:09:28.006374,5.0,Betty,1,https://www.google.com/maps/contrib/102198025146396731239/reviews?hl=en
ChZDSUhNMG9nS0VJQ0FnSUM1OU82b0NnEAE,"Magical place! Place Colette, the French comedy, the metro station, magically decorated, Next to the Madeleine",a year ago,2024-12-27 21:09:28.007373,5.0,Marie Jose Legendre,64,https://www.google.com/maps/contrib/101031672461593197708/reviews?hl=en
ChdDSUhNMG9nS0VJQ0FnSURMNUtqLTBRRRAB,Pretty nice meeting place!,6 months ago,2024-12-27 21:09:28.007373,5.0,Geo,42,https://www.google.com/maps/contrib/108914317675372201207/reviews?hl=en
ChdDSUhNMG9nS0VJQ0FnSURwcXB5OW5RRRAB,"2023 summer. Pleasant, fresh square with metro stop embellished with a contemporary structure",a year ago,2024-12-27 21:09:28.007373,4.0,luca bonello,483,https://www.google.com/maps/contrib/115435380281495495522/reviews?hl=en
ChZDSUhNMG9nS0VJQ0FnSUMxdnF6RUVnEAE,Interesting place,11 months ago,2024-12-27 21:09:32.259823,4.0,Monika Stelmach,200,https://www.google.com/maps/contrib/110755510039548597001/reviews?hl=en
ChdDSUhNMG9nS0VJQ0FnSUNwdDVqeG5RRRAB,"Very nice place to visit the Palais Royal, the French comedy, the Louvre",a year ago,2024-12-27 21:09:32.260823,5.0,Olivier Fleurot,62,https://www.google.com/maps/contrib/114110928580562786285/reviews?hl=en
ChZDSUhNMG9nS0VJQ0FnSURKeU1Hb2R3EAE,"Little candle concert at night, nicely kitsch!",a year ago,2024-12-27 21:09:32.260823,4.0,karine L,54,https://www.google.com/maps/contrib/114933544891879344935/reviews?hl=en
ChdDSUhNMG9nS0VJQ0FnSURKb2RTbzR3RRAB,"Marivaux at the Comédie Française, excellent.",a year ago,2024-12-27 21:09:32.260823,4.0,Ma TD,13,https://www.google.com/maps/contrib/100342713815830584726/reviews?hl=en
ChZDSUhNMG9nS0VJQ0FnSURKNkt2TkdnEAE,One of the many places in Paris to visit.,a year ago,2024-12-27 21:09:32.260823,5.0,Christian Coulais,230,https://www.google.com/maps/contrib/108288043190618176201/reviews?hl=en
ChZDSUhNMG9nS0VJQ0FnSURwbDlIckVREAE,Nice place.,a year ago,2024-12-27 21:09:32.261823,4.0,Thalès de Milet,315,https://www.google.com/maps/contrib/115130037850434397943/reviews?hl=en
ChdDSUhNMG9nS0VJQ0FnSUQ1MlpUVG9nRRAB,A must see,a year ago,2024-12-27 21:09:32.261823,5.0,I'mIn T,161,https://www.google.com/maps/contrib/104622418310078356039/reviews?hl=en
ChZDSUhNMG9nS0VJQ0FnSUM1NVBHWEtBEAE,Worth seeing,a year ago,2024-12-27 21:09:32.261823,5.0,euihyung chung,150,https://www.google.com/maps/contrib/114433128656642772035/reviews?hl=en
ChdDSUhNMG9nS0VJQ0FnSURaMjY2RjZBRRAB,Always armored,a year ago,2024-12-27 21:09:32.261823,2.0,Beatriz G.C.,92,https://www.google.com/maps/contrib/116389062501151551143/reviews?hl=en
ChZDSUhNMG9nS0VJQ0FnSUN2ajhpQk1REAE,,a week ago,2024-12-27 21:09:32.261823,5.0,Carles Ferrer,21,https://www.google.com/maps/contrib/114661130213599255580/reviews?hl=en
