id_review,caption,relative_date,retrieval_date,rating,username,n_review_user,n_photo_user,url_user
ChZDSUhNMG9nS0VJQ0FnSUN2bmVPT1VREAE,"One of the most special memories I hold close to my heart happened right there, as I stood in awe of everything around me. I was with my kids, and nearby there was another group of children. That’s when I came up with an idea: “Alright, every time we cross a bridge, we’re going to make a wish. Close your eyes, and let’s wish for something special. Ready? 1, 2, 3.” We all closed our eyes as we crossed the bridge, and I added, “But don’t say your wishes out loud, keep them secret!” The excitement was contagious—everyone cheered, “Yay!” and the joy of that moment became an unforgettable memory.🥰  It was such a beautiful experience to share with the kids. Moments like these remind me how important it is to never lose your inner child, to keep seeing the world with wonder, and to stay amazed by the little things. Building connections, creating memories, and cherishing them—that’s what truly makes life extraordinary.  My trip was so much more meaningful because of those moments.❣️  The Pont Alexandre III is, without a doubt, one of the most beautiful bridges I’ve ever seen. I was completely captivated by its beauty, its magic, and the romantic atmosphere that surrounds it. It’s a place that truly transports you and makes you feel like you’ve stepped into a fairy tale.🧚‍♀️  Paris, with its charming streets, is simply unforgettable. A place that stays in your heart forever!",a month ago,2025-01-24 14:21:05.443062,5.0,Mariela Bedoya,58,https://www.google.com/maps/contrib/112571962551071062861/reviews?hl=en-GB
ChZDSUhNMG9nS0VJQ0FnSURYeGMtN1RREAE,"We have crossed this bridge many times admiring its beauty, however, on this occasion whilst walking along the river esplanade we got to see it from a different (looking up) angle, and under it, the workmanship is simply stunning",2 months ago,2025-01-24 14:21:05.444063,5.0,V H,"1,000",https://www.google.com/maps/contrib/116525100818724963755/reviews?hl=en-GB
ChdDSUhNMG9nS0VJQ0FnSUNfckt5eHlRRRAB,I wanted to celebrate the New Year in a different country & France it was! Landed in CDG New Year Eve at 10:30 PM. Arrived at the hotel at 11:40PM. Hotel attendant suggested I download the Bolt app (Lyft equivalent) the car ride service arrived within a min of the request. I was told to go to Pont Alexandre lll to get a glimpse of the fireworks & the Eiffel Tower. By 11:50 I was by the water & ready to countdown the year away into the new one. Happy 2025!,a week ago,2025-01-24 14:21:05.445063,5.0,f martinez,34,https://www.google.com/maps/contrib/104517009434940220565/reviews?hl=en-GB
ChdDSUhNMG9nS0VJQ0FnSURmMGRmN3NRRRAB,"A Stunning Bridge with Unmatched Views  Pont Alexandre III is one of the most beautiful and iconic spots in Paris. The views from the bridge are absolutely breathtaking—you can see the Eiffel Tower in one direction and the elegant Grand Palais in the other. It’s the perfect place to stop and admire the beauty of the city, especially at sunrise or sunset when the light makes everything feel magical.  The bridge itself is a masterpiece of design and history. Built for the 1900 Exposition Universelle, it’s full of intricate details, from the golden statues of Pegasus at each end to the ornate lamps and sculptures along its length. Every angle is worth a photo, and it’s easy to see why this spot is so beloved by locals and tourists alike.  Whether you’re taking a peaceful walk, capturing stunning photos, or just enjoying the views of the Seine and beyond, Pont Alexandre III is an unforgettable experience. It’s a place where Paris truly shines—don’t miss it!",2 weeks ago,2025-01-24 14:21:05.446063,5.0,Elmira Esfahani,85,https://www.google.com/maps/contrib/101988448575446914234/reviews?hl=en-GB
ChdDSUhNMG9nS0VJQ0FnSUMzaGEzQ213RRAB,"Watch my first photo shot by an old film camera. A beautiful bridge. Now used as a car, people bridge. There are many interesting statues on the bridge.",2 months ago,2025-01-24 14:21:05.447063,5.0,Chang Allen,106,https://www.google.com/maps/contrib/108148778859764206707/reviews?hl=en-GB
ChdDSUhNMG9nS0VJQ0FnSUNYOVBQOV9RRRAB,"If you find yourself in Paris, don’t miss the chance to take a walk across this bridge! It’s one of the most beautiful in the city.",3 months ago,2025-01-24 14:21:05.447063,5.0,MsAllatt,98,https://www.google.com/maps/contrib/103581576328066501417/reviews?hl=en-GB
ChZDSUhNMG9nS0VJQ0FnSUNubjhxRWR3EAE,"Possibly the most photoghraphed bridge over the river Seine, linking Invalides with Grand Palais. A walk along the river bank under the span gives a brilliant view of the ironwork used in the constuction and a close up of the ornate facade.",a month ago,2025-01-24 14:21:05.448064,5.0,Mike Day,337,https://www.google.com/maps/contrib/101631451196518773367/reviews?hl=en-GB
ChZDSUhNMG9nS0VJQ0FnSUNuX1ktNGFREAE,A good spot to snag some great photos of La Tour Eiffel as well as the Pont Alexandre III with its gold trimmings!  The bridge itself is beautiful and makes for a great backdrop in photos!,3 months ago,2025-01-24 14:21:05.448064,4.0,Christopher Owens,176,https://www.google.com/maps/contrib/108074264384117184540/reviews?hl=en-GB
ChZDSUhNMG9nS0VJQ0FnSUQzOVpMZ05BEAE,Stunning architecture. and engineering since it has been standing so long. it makes the area what it is.,2 months ago,2025-01-24 14:21:05.449063,4.0,Muhammed Uzair Osman,591,https://www.google.com/maps/contrib/106576958910447369429/reviews?hl=en
ChZDSUhNMG9nS0VJQ0FnSUNMOG9pTVlREAE,"My visit to Pont Alexandre III was truly memorable. This iconic bridge, renowned for its ornate design and intricate details, offers stunning views of the Seine River and surrounding landmarks. The beautiful sculptures and gilded statues, combined with the elegant lamp posts, create a picturesque setting that feels quintessentially Parisian. Strolling across the bridge, I admired the grand architecture of the nearby Grand Palais and Petit Palais, and enjoyed the lovely sight of the Eiffel Tower in the distance. It is a must-see for anyone visiting Paris, offering a perfect blend of history, art, and breathtaking views.",7 months ago,2025-01-24 14:21:05.449063,5.0,Highway Video,414,https://www.google.com/maps/contrib/114783197435768198244/reviews?hl=en
ChZDSUhNMG9nS0VJQ0FnSUNuaEplWUlnEAE,Numerous sculptors provided the sculpture that feature prominently on the bridge such as fames and nymphs.A lot of gold sculptures and I think this is the most beautiful bridge.,4 months ago,2025-01-24 14:21:05.450063,5.0,Marino Paradina,447,https://www.google.com/maps/contrib/118004089828405896868/reviews?hl=en
ChdDSUhNMG9nS0VJQ0FnSURiMTh6dTNRRRAB,"Iconic bridge crossing the Seine river that at the time of my visit was being used for Olympic purposes, which was very cool to see personally. Beautiful statues adorn the four posts.",4 months ago,2025-01-24 14:21:05.450063,5.0,Sarah Hartman,"2,910",https://www.google.com/maps/contrib/105125183085602630773/reviews?hl=en
ChdDSUhNMG9nS0VJQ0FnSUMza0xQT3h3RRAB,"Breathtaking views, perfect for a taking pictures with great background of the Eiffel Tower",2 months ago,2025-01-24 14:21:05.451064,5.0,Mark Yu,108,https://www.google.com/maps/contrib/104431018346594730876/reviews?hl=en
ChdDSUhNMG9nS0VJQ0FnSURyejVLVXNnRRAB,Perhaps the most beautiful bridge in Paris. This is an iconic landmark in Paris.  Go near the river to take beautiful pictures of the bridge.,6 months ago,2025-01-24 14:21:05.451064,4.0,Mihir Shah,133,https://www.google.com/maps/contrib/113825911885662822745/reviews?hl=en
ChdDSUhNMG9nS0VJQ0FnSURQeUlMVXR3RRAB,"The Pont Alexandre III in Paris is a masterpiece of Belle Époque architecture, symbolizing Franco-Russian friendship. Its ornate design, with golden statues, intricate carvings, and art nouveau lamps, exudes elegance and grandeur. Spanning the Seine, it offers stunning views of the Eiffel Tower and Les Invalides. A stroll across this bridge, especially at sunset, feels magical, blending history, art, and romance. A must-visit for anyone exploring the charm of Paris!",a month ago,2025-01-24 14:21:05.452063,4.0,Dani Baal,"1,145",https://www.google.com/maps/contrib/103357020897930875043/reviews?hl=en
ChdDSUhNMG9nS0VJQ0FnSUNINWRhMHdnRRAB,"Pont Alexandre III is the finish line for Paris 2024 races. Très incroyable backdrop with many cheering fans leading up to the bridge. It is perhaps the grandest bridge across the river Seine. Although not a long bridge in length, it is culturally important to the city of Paris.",4 months ago,2025-01-24 14:21:05.453063,5.0,Alvin Ma,194,https://www.google.com/maps/contrib/103816310242706378740/reviews?hl=en
ChdDSUhNMG9nS0VJQ0FnSUNEaTlUaDJRRRAB,A other must see tourist attraction in Paris. Such a beautiful and ornate bridge along with great views and photo opportunities of the Eiffel tower. Take a short walk from the Grand or Petite Palais. You won't regret it.,9 months ago,2025-01-24 14:21:05.453063,5.0,Wil Chung,162,https://www.google.com/maps/contrib/109391629398584934361/reviews?hl=en
ChZDSUhNMG9nS0VJQ0FnSUQzeE9qd2JBEAE,"Very nice looking bridge, Napoleon's favorite - leading towards his grave at the military museum",2 months ago,2025-01-24 14:21:05.454063,4.0,Martin Andersson,51,https://www.google.com/maps/contrib/105571355751566288725/reviews?hl=en
ChZDSUhNMG9nS0VJQ0FnSUR6OV9fSWRREAE,It’s the most beautiful bridge in Paris. It’s half closed because of Paris Olympic preparations. But one side is open you can enjoy.,7 months ago,2025-01-24 14:21:09.591764,5.0,Krishna Rani Sahoo,110,https://www.google.com/maps/contrib/105378516753229567828/reviews?hl=en
ChdDSUhNMG9nS0VJQ0FnSURkM0lHZ3hBRRAB,"The most ornate bridge in Paris. We saw it from a river cruise, but I have also walked across. It was decorated for a big exposition and the lovely decorations, sculptures and lighting, remain to entertain us. Take a slow walk to admire it. You will also be in the midst of cultural institutions.",11 months ago,2025-01-24 14:21:09.591764,4.0,Narender Kumar,"1,292",https://www.google.com/maps/contrib/106535077984996903079/reviews?hl=en
ChZDSUhNMG9nS0VJQ0FnSURYM3BERkdnEAE,Beautiful bridge with decorations in gold ! fabulous photo location😁 …,2 months ago,2025-01-24 14:21:09.592767,5.0,Ada Drescher,46,https://www.google.com/maps/contrib/113529094641229212032/reviews?hl=en
ChdDSUhNMG9nS0VJQ0FnSUQzaE5leGlBRRAB,A Paris icon and a wonderful place to watch the Eiffel Tower sparkle.,2 months ago,2025-01-24 14:21:09.593764,5.0,Gary Rogers,225,https://www.google.com/maps/contrib/107830898894177028913/reviews?hl=en
ChdDSUhNMG9nS0VJQ0FnSURIeXVIQnJRRRAB,One of the beautiful bridges in Paris France. Stunning architecture and craftsmanship,4 months ago,2025-01-24 14:21:09.593764,5.0,SARATH S U,226,https://www.google.com/maps/contrib/112320321007811758957/reviews?hl=en
ChdDSUhNMG9nS0VJQ0FnSURfOE5qWDhBRRAB,Good spot to see the Eiffel tower at night if you are north of the Seine,3 days ago,2025-01-24 14:21:09.594763,5.0,Alex Jackson (AJ),32,https://www.google.com/maps/contrib/103705358804755129257/reviews?hl=en
ChdDSUhNMG9nS0VJQ0FnSUNmeE1IOTZBRRAB,A beautiful bridge with ornate staues and iron work.,4 weeks ago,2025-01-24 14:21:09.594763,5.0,Jack Bowers,94,https://www.google.com/maps/contrib/116265608941824156009/reviews?hl=en
ChZDSUhNMG9nS0VJQ0FnSUNmajVDRkpBEAE,My favourite bridge in Paris❤️,5 days ago,2025-01-24 14:21:09.595764,5.0,Josef Michailov,"1,180",https://www.google.com/maps/contrib/110253611844764748116/reviews?hl=en
ChdDSUhNMG9nS0VJQ0FnSURacHRQY3hnRRAB,"Very beautiful bridge, I love this bridge. So happy I got to come here with my best friend for some photoshoots. We got some nice angles to capture the bridge and the Eiffel tower. Highly recommended to visit this bridge if you ever come to Paris.",a year ago,2025-01-24 14:21:09.595764,5.0,Eva,308,https://www.google.com/maps/contrib/100556235777158628185/reviews?hl=en
ChdDSUhNMG9nS0VJQ0FnSUNGMC1iMWlRRRAB,"This bridge is just very pretty, the dark and gold contrast of its decoration is really nice. It has some sculptures on each corner and each end of the bridge.  From here you can take some river cruises on the Seine river as well.",a year ago,2025-01-24 14:21:09.596764,5.0,G A C,182,https://www.google.com/maps/contrib/100617558030584190053/reviews?hl=en
ChZDSUhNMG9nS0VJQ0FnSUQ1eVpEc0tBEAE,"Pont Alexandre III is the epitome of Parisian elegance, a bridge that's as much a work of art as it is a functional structure. Spanning the Seine River, it's adorned with ornate lamps, cherubs, nymphs, and gilded sculptures, making it a feast for the eyes. Strolling along this bridge feels like a journey through Belle Époque Paris. The view of the Eiffel Tower from the bridge is simply breathtaking. It's not just a bridge; it's a symbol of Paris's timeless charm and grandeur. 🌉🇫🇷🗼",a year ago,2025-01-24 14:21:13.790059,5.0,Oscar Munoz,203,https://www.google.com/maps/contrib/109713842727653745242/reviews?hl=en
ChZDSUhNMG9nS0VJQ0FnSUROOG9xMFpREAE,Beautiful views no matter the time of year! The bridge is like a museum with different views of Paris! Highly recommend going in the morning or when the sun is setting!,a year ago,2025-01-24 14:21:13.791059,5.0,Corinne,55,https://www.google.com/maps/contrib/109287248945156465649/reviews?hl=en
ChdDSUhNMG9nS0VJQ0FnSURObWRuNGxBRRAB,"Coming out of the Invalides train station, I stumbled upon the breathtaking Pont Alexandre III. Let me tell you, this bridge is not your ordinary way of crossing the Seine. It's an absolute masterpiece of art and architecture, offering some of the most stunning views in Paris, including the iconic Eiffel Tower.  Did you know that it was named after Tsar Alexander III of Russia? The bridge was inaugurated back in 1900 for the World's Fair and it's a testament to the friendship between France and Russia. The design of this bridge is just mind-blowing, featuring these four majestic statues representing Fame, Harmony, Charity, and Commerce. And let me tell you, these statues are adorned with gold leaf, crafted by the most renowned artists of that time, showcasing the exquisite Art Nouveau style.  As I was strolling along the bridge, I couldn't help but be captivated by the intricate details and the breathtaking panoramic views of the city. It's in such a perfect location, connecting the Invalides and Champs-Elysées districts, making it the ideal spot to take in the beauty of Paris. No wonder so many people choose this place for their engagement and wedding photos.  Let me tell you, the Pont Alexandre III isn't just your average bridge. It's a symbol of elegance and history. With a length of 828 meters, it's one of the longest and most ornate bridges in Paris. And let's not forget about those beautifully decorated lampposts and the intricate ironwork that adds to its charm. Trust me, if you're ever in Paris, you just can't miss it.  All in all, my experience at Pont Alexandre III was simply magical. It's a place where history, art, and breathtaking views come together to create an unforgettable experience.",a year ago,2025-01-24 14:21:13.792059,5.0,Daniel Neuhaus,178,https://www.google.com/maps/contrib/106423677302961815900/reviews?hl=en
ChZDSUhNMG9nS0VJQ0FnSUMxMElDUlN3EAE,"Wide bridge over the Seine that if crosses moving south heads towards the Eiffel Tower, and if north, Champs Elysees. The bridge is decorated with numerous statues and is in my opinion the most impressive bridge in all of Paris.",a year ago,2025-01-24 14:21:13.793060,5.0,World Proven,137,https://www.google.com/maps/contrib/101098059369617091253/reviews?hl=en
ChdDSUhNMG9nS0VJQ0FnSURudk1IdnlRRRAB,Pont Alexandre III is one of the most beautiful bridge in Paris,3 months ago,2025-01-24 14:21:13.794059,5.0,Cloud Bite,2,https://www.google.com/maps/contrib/101960293474808692704/reviews?hl=en
ChdDSUhNMG9nS0VJQ0FnSUNqb3RMSW53RRAB,One of the most impressive bridges of Paris over river Seine River. Especially impressive at night due to the lights and the magnificent view of surrounding places and the Eifel Tower.,9 months ago,2025-01-24 14:21:13.794059,5.0,George Mavrommatopoulos,224,https://www.google.com/maps/contrib/102714993229954790298/reviews?hl=en
ChdDSUhNMG9nS0VJQ0FnSURCd19xSXhBRRAB,A beautiful bridge built in the 1800s. The bridge has heavily decorated lamp posts on both sides and the entire bridge has touches of gold to its structure. This makes the bridge very majestically appealing. You will get a beautiful glimpse of the Seine river and a decent view of the Eiffel Tower.,a year ago,2025-01-24 14:21:13.795059,3.0,shivani kakhandki,28,https://www.google.com/maps/contrib/116361015738504833045/reviews?hl=en
ChZDSUhNMG9nS0VJQ0FnSUN4bFBlek1nEAE,Incredibly beutiful bridge about 25 minutes walking distant from the Eiffel tower. Great view of River Seine and Eiffel. Both day and night times have their own charm from this view point.,a year ago,2025-01-24 14:21:13.796059,5.0,Debaleena Sain,257,https://www.google.com/maps/contrib/101620741017368626760/reviews?hl=en
ChZDSUhNMG9nS0VJQ0FnSUNkNU9EWkNREAE,"Pont Alexandre III is a marvel of engineering and beauty, spanning the Seine River in Paris with elegance and grace. Adorned with ornate sculptures, gilded decorations, and majestic lampposts, it is widely regarded as one of the most exquisite bridges in the world. Named after Tsar Alexander III, it symbolizes the Franco-Russian alliance and serves as a timeless monument to friendship and diplomacy. Strolling across Pont Alexandre III offers breathtaking views of the Seine and iconic Parisian landmarks, making it a must-see destination for visitors seeking romance, history, and architectural splendor.",11 months ago,2025-01-24 14:21:13.796059,5.0,Kalangi Rodrigo,24,https://www.google.com/maps/contrib/100703559953782319591/reviews?hl=en
ChdDSUhNMG9nS0VJQ0FnSURiczl6Z3BBRRAB,Alexender Bridge is the most beautiful bridge of Paris connecting 2 major tourist attractions: Grand palace & Petit Palace on one side and Invalides on the other side. The lamps of bridge are stunning and the winged sculptures on bridge pillars worth checking out. Best place for photography during day and night both.,5 months ago,2025-01-24 14:21:13.797060,5.0,Nirav Parikh,281,https://www.google.com/maps/contrib/113521461858345514541/reviews?hl=en
