id_review,caption,relative_date,retrieval_date,rating,username,n_review_user,n_photo_user,url_user
ChZDSUhNMG9nS0VJQ0FnSURqX3Z2Zld3EAE,"One of a school that can be visited by local/ tourist. It’s really great school to have this kind of beautiful view, it's calm and quiet. Usually there are no crowds and they have lots of sitting bench and you can enjoy the day. There are also many parc/ Jardin beautiful places nearby to be explored in such as arboretum, stadium or parc de floral.",8 months ago,2025-01-24 12:38:58.952586,5.0,Putri Dumadi,732,https://www.google.com/maps/contrib/104270468737476868971/reviews?hl=en-GB
ChZDSUhNMG9nS0VJQ0FnSUM4cV92eWVnEAE,My favorite place in Paris. It's calm and quiet. Usually there are no crowds and they have lots of little nooks where you can install yourself and enjoy the day. I love this place in all seasons. It's easy to get to by metro. There are places nearby for snacks and a bathroom next door at the arboretum.,4 years ago,2025-01-24 12:38:58.952586,5.0,B Tomaras,32,https://www.google.com/maps/contrib/100497204718873284149/reviews?hl=en-GB
ChZDSUhNMG9nS0VJQ0FnSUNIMVBDTkpnEAE,Magnificent place where you discover another nature! This place is totally free and a delight for the eyes. There are very pleasant areas to rest.,4 months ago,2025-01-24 12:38:58.953588,5.0,Franck Malaterre,99,https://www.google.com/maps/contrib/110931761577792008912/reviews?hl=en-GB
ChZDSUhNMG9nS0VJQ0FnSURIbElpbWNREAE,An incredible school with the most colorful summer flower beds. To discover absolutely,4 months ago,2025-01-24 12:38:58.954587,5.0,Morgan Guichard,696,https://www.google.com/maps/contrib/103835772896410236855/reviews?hl=en-GB
ChZDSUhNMG9nS0VJQ0FnSUNUdk1LR1RBEAE,"A whole day spent in this relaxing and magnificent place. Extremely well maintained, perfect calm, lots of species of plants, trees, shrubs... The staff there are very friendly and do not hesitate to give advice. On the edge of the Bois de Vincennes, next to the Joinville RER, a haven of peace. Well done and thank you to the whole team 👋",8 months ago,2025-01-24 12:38:58.954587,5.0,jean-pierre roger,455,https://www.google.com/maps/contrib/105268875514090033473/reviews?hl=en-GB
ChZDSUhNMG9nS0VJQ0FnSUN4OHBlQVF3EAE,"The garden of this absolutely magnificent school. Lots of very different corners, majestic trees, flowers, wetlands, vegetable plants, a large meadow.... you won't be bored there for a second. Plus it’s easy to come here with children. It’s a perfect place to teach them about plants.",a year ago,2025-01-24 12:38:58.955586,5.0,Isabelle Gala,45,https://www.google.com/maps/contrib/116794028884243235714/reviews?hl=en-GB
ChdDSUhNMG9nS0VJQ0FnSUNKMGVMQm5nRRAB,We had a wonderful discovery of the École du Breuil gardens located near the Arboretum. We appreciated the different areas which are maintained and highlighted with taste and originality. Do not hesitate to go to the greenhouses you will see a magnificent collection of plants of various species as well as an ornamental vegetable garden mixing vegetables and flowers in perfect harmony. The gardeners are friendly and open to information. We had a lovely time and we wouldn't hesitate to come back at another time of year.,a year ago,2025-01-24 12:38:58.955586,5.0,The cat,"1,304",https://www.google.com/maps/contrib/100497670649705198478/reviews?hl=en-GB
ChZDSUhNMG9nS0VJQ0FnSUR4b1k2MmZBEAE,"Very beautiful place, a chance for garden lovers and admirers, that it is accessible to the public. Various worlds are present, the maintenance is exceptional. The variety of plants is significant and will delight visitors. Of course, in each season, the garden deserves to be visited as it must be adorned with different colors and its atmosphere must evolve. In addition, access to the garden is free.",a year ago,2025-01-24 12:38:58.956587,5.0,Seb Astien,137,https://www.google.com/maps/contrib/107668449707670349064/reviews?hl=en-GB
ChZDSUhNMG9nS0VJQ0FnSURKOE83b05nEAE,"A beautiful walk, accessible to all, surrounded by exceptional flora. This is what the Breuil school garden has in store for you, right next to the Vincennes racecourse. Served by the bus, you can also easily park your car right in front. Entrance is free and once you pass through the gate, the immense park is open to you: remarkable trees, flowers, ponds and small water hearts, vegetable garden, beehives....the walk has a thousand surprises in store for you! Note that at the very back of the garden, a large open space allows children to play ball, frisbee or even badminton. Away from the Bois de Vincennes, this place attracts few people and is a good place for those looking for calm.",a year ago,2025-01-24 12:38:58.957586,5.0,Olivier S.,129,https://www.google.com/maps/contrib/103537388592202213874/reviews?hl=en
ChZDSUhNMG9nS0VJQ0FnSUNKbXFDS0dREAE,"Magnificent garden with colors, smells, butterflies, crickets... we have a great time with the family... and no problem parking on a Sunday at 9:45 a.m. just a stone's throw away by car.",a year ago,2025-01-24 12:38:58.957586,5.0,Arnaud Sourdrille,218,https://www.google.com/maps/contrib/112917739846951864959/reviews?hl=en
ChZDSUhNMG9nS0VJQ0FnSURwbUx5UUhBEAE,"Pure pleasure, a magnificent walk, flowers galore, interesting installations, and gardeners ready to answer any question with a smile :) My advice, take buses 201 or 77 to get to the garden....",a year ago,2025-01-24 12:38:58.958587,5.0,maryn potter,206,https://www.google.com/maps/contrib/105060328937825143539/reviews?hl=en
ChdDSUhNMG9nS0VJQ0FnSURVcjZEdl9nRRAB,"Magnificent botanical and horticultural garden, little known. It is a pleasant place where you can discover many plants and flowers. Some furnished spaces are ideal for relaxation. A few minutes walk from the RER Joinville-le-Pont. I also recommend the Paris arboretum just opposite. And if you came there with a book to spend a few moments of peace and quiet and find freshness...",2 years ago,2025-01-24 12:38:58.959588,5.0,Tof Bus,161,https://www.google.com/maps/contrib/109194945156431984594/reviews?hl=en
ChZDSUhNMG9nS0VJQ0FnSURwLXJxUVdBEAE,"Labeled a remarkable garden, the botanical garden is open to the public all year round. It is maintained by the students and teachers of the Breuil school. So we find lots of explanations on plants and soils. Very educational for those who are interested in plants, but also pleasant for those who want to be content with being in a beautiful, quiet garden with their children.",a year ago,2025-01-24 12:38:58.959588,5.0,Roper Stern,49,https://www.google.com/maps/contrib/114135721343335671193/reviews?hl=en
ChdDSUhNMG9nS0VJQ0FnSUQ5bjRDaXN3RRAB,"Very beautiful, particularly well-kept park. A moment of calm in this green setting.",10 months ago,2025-01-24 12:38:58.960588,5.0,Ray Iznogoud,36,https://www.google.com/maps/contrib/118319686300950838304/reviews?hl=en
ChZDSUhNMG9nS0VJQ0FnSUN3eGJ5elhBEAE,"My school gardens are open to the public ALL year round. The school celebration will take place on May 29 and 30, 2021 with plant sales by the BTS to finance their study trip as well as meetings with teachers and gardeners from Paris town hall. Come many!!",3 years ago,2025-01-24 12:38:58.960588,5.0,Hugo Belin,27,https://www.google.com/maps/contrib/107841878270802531003/reviews?hl=en
ChZDSUhNMG9nS0VJQ0FnSUMwMHFiWkVREAE,"Superb walk for those who love flowers, trees, lianas, exotic plants and other cacti. The building is not extraordinary but the gardens are undeniably worth a look. Velibs allow you to stop or leave there without worry.",5 years ago,2025-01-24 12:38:58.961586,5.0,Baptiste Aubert,186,https://www.google.com/maps/contrib/104876857311242964049/reviews?hl=en
ChZDSUhNMG9nS0VJQ0FnSUNpbGJEc0dBEAE,"Very good school of landscape and horticulture. And the park is magnificent in spring, especially the Mediterranean part ❤️❤️ I did my professional baccalaureate in landscaping and surely because this sector will surely disappear, it leaves us a little behind. And I have the impression that we never finish our practical projects and that's a real shame. The BTSA in this school must be great, he learns really interesting things.",4 years ago,2025-01-24 12:38:58.961586,4.0,Démentia,26,https://www.google.com/maps/contrib/115687075259663670924/reviews?hl=en
ChZDSUhNMG9nS0VJQ0FnSUNUaUxpdExBEAE,"A little-known garden but worth the detour, very well maintained by the teams and which has a remarkable botanical collection.",8 months ago,2025-01-24 12:38:58.962587,5.0,Maxime Frenel,32,https://www.google.com/maps/contrib/113337620266134721238/reviews?hl=en
ChZDSUhNMG9nS0VJQ0FnSURUemNiNEdnEAE,"Brilliant place discovered thanks to the school festival on May 25 and 26. Lots of space and calm, a library to learn everything about plants but also the history of gardens,... An adorable welcome, excellent guided tour (thank you Laurent). I will come back with great pleasure 😍😍😍",7 months ago,2025-01-24 12:39:03.121394,5.0,Agnes D,36,https://www.google.com/maps/contrib/115873864227168022587/reviews?hl=en
ChdDSUhNMG9nS0VJQ0FnSUNULUxhbTJBRRAB,"Gorgeous. Very pretty flower beds, arrangements of garden plots. Very pleasant in spring. The benches, seats and other armchairs invite you to take your time. A real zen moment with only one downside: the background noise of the A4 cars' sweepers.",8 months ago,2025-01-24 12:39:03.122395,5.0,Myriam Myriam,0,https://www.google.com/maps/contrib/107317519448035507041/reviews?hl=en
ChdDSUhNMG9nS0VJQ0FnSUR1X2NteXFnRRAB,Small and pretty. Wilder than I expected. Spaces that invite you to sit and chat. Free! 1/2 hour to go around walking normally,2 years ago,2025-01-24 12:39:03.122395,4.0,Maina005,113,https://www.google.com/maps/contrib/118117215607298376294/reviews?hl=en
ChZDSUhNMG9nS0VJQ0FnSUN4OGRPTVhREAE,It’s a magnificent place and great discovery for a family outing. I recommend,a year ago,2025-01-24 12:39:03.123394,5.0,Patricia Bati,25,https://www.google.com/maps/contrib/105914152649151082201/reviews?hl=en
ChZDSUhNMG9nS0VJQ0FnSUNYMU1QX1FREAE,"A shame on the part of the teaching team who participate in the harassment of their own members in a childish and unfair manner, adults in their old age who attack younger people and refuse to listen to them. Avoid if you want to work in a healthy environment",3 months ago,2025-01-24 12:39:03.123394,1.0,clarkiss,0,https://www.google.com/maps/contrib/110990847725009257331/reviews?hl=en
ChZDSUhNMG9nS0VJQ0FnSUNGMGFLTWNBEAE,Charming garden where you can enjoy a beautiful bucolic walk,a year ago,2025-01-24 12:39:03.124395,4.0,Lory Orsini,137,https://www.google.com/maps/contrib/109850913020562598669/reviews?hl=en
ChdDSUhNMG9nS0VJQ0FnSUMyNlB1dS1RRRAB,"A magical place! Pleasant in every season, to enjoy the thousand colors of nature all year round...",2 years ago,2025-01-24 12:39:03.124395,5.0,Giorgio Lucentini,33,https://www.google.com/maps/contrib/109225461642118310722/reviews?hl=en
ChZDSUhNMG9nS0VJQ0FnSURlcE5HOUtnEAE,School of gardens of the city of Paris. The gardens are public and are worth a visit. There is also an interesting arboretum on the sidewalk opposite. Entertainment on certain days. Friendly welcome.,2 years ago,2025-01-24 12:39:03.125395,5.0,Luc Gr,465,https://www.google.com/maps/contrib/118160421193839222032/reviews?hl=en
ChdDSUhNMG9nS0VJQ0FnSUNSeE9iYWhnRRAB,"beautiful garden, the labeling of the plants needs to be maintained because it is not always present or next to the plant. If you're looking for a particular plant, it's not easy to find your way around... the people there don't provide any information. Shame.",a year ago,2025-01-24 12:39:03.125395,4.0,citron nelle,0,https://www.google.com/maps/contrib/113440545537659199712/reviews?hl=en
ChdDSUhNMG9nS0VJQ0FnSUMyeE1ya3dBRRAB,"Having attended different training courses (university, professional training) this training that I am currently taking on a work-study basis is really great. the teaching team and gardeners are very professional, very attentive and passionate. They sometimes find themselves in a rush because they work a lot. Their ideas are both innovative and adapted to diverse audiences. There is really quality teaching and something to do to admire the plants in the public areas. For those who like to read, the specialist library is great (as is the team). As with everything there is always something to complain about but I only get positive things from it and going there puts me in a very good mood.",2 years ago,2025-01-24 12:39:03.126395,5.0,VanilleForJo,22,https://www.google.com/maps/contrib/112986029837185182370/reviews?hl=en
ChdDSUhNMG9nS0VJQ0FnSUNldnNQejFnRRAB,"Magnificent place, very well flowered, invites you to relax and daydream. You can discover different species of plants there (and trees at the arboretum opposite). Small watering holes, with some ducks and moorhens.",2 years ago,2025-01-24 12:39:07.420855,5.0,Constance Bonnotte,0,https://www.google.com/maps/contrib/107332164523816486776/reviews?hl=en
ChdDSUhNMG9nS0VJQ0FnSURKdUt2RWpBRRAB,"This is another floral park in the Bois de Vincennes maintained by the teachers and students of the school. Pleasant, very quiet walk. Quite uncrowded",a year ago,2025-01-24 12:39:07.420855,4.0,manuel picaud,422,https://www.google.com/maps/contrib/107603117339056160263/reviews?hl=en
ChdDSUhNMG9nS0VJQ0FnSUNpd3R1bG5nRRAB,"A superb place to learn or to stroll - without forgetting its arboretum. It was a chance for me to be able to do my training there, I simply regret not having discovered this place - quite discreet and little known to Parisians - sooner. But that is perhaps what makes it so pleasant, because it is never crowded like the gardens of Paris intramural can be. And the gardeners are all friendly and willing to pass on their knowledge! See you soon, dear school!",4 years ago,2025-01-24 12:39:07.421857,5.0,Nicolas Galmiche,30,https://www.google.com/maps/contrib/116413568949437411080/reviews?hl=en
ChZDSUhNMG9nS0VJQ0FnSUN4cF9IMkNBEAE,"We had a very pleasant walk, the gardens are fabulous and all the flowers and plants are wonderful. Thank you to the students ❤️",a year ago,2025-01-24 12:39:07.422857,5.0,Émilie Jacquet,2,https://www.google.com/maps/contrib/105830954224760944586/reviews?hl=en
ChZDSUhNMG9nS0VJQ0FnSUNld2RyTE53EAE,"Garden maintained among others by the students of the agricultural high school and which invites you to take a short walk in this place away from tourists. Accessible by RATP buses 77 and 201 or Joinville le pont station, about ten minutes on foot.",2 years ago,2025-01-24 12:39:07.422857,4.0,Thierry Girard,987,https://www.google.com/maps/contrib/100981567033985110977/reviews?hl=en
ChdDSUhNMG9nS0VJQ0FnSURpNHV2aF93RRAB,Right in front of the absolutely splendid arboretum!,4 years ago,2025-01-24 12:39:07.423857,5.0,DAVY TRYEP,274,https://www.google.com/maps/contrib/105005672928690917902/reviews?hl=en
ChZDSUhNMG9nS0VJQ0FnSURxOWRTcllBEAE,"Be careful during adult training interviews (received and judged as in CP) good job. Inappropriate, contemptuous remarks and down-to-earth humor! However, I had made an effort for 6 hours to be on the site and then meet there. Too bad I like this job Otherwise the garden is very beautiful...",3 years ago,2025-01-24 12:39:07.423857,2.0,bow topbow,0,https://www.google.com/maps/contrib/102548339267949567125/reviews?hl=en
ChdDSUhNMG9nS0VJQ0FnSURlanNHSzl3RRAB,Very nice place with its College de France annex,2 years ago,2025-01-24 12:39:07.423857,4.0,Virtuelle T,144,https://www.google.com/maps/contrib/116047524118012012249/reviews?hl=en
ChZDSUhNMG9nS0VJQ0FnSURwek1hLU53EAE,"Superb, beautiful, quiet location in August. The people who work there are lovely. First visit but certainly not the last.",a year ago,2025-01-24 12:39:07.424856,5.0,Florence Hequet,0,https://www.google.com/maps/contrib/100058498584078013166/reviews?hl=en
ChZDSUhNMG9nS0VJQ0FnSUN3NWJ1Q0d3EAE,"before or after visiting the arboretum it is a significant addition to discovering the subtlety of the work of landscapers. New visit + photos Saturday October 16, 2021.",3 years ago,2025-01-24 12:39:07.424856,5.0,ernest cor-de-buy,"1,971",https://www.google.com/maps/contrib/117614306793259566290/reviews?hl=en
