id_review,caption,relative_date,retrieval_date,rating,username,n_review_user,n_photo_user,url_user
ChdDSUhNMG9nS0VJQ0FnSUNiazhYaGlnRRAB,Miss Melisa HAMADA is really great in her work. She explains everything very clearly. Really excellence in her job. Thanks .,5 months ago,2025-01-24 13:07:53.951332,5.0,ridan braison,0,https://www.google.com/maps/contrib/106427062345582738366/reviews?hl=en-GB
ChdDSUhNMG9nS0VJQ0FnSUM5c0ptRTRBRRAB,I had the best experience with my conseiller Mme Marie SECK. She is super professional and efficient to help me solve my bank issues quickly. She is very patient and kind to me who can’t speak French well. I highly recommend her if you want to open an account at SG.,10 months ago,2025-01-24 13:07:53.952331,5.0,Hannah Liao,0,https://www.google.com/maps/contrib/108396258532223115381/reviews?hl=en-GB
ChZDSUhNMG9nS0VJQ0FnSURUaDdqbkJBEAE,"TLDR: just don't go there, there are better banks in Paris.  Every interaction with them is painful. They always find ways to surprise me with their incompetence. Pending issue for 3 months now (due to their error, duh): watch them reply to this review before actually coming back to me by email or phone about my issue :) btw: you should read the 5* reviews here - they all have the same format (they are fake). Their incompetence is such that they can't even make fake reviews look legit. Some relatives and myself had to close our accounts after more than 10 years of service going downhill.",7 months ago,2025-01-24 13:07:53.953335,1.0,salem lahlou,0,https://www.google.com/maps/contrib/110957053455724026883/reviews?hl=en-GB
ChdDSUhNMG9nS0VJQ0FnSURaOVlyTWpnRRAB,"I was particularly satisfied with the immediate and excellent service of Mr. Rayan Djadda. The atmosphere was always pleasant and friendly, he answered all of my questions in detail and always with a smile. My request was fulfilled very quickly and without any hassle! Thank you very much again.",a year ago,2025-01-24 13:07:53.953335,5.0,Dimitra Mylonaki,2,https://www.google.com/maps/contrib/106991035160233445853/reviews?hl=en-GB
ChZDSUhNMG9nS0VJQ0FnSUNacDdTTUNREAE,I had an appointment at Societe Generale to change my card and assurance. Mrs. Marie Seck helped me with all the documents. She was very helpful and friendly. I also appreciated that she tried to speak English as well since I didn’t understand everything in French.,a year ago,2025-01-24 13:07:53.954331,5.0,Migena Gançi,0,https://www.google.com/maps/contrib/101329596106721157775/reviews?hl=en-GB
ChdDSUhNMG9nS0VJQ0FnSUMtcExLM2lBRRAB,"This is the worst bank branch I have ever come across in any country; had it been possible I would have given zero stars. I have never gone in to them with a problem that they have fixed - I usually have more problems after contacting them than I did before. They never answer their phone and they couldn't even block a lost/stolen check book - an emergency service... I also think multiple of the employees at this branch are paying for reviews: when was the last time anyone you know named their bank counsellor in an honest review? Pretty rare, no? Yet here most positive reviews have a named counsellor in them... DO NOT OPEN AN ACCOUNT HERE!!!",2 years ago,2025-01-24 13:07:53.955332,1.0,Lola A,0,https://www.google.com/maps/contrib/108334860570842036688/reviews?hl=en-GB
ChZDSUhNMG9nS0VJQ0FnSURSa0pPSllBEAE,"I am really sastified with the services provided by rep QUIGNETTE ⭐️⭐️⭐️⭐️⭐️. She acts promptly in a very professional maner.  On the other hands, I found that it was very easy to make an appointment online via their site. This really helps people who are foreigners like me ❤️!",a year ago,2025-01-24 13:07:53.955332,5.0,Minh Anh Le,0,https://www.google.com/maps/contrib/113292740420009814285/reviews?hl=en-GB
ChdDSUhNMG9nS0VJQ0FnSURlMHVxVWpBRRAB,"Before opening the account, I had really hesitated since I heard that it was a bit difficult but the Société Générale agency with Mrs. Hamada Mélissa and especially Mrs. M'BIGUINO Lena anne really made it easier for me task. Bravo, good job.",2 years ago,2025-01-24 13:07:53.956332,5.0,omar Malla,4,https://www.google.com/maps/contrib/107773308580151127997/reviews?hl=en-GB
ChZDSUhNMG9nS0VJQ0FnSUNoaU55a0pnEAE,Very welcoming and efficient. The Bank has good deals for students and the staff are super kind. I opened my account with Mme Asterid et Mr. Rayan very easily!,a year ago,2025-01-24 13:07:53.956332,5.0,Hamim Saad,0,https://www.google.com/maps/contrib/116335382289511131268/reviews?hl=en
ChZDSUhNMG9nS0VJQ0FnSUM2NFl5TmVBEAE,"I have the best agent ever! His name is Rayan Djadda and he is been helping me a lot with my account, I'm not from France, so the system here is very different in here.  He always advise me what are the best options for me. He is super professional and dedicated, never in a rush, he takes his time to help you. I highly recommend Rayan.",3 years ago,2025-01-24 13:07:53.957332,5.0,Gian Uberuaga,0,https://www.google.com/maps/contrib/106521877815037802501/reviews?hl=en
ChZDSUhNMG9nS0VJQ0FnSUNld3JtZUxBEAE,"Horrible service. I came with 4 other students to open a bank account and we all waited 2 hours (estimated wait time was 30 minutes) to open an account, which is ridiculous. They said they would provide service in English (which I would have appreciated since my French is only level B2), but they never spoke to me in anything but French. They had multiple issues with my email and phone number, not getting it right and having to confirm the information 2 hours after I even entered the bank. And for some reason, it takes 10 minutes just to change my phone number. And after you open an account, it still won't be valid until 48 hours later. Horrible bank, do not go here. Literally find any other bank.",2 years ago,2025-01-24 13:07:53.958331,1.0,Ana Han,48,https://www.google.com/maps/contrib/113156690939149432099/reviews?hl=en
ChdDSUhNMG9nS0VJQ0FnSUR0dVpqaWt3RRAB,"Mrs. Marie Seck is very patient and helpful, and is always efficient. Very pleasant experience, highly recommend!",11 months ago,2025-01-24 13:07:53.958331,5.0,黄谷,0,https://www.google.com/maps/contrib/105485104090443121009/reviews?hl=en
ChdDSUhNMG9nS0VJQ0FnSUQyczYtWjF3RRAB,"My account adviser at the Société Générale, Monsieur Rayan Djadda, is excellent. He processes problems extremely fast, efficient. I am very happy to have him as an adviser.",2 years ago,2025-01-24 13:07:53.959332,5.0,Phuong Nguyen,0,https://www.google.com/maps/contrib/112304080581704027823/reviews?hl=en
ChdDSUhNMG9nS0VJQ0FnSURlNWFUMXB3RRAB,I am very pleased with Mme Anne MBIGUINO service at the Sorbonne agency. She was very helpful in helping me reduce the Cotization fees of my bank card.,2 years ago,2025-01-24 13:07:53.959332,5.0,Assa Auerbach,7,https://www.google.com/maps/contrib/103605902417753992720/reviews?hl=en
ChZDSUhNMG9nS0VJQ0FnSURqN0pYRE1BEAE,Miliza was so excellent and friendly to help me to get done my needs with this branch,8 months ago,2025-01-24 13:07:53.960332,5.0,indunil perera,0,https://www.google.com/maps/contrib/104039918229832347346/reviews?hl=en
ChdDSUhNMG9nS0VJQ0FnSUNwaXZyQS1BRRAB,Very good experience with Mr Djadda who is very good and he helped me a lot with my issues. Always a pleasure to see him.,a year ago,2025-01-24 13:07:53.960332,5.0,Md Sajal,0,https://www.google.com/maps/contrib/107143546950104894910/reviews?hl=en
ChdDSUhNMG9nS0VJQ0FnSUQ2MU15NjNBRRAB,I'm very happy about this branch because Mr Rayan is my banker. He is very helpful gentle man and good behaviour. Totally he is outstanding. Thank you Mr rayan for helping me lots.,3 years ago,2025-01-24 13:07:53.961331,5.0,ajad khan,0,https://www.google.com/maps/contrib/109175510488113818035/reviews?hl=en
ChZDSUhNMG9nS0VJQ0FnSUN3ZzRlVFFnEAE,"If it had been possible to give 0 as a review I would do it. I have asked more than a month ago to close my account. I no longer live in France and this SocGen account is not usable, I do not have internet access etc. It turns out that that they are not even capable to close an account for over a month. Despite they confirmed they received my demand to close it, still the funds are not transferred to my other bank. The service is so bad, avoid!!",5 years ago,2025-01-24 13:07:53.961331,1.0,Andreea Minca,0,https://www.google.com/maps/contrib/113047768086111876439/reviews?hl=en
ChZDSUhNMG9nS0VJQ0FnSUROMVkyaWRREAE,Astrid. She is very nice person . I’m very satisfied for her service.,11 months ago,2025-01-24 13:07:58.071787,5.0,Dalim Molla Bipulashar,0,https://www.google.com/maps/contrib/117146264042488791595/reviews?hl=en
ChdDSUhNMG9nS0VJQ0FnSUNudHBYbzF3RRAB,👎🏻👎🏻👎🏻👎🏻👎🏻so impatient! Not professional at all …,3 months ago,2025-01-24 13:07:58.072787,1.0,郎丹丹,4,https://www.google.com/maps/contrib/101174122271980073753/reviews?hl=en
ChdDSUhNMG9nS0VJQ0FnSURRX1lueGp3RRAB,They are the best no waiting time to open an account and very friendly staff,8 years ago,2025-01-24 13:07:58.073790,5.0,Abdulrahman Alhazmi,364,https://www.google.com/maps/contrib/102304961783480428118/reviews?hl=en
ChdDSUhNMG9nS0VJQ0FnSUNXZ3RQYS1RRRAB,Mister Djadda is very kind and helpful. I would love to go back to thé bank again because of the very nice service and welcoming. Thanks Djadda♥️,2 years ago,2025-01-24 13:07:58.074790,5.0,Nok Phimmasenh,0,https://www.google.com/maps/contrib/108053210520030759110/reviews?hl=en
ChZDSUhNMG9nS0VJQ0FnSUNPbGJhWVVnEAE,The best banking customer service I've had so far! I was able to get answers to my requests in record time.,2 years ago,2025-01-24 13:07:58.074790,5.0,Billel Remki,1,https://www.google.com/maps/contrib/101261093324412054157/reviews?hl=en
ChdDSUhNMG9nS0VJQ0FnSUN3aXEyNm1BRRAB,Probably the worst experience ever with customer services. Agents don't even try to understand customer's problems. Only good to take fees from your bank account as long as they can. Absolute rubbish.,7 years ago,2025-01-24 13:07:58.075789,1.0,Julien BAUDEQUIN,10,https://www.google.com/maps/contrib/101887052132592505967/reviews?hl=en
ChZDSUhNMG9nS0VJQ0FnSUNHbW9UYUx3EAE,Mr. Djadda Rayan is very helpful. He patiently answered all my questions that I asked him to open my account.,3 years ago,2025-01-24 13:07:58.075789,5.0,Tanu Singla,0,https://www.google.com/maps/contrib/114909744445119762921/reviews?hl=en
ChdDSUhNMG9nS0VJQ0FnSUMtMzlmcDNnRRAB,Lena -anne m’biguino is very patient and good!,2 years ago,2025-01-24 13:07:58.076788,5.0,yuhong pan,0,https://www.google.com/maps/contrib/117067664703385651702/reviews?hl=en
ChdDSUhNMG9nS0VJQ0FnSUN4N2VxcXd3RRAB,Marie seck is very nice!,a year ago,2025-01-24 13:07:58.076788,5.0,Jiangyuan Cai,0,https://www.google.com/maps/contrib/104845680738875729083/reviews?hl=en
ChZDSUhNMG9nS0VJQ0FnSURJeVo3aGJREAE,Horrendous.... words can't describe how useless and incompetent they are - even considering that they're French.,6 years ago,2025-01-24 13:07:58.077788,1.0,Daniel Anstey,0,https://www.google.com/maps/contrib/117915392882192844487/reviews?hl=en
ChdDSUhNMG9nS0VJQ0FnSURCN2ZmRGdRRRAB,Very good!,a year ago,2025-01-24 13:08:02.242915,5.0,Yvette QIU,0,https://www.google.com/maps/contrib/103544427135786514486/reviews?hl=en
ChdDSUhNMG9nS0VJQ0FnSUQ1aWZfNXl3RRAB,👍🏻👍🏻👍🏻👍🏻 …,a year ago,2025-01-24 13:08:02.243916,5.0,Claudia Tai,0,https://www.google.com/maps/contrib/105751904937448068260/reviews?hl=en
ChdDSUhNMG9nS0VJQ0FnSURmNWVUaGlnRRAB,"Very good meeting with Ms. SECK, she was able to give me very relevant advice for my savings! And in a good mood!  Very welcoming, concerned and professional!",2 weeks ago,2025-01-24 13:08:02.243916,5.0,Carrie Powell,0,https://www.google.com/maps/contrib/117663021811240893399/reviews?hl=en
ChdDSUhNMG9nS0VJQ0FnSURQMF9Ddm5nRRAB,"With the help of Ms. Seck, I opened my bank account successfully. The process was perfect and very pleasant.",a month ago,2025-01-24 13:08:02.244915,5.0,SEONG YOUN LEE,1,https://www.google.com/maps/contrib/100391446682059030941/reviews?hl=en
ChdDSUhNMG9nS0VJQ0FnSURQcU5uOGl3RRAB,"I have the joy of being followed by Madame Hamada, very professional and attentive. I understood that for her every customer counts, and to this end she does everything to retain them. The human relationship is highlighted which is part of a global vision of management.",a month ago,2025-01-24 13:08:02.245915,5.0,MHK_Media International Christian Mahoukou (Christian Mahoukou),0,https://www.google.com/maps/contrib/118102107878506121945/reviews?hl=en
ChdDSUhNMG9nS0VJQ0FnSUM3cjRIWW13RRAB,"I am lucky enough to be followed by Mrs. SECK who is an advisor, responsive, professional, warm and attentive. She takes the time to treat my requests with attention and systematically reminds me when necessary. She received an urgent request for an account opening and took the time to explain everything to me in detail, so that I could make the best choices. I recommend this agency and particularly this advisor.",5 months ago,2025-01-24 13:08:02.245915,5.0,FRANCOIS-ELOCCIE Aunoo Douce,0,https://www.google.com/maps/contrib/112458295357179319987/reviews?hl=en
ChdDSUhNMG9nS0VJQ0FnSURYMGJISnh3RRAB,"A responsive, smiling and friendly advisor! All our requests are handled quite quickly and efficiently, my mother and I are satisfied. Thank you Mrs Fofana",2 months ago,2025-01-24 13:08:02.246915,5.0,Kadidia Traore,0,https://www.google.com/maps/contrib/113268791357347483697/reviews?hl=en
ChZDSUhNMG9nS0VJQ0FnSUNINzRINlBnEAE,"Very pleasant service, I was lucky enough to have an appointment with Ms. SECK, a very kind and friendly woman. She explained everything to me well and I am very happy and grateful for her.",4 months ago,2025-01-24 13:08:02.246915,5.0,yahya amahzoune,0,https://www.google.com/maps/contrib/112707287822694998068/reviews?hl=en
ChdDSUhNMG9nS0VJQ0FnSUNIejZ2SjhBRRAB,I was very well received by my advisor Madame Seck who explained everything to me and found the best solutions adapted to my situation. She is very competent and professional.,4 months ago,2025-01-24 13:08:02.248178,5.0,Ani Muradyan,7,https://www.google.com/maps/contrib/110574295446889789475/reviews?hl=en
ChZDSUhNMG9nS0VJQ0FnSUNQLVAzZEVnEAE,"I had an appointment with Mrs. Seck, a warm welcome, very pleasant, very professional, valuable help. I highly recommend it.",2 months ago,2025-01-24 13:08:02.248700,5.0,Merbouha Ghanes,0,https://www.google.com/maps/contrib/114890047740141171591/reviews?hl=en
