id_review,caption,relative_date,retrieval_date,rating,username,n_review_user,n_photo_user,url_user
ChdDSUhNMG9nS0VJQ0FnSURUaTV5ZnBBRRAB,"This place was really cool to visit for the first time, was a little busy but I was still able to make my way through everything and locate everything pretty easy with the signs, food court was pretty good they had some good sandwiches if you don't want to eat too much and so much pretty art",7 months ago,2025-01-24 12:46:25.098937,5.0,Parker O'Neil,5,https://www.google.com/maps/contrib/103686160679473071285/reviews?hl=en-GB
ChZDSUhNMG9nS0VJQ0FnSUNQdks3dkJBEAE,"Leticia is wonderful. She assisted me with my membership. Very elegant ; well spoken, speaks perfect English and very efficient and helpful. She is an asset as the client facing person for Amis du Louvre. Ask for her to get your membership !",2 months ago,2025-01-24 12:46:25.099938,5.0,Michael Waller,0,https://www.google.com/maps/contrib/113012665203603379910/reviews?hl=en-GB
ChZDSUhNMG9nS0VJQ0FnSUM1a2NITUd3EAE,"Very weird position. Note that the society is located in the museum, and you theoretically cannot go in if you haven't got the card, which can be obtained on site so it is really catch 22. You better order the card online and carry it when going there.  If you really don't have the time or you faced difficulties of receiving the card by post, try to communicate with the staff outside Richelieu's Gate.  Little tips that few people noticed: if you are under 26, the membership which lasts for a year, is actually cheaper than ordering one ticket online, and the same price as buying one ticket on site.  The staffs are very friendly. The site is also very quiet and comfortable.",a year ago,2025-01-24 12:46:25.100973,4.0,王伟辰,14,https://www.google.com/maps/contrib/100316407983902983792/reviews?hl=en-GB
ChdDSUhNMG9nS0VJQ0FnSUMzaWNxSmdnRRAB,"70 000 Amis du Louvre, Friends of the Louvre, and counting!  Join now ...",2 months ago,2025-01-24 12:46:25.101953,5.0,Dryslwyn Cottage,199,https://www.google.com/maps/contrib/107178296545426139806/reviews?hl=en-GB
ChdDSUhNMG9nS0VJQ0FnSUNwNl9fMy13RRAB,Highly recommend joining the Société des Amis du Louvre. It's a fantastic way to support the Louvre AND skip the entrance line.  I also had great service w/my card replacement when I was in Paris (and forgot to bring my card!).,a year ago,2025-01-24 12:46:25.101953,5.0,Suzanne Frey,"1,193",https://www.google.com/maps/contrib/108854355910193896778/reviews?hl=en-GB
ChdDSUhNMG9nS0VJQ0FnSURoN3BhdzVRRRAB,"You can be a member of <> here. It is possible to be a member by internet, but it takes about a week to get it by post  and it may be lost. I recommend doing it here because you can get a card immediately. The opening time can be different from the Louvre Museum, so check it before visiting.",a year ago,2025-01-24 12:46:25.102953,4.0,Jeongku CHOI,264,https://www.google.com/maps/contrib/103135352727449215077/reviews?hl=en-GB
ChZDSUhNMG9nS0VJQ0FnSUM5NUtpLUlBEAE,I made a mistake for the card but the people there are so nice and they help me to solve the problem. And of course they solve the problem right away. Thank you so much.,10 months ago,2025-01-24 12:46:25.102953,5.0,Tocotoco Jin,20,https://www.google.com/maps/contrib/103312303707900850900/reviews?hl=en-GB
ChdDSUhNMG9nS0VJQ0FnSURSX19YRDFnRRAB,"One of the most visited museum.. BUT!!!!! You have take care your stuff ( pursue, mobile  ) .. Be  Alert 📢 ⚠️.. inside all paintings are looks so originalS …",a year ago,2025-01-24 12:46:25.103956,4.0,Rammy Basra,86,https://www.google.com/maps/contrib/102632239207129018253/reviews?hl=en-GB
ChZDSUhNMG9nS0VJQ0FnSURJdThyMWJnEAE,"If you plan to make multiple visits to the Louvre, consider buying an annual pass. Also reduces entry fees at a selection of other museums in Paris and elsewhere in France.",6 years ago,2025-01-24 12:46:25.103956,5.0,Stephanie M Johnson,0,https://www.google.com/maps/contrib/109504353061833968906/reviews?hl=en
ChZDSUhNMG9nS0VJQ0FnSURscXBfZmR3EAE,Nice,a year ago,2025-01-24 12:46:25.104961,5.0,Ermest Sollaku,904,https://www.google.com/maps/contrib/102626758967550031193/reviews?hl=en
ChZDSUhNMG9nS0VJQ0FnSURzN3Z2clZBEAE,Waiting for a bus can give you best photo ever!,4 years ago,2025-01-24 12:46:25.104961,5.0,Dragana S,41,https://www.google.com/maps/contrib/116548391855467818425/reviews?hl=en
ChdDSUhNMG9nS0VJQ0FnSURsNnBDWnhBRRAB,Beautiful,a year ago,2025-01-24 12:46:25.104961,5.0,ERINDA TARTARAJ,626,https://www.google.com/maps/contrib/103555756359035266094/reviews?hl=en
ChZDSUhNMG9nS0VJQ0FnSUNmaG9hTEtBEAE,Beautiful artwork:),3 weeks ago,2025-01-24 12:46:25.105953,5.0,영상 퀄리티 좋으면 우는 싸이렌,28,https://www.google.com/maps/contrib/111138204807913727914/reviews?hl=en
ChZDSUhNMG9nS0VJQ0FnSURCcGVQV0dnEAE,"If you are planning to visit the Louvre over many, many days, look into becoming a member.",a year ago,2025-01-24 12:46:25.105953,5.0,Juana Gomez,113,https://www.google.com/maps/contrib/112326576231019329897/reviews?hl=en
ChZDSUhNMG9nS0VJQ0FnSURWdS02SmZ3EAE,"I don't know if it's related to Louvre, but I'm sure it's cool",a year ago,2025-01-24 12:46:25.106953,5.0,Mike Ivanenko,"1,108",https://www.google.com/maps/contrib/117162202698810851831/reviews?hl=en
ChZDSUhNMG9nS0VJQ0FnSURlMU5YOVhREAE,The staff here is very helpful and nice. I got my annual pass quickly and smoothly.,2 years ago,2025-01-24 12:46:25.106953,5.0,L XXX,38,https://www.google.com/maps/contrib/103002217177964684731/reviews?hl=en
ChdDSUhNMG9nS0VJQ0FnSUM2MHByTWhBRRAB,An amazing place!,3 years ago,2025-01-24 12:46:25.107953,5.0,Steve S.,760,https://www.google.com/maps/contrib/109425833457372260850/reviews?hl=en
ChZDSUhNMG9nS0VJQ0FnSUNuellIS0dnEAE,Worth it,3 months ago,2025-01-24 12:46:25.107953,5.0,Jose Diaz,28,https://www.google.com/maps/contrib/101386522681195656679/reviews?hl=en
ChZDSUhNMG9nS0VJQ0FnSUNaOC1PVGNREAE,Nice museum,a year ago,2025-01-24 12:46:29.295030,5.0,Md Ahasan Uddin,263,https://www.google.com/maps/contrib/117528398805903131720/reviews?hl=en
ChZDSUhNMG9nS0VJQ0FnSUM2djRQQ2N3EAE,Perfect,3 years ago,2025-01-24 12:46:29.296040,5.0,Miroslav Minchev,300,https://www.google.com/maps/contrib/106607821945542778657/reviews?hl=en
ChZDSUhNMG9nS0VJQ0FnSUN3bk0tRGF3EAE,Nice paintings and statues.,8 years ago,2025-01-24 12:46:29.296040,5.0,Marten van der Haar,174,https://www.google.com/maps/contrib/103058750408938878927/reviews?hl=en
ChdDSUhNMG9nS0VJQ0FnSUNSaXZ6bGl3RRAB,Awesome place.,a year ago,2025-01-24 12:46:29.296040,5.0,Robert Pohm,143,https://www.google.com/maps/contrib/113666895856635785498/reviews?hl=en
ChZDSUhNMG9nS0VJQ0FnSURBbVBpQUh3EAE,Super place for the tourists.,8 years ago,2025-01-24 12:46:29.297032,5.0,Lutfar Rahman Lipon (Lipon71),0,https://www.google.com/maps/contrib/113430757412080278531/reviews?hl=en
ChdDSUhNMG9nS0VJQ0FnSUNlMmJmdTF3RRAB,Nice,2 years ago,2025-01-24 12:46:29.297032,4.0,sangita waman,0,https://www.google.com/maps/contrib/117902880325675958705/reviews?hl=en
ChdDSUhNMG9nS0VJQ0FnSURYaDhtTDVBRRAB,"The person on the phone seems keen to do the right thing but is dramatically lacking in listening skills, she systematically interrupts me, I never manage to finish asking a question and she systematically answers sideways and imprecisely to the questions I try so hard to answer. although bad to pose, but which I never managed to pose. My interlocutor seems to know better each time, and to imagine the questions I am going to ask. Oops, missing the point. It’s a shame, all this doesn’t give a very good image of the Louvre in the end.",2 months ago,2025-01-24 12:46:29.298031,1.0,Hélène Astier,27,https://www.google.com/maps/contrib/116753330585134089595/reviews?hl=en
ChdDSUhNMG9nS0VJQ0FnSUNwakt6ZnJRRRAB,"Upon entering the office, one is warmly greeted by a dedicated team who share a common passion for art and culture. Members of the Société des Amis du Louvre play an essential role in supporting the museum's activities, thus enabling the preservation and enrichment of its exceptional collections.  This office offers a wealth of information on current exhibitions, special events and educational activities organized by the Société des Amis du Louvre. It allows visitors to become more involved in the life of the museum, to become members and to contribute to its sustainability.  In addition to its practical role, the office of the Society of Friends of the Louvre creates a spirit of community among museum enthusiasts. It is a place where people who share a love of art can meet, exchange ideas and celebrate the beauty and richness of culture together.",a year ago,2025-01-24 12:46:29.298031,5.0,JNC,83,https://www.google.com/maps/contrib/109330283772396851158/reviews?hl=en
ChdDSUhNMG9nS0VJQ0FnSUNyejRQNGhRRRAB,"Since the Friends of the Louvre card does not maintain the conditions of access to the Museum for its members, it would be logical to extend its validity by 2 months. Thank you for offering it",6 months ago,2025-01-24 12:46:29.299031,5.0,Léone,27,https://www.google.com/maps/contrib/109793571531231283300/reviews?hl=en
ChdDSUhNMG9nS0VJQ0FnSUNyMnJQSjFRRRAB,"It would have been desirable to be informed by email that reservations were obligatory between July 1 and September 8, even for members of the Friends of the Louvre... this would avoid being turned away like a dirty person.",6 months ago,2025-01-24 12:46:29.300031,3.0,B. Badlesmere,1,https://www.google.com/maps/contrib/100947283308178323076/reviews?hl=en
ChdDSUhNMG9nS0VJQ0FnSURHc3ZTQnRRRRAB,"A very beautiful museum, a lot of art in one place is amazing. The size of the facility is impressive, you can spend a pleasant day there.",3 years ago,2025-01-24 12:46:33.469801,5.0,Irena Sikora,65,https://www.google.com/maps/contrib/102088062748550908628/reviews?hl=en
ChZDSUhNMG9nS0VJQ0FnSUNGbmZxTEN3EAE,"It is a pity that the museum is closed today, we have learned something else, we should check it through internet technologies so that we do not come in vain 🤣 …",a year ago,2025-01-24 12:46:33.470801,4.0,Baris,61,https://www.google.com/maps/contrib/105637629768320714171/reviews?hl=en
ChdDSUhNMG9nS0VJQ0FnSUNybTZUUWp3RRAB,"Turned away because I didn't have a reservation even though I have a Louvre card, another stupid measure if we take cards it's to avoid this so it's the last time I take this card, obviously this museum with too much money",6 months ago,2025-01-24 12:46:33.470801,1.0,Pascal Maillard,0,https://www.google.com/maps/contrib/106316157479766713804/reviews?hl=en
ChdDSUhNMG9nS0VJQ0FnSUNoem91UGxnRRAB,"I loved all the things you can see! It is a shame that most of the items on display are stolen from other cultures, and there is no information, signs or a guide on where to start the tour or how to walk it! I recommend taking a guided tour.",a year ago,2025-01-24 12:46:33.471801,5.0,Daniel Torres,92,https://www.google.com/maps/contrib/111142688243462516479/reviews?hl=en
ChdDSUhNMG9nS0VJQ0FnSUNCaHVDci13RRAB,"The membership card is a scam. Almost 1 month after being debited, card still not received.  Also note that these thieves start the membership year when you pay, not when you receive your card, so you're in for several weeks.  The contact form on the site is absolutely useless, I think it doesn't even send a message, or everyone doesn't care. The operators are probably deaf because they never answer the phone.",2 years ago,2025-01-24 12:46:33.471801,1.0,Hugo DENISSE,0,https://www.google.com/maps/contrib/109746160120319061900/reviews?hl=en
ChdDSUhNMG9nS0VJQ0FnSUMtNk1HVGl3RRAB,"Hello, I am reminding you once again, regarding my order of two annual subscription cards to the Louvre. I received an email on 04/10/2022 telling me to receive the card in 7 days... 22 days later, I still have not received anything, I tried to contact you by phone in vain, and no return from my previous message, I am extremely unhappy, even though the subscription was deducted from my account. Please call me back as soon as possible",2 years ago,2025-01-24 12:46:33.472801,1.0,Ronan Garnier,0,https://www.google.com/maps/contrib/102621923072763876532/reviews?hl=en
ChZDSUhNMG9nS0VJQ0FnSUNkdzk2VmJ3EAE,I went to the Friends of the Louvre office directly at the Louvre Museum. The lady at the reception is very welcoming. She made my card and we talked throughout the process of making my subscription. Very nice welcome.,11 months ago,2025-01-24 12:46:33.473802,5.0,bskdkdld,47,https://www.google.com/maps/contrib/113079891581325901805/reviews?hl=en
ChdDSUhNMG9nS0VJQ0FnSUQtbGY2ZjJnRRAB,"No professionalism. I ordered a Friends of the Louvre card online on November 10, but I still have not received it. I tried to contact the company via their two numbers, I even filled out the form on the site, no response.",2 years ago,2025-01-24 12:46:33.473802,1.0,Manel Zahaf,0,https://www.google.com/maps/contrib/111801114408711072024/reviews?hl=en
ChdDSUhNMG9nS0VJQ0FnSUNCN0o3VTF3RRAB,"Good welcome, good advice regarding the purchase of an annual “friends of the Louvre” card",2 years ago,2025-01-24 12:46:33.473802,5.0,Odile Firenze,67,https://www.google.com/maps/contrib/117272881311801035300/reviews?hl=en
ChZDSUhNMG9nS0VJQ0FnSURoeWFyMFdBEAE,"It’s a labyrinth that leads to poetry. I still haven't gone around it, and I'm dreading this moment, because I would like this immensity to be endless. This place is an inestimable opportunity which provides access to the best that humans have been able to give. THANKS.",a year ago,2025-01-24 12:46:33.474801,5.0,S AG,0,https://www.google.com/maps/contrib/105341310474083391246/reviews?hl=en
