name,landscape and content,suitable activities,atmosphere,latitude,longitude,x,y,id
Colonne Médicis,"A tall, solitary Doric column attached to the Bourse de Commerce, surrounded by a park. Interior access is unavailable despite historical interest.","Sightseeing, photographing the column and park, observing architectural details, visiting during day or night for varied views.",Quietly historical with a mix of curiosity and slight disappointment. The park adds a pleasant contrast to the column’s imposing structure.,48.8625261,2.3429954,651799.1525560567,6862699.771155821,516
Richard Lenoir Green Belt - Bréguet-Sabin Square,"Lush gardens and green spaces following a canal-like stretch, with pleasant walking paths and occasional animations.","Walking, strolling, and enjoying community animations or events in the gardens.","Mostly pleasant and lively, though some visitors note disruptions from homeless populations.",48.8575466,2.3712349,653866.4770669932,6862129.223721404,517
Louve Capitoline,"Bronze statue of the Capitoline Wolf nursing Romulus and Remus, symbolizing Rome's foundation. Features historical and mythological themes, with comparisons to Parisian landmarks.","Viewing the sculpture, reflecting on Roman mythology, comparing replicas, exploring the surrounding square, and engaging with historical symbolism.","Culturally reverent with awe for Rome's heritage, pride in historical significance, and a slightly disorienting yet immersive vibe in the square.",48.85001,2.3438789,651852.4045263323,6861307.5527544655,518
Street Art Graffiti Fresque Femme Pensive,"Monumental, vibrant street art featuring large murals like 'Femme Pensive' and works by artists such as Shepard Fairey. Themes include contemplation, light, and social messages, with diverse pieces clustered around Boulevard Vincent Auriol and the 13th arrondissement.","Walking tours to explore street art, photography of colorful murals, and discovering hidden or notable pieces like 'Rise Above Level' in the area.","Vibrant, inspiring, and visually dynamic. Visitors describe it as eye-catching, brilliant, and a must-see, with an uplifting yet contemplative energy from the art's scale and themes.",48.8265903,2.3601805,653027.5244881479,6858693.710671756,519
Fountain of the Four Seasons,"Large monumental fountain with intricate details and historical sculptures glorifying Louis XV. Features wide, ornate design and recent renovations restoring visibility.","Photographing the fountain's grandeur, admiring architectural details, and combining visits with nearby attractions like the Maillol Museum.","Majestic yet polarizing; blends historical grandeur with occasional neglect (dirtiness), creating a mix of awe and slight disappointment.",48.8546948,2.3251279,650480.9004957643,6861840.054986659,520
Fontaine des quatre saisons,"A beautiful fountain with detailed carvings and sculptures located in Square Marigny, surrounded by grassy areas.","Resting on the grass, eating crepes, and photographing the fountain and its surroundings.","Relaxed and peaceful, offering a calm environment for unwinding amidst scenic beauty.",48.8546948,2.3251279,650480.9004957643,6861840.054986659,521
La Fresque du Climat,"Large-scale climate education through visual murals and workshops. Focuses on raising awareness about environmental issues with 200,000+ participants. Combines art and science for impactful messaging.","Participating in interactive workshops, collaborative climate awareness activities, and group discussions to understand environmental challenges.","Engaging, educational, and collaborative. Friendly staff fosters a space for reflection and action, though decentralized organization may cause logistical challenges.",48.8683647,2.3662174,653507.9977988686,6863335.0537966,522
Statue de Corneille,"Stone statue of French writer Pierre Corneille, situated near the Pantheon. Thematic focus on literary and historical significance, with modest visual prominence.","Quick photo stop, strolling while exploring Parisian landmarks, or combining with visits to the Pantheon.","Quiet, understated presence blending into the historic surroundings. Cultural and intellectual vibe tied to Corneille's legacy, though not a bustling attraction.",48.8467224,2.3458067,651990.8388510089,6860940.82952551,523
Paroisse orthodoxe Sainte-Trinité,Small Russian Orthodox church with a cozy ambiance.,Visiting the church.,Cozy and exceptional.,48.8263296,2.291159,647960.1666446519,6858707.997556292,524
Moulin Radet,"Historic windmill in Montmartre, one of two remaining. Features charming architecture and scenic presence, blending historical significance with picturesque surroundings.","Evening visits for ambiance appreciation, sightseeing, and historical exploration of Montmartre's iconic landmark.","Suggestive, quaint, and historically rich, evoking a blend of charm and cultural heritage in a serene setting.",48.8873896,2.3371237,651391.5972659176,6865468.017097636,525
Calouste Gulbenkian Foundation - Delegation in France,"Cultural space with a beautiful garden, showcasing exceptional art collections and Portuguese creativity. Features a mix of museum exhibits and serene outdoor areas in the 7th arrondissement.","Exploring art collections, enjoying the garden, attending cultural events, and engaging with Portuguese creative works in a compact, accessible setting.","Warm, friendly, and welcoming environment with a human-scale, intimate feel. Relaxed and pleasant ambiance suitable for quiet cultural appreciation.",48.8501757,2.3269332,650609.0789366926,6861336.443109684,526
Intendant Garden,"Well-kept garden with animal presence (rabbits, birds), historical ties to Hôtel National des Invalides, and manicured greenery. Features thematic elements from its 1980 creation.","Relaxing, meditating, observing animals, exploring serene pathways, and discovering quiet green spaces for personal respite.","Tranquil, zen-like environment with a peaceful vibe. Described as beautiful and calming, blending natural serenity with subtle liveliness from wildlife.",48.85443189999999,2.3135929,649634.2807567234,6861818.118647237,527
Fontaine du Palmier,"Neoclassical fountain with victory columns, statues, and historical significance from Napoleon's era. Features intricate design elements like a palm tree-shaped column and mythological figures.","Casual visits, photography, and impromptu stops during city walks. Observing architectural details and historical context.",Grand yet understated historic vibe blending with Parisian streets. Lively due to central location but retains classical elegance.,48.85747019999999,2.347319,652111.6974116211,6862134.967210241,528
Le charme parisien des passages couverts,"19th-century arcades with glass roofs, historic galleries like Verot Dodat, and boutique shops. Features architectural details and sheltered walkways.","Strolling through passages, exploring shops, sightseeing historic architecture, and window-shopping at luxury stores.","Charming, nostalgic, and enchanting with a touch of Parisian elegance. Quiet wonder blended with historic allure.",48.8630797,2.3397798,651563.7616815066,6862763.294601366,529
Assemblée Nationale - Immeuble Chaban-Delmas,"Iconic building with magnificent architecture, noted for its beauty and grandeur. Features prominent political significance as part of the National Assembly complex.","Sightseeing, admiring architectural details, attending events like speech competitions, and exploring the exterior surroundings.","Grand, awe-inspiring, and formal, with a mix of historical reverence and political gravity noted in reviews.",48.8608488,2.3156694,649792.8256677261,6862530.297323758,530
Le cavalier Romain,"Classical statue of a man with a horse, located near Avenue Jacques. Features beautiful surroundings and a restaurant.","Viewing the statue, exploring the area across Avenue Jacques, dining at the restaurant.","Amazing and visually appealing, with a welcoming vibe highlighted by great restaurant service.",48.8592014,2.2926825,648104.7529366598,6862361.982809396,531
L’araignée rouge de Calder,"Imposing 15-meter red steel sculpture by Calder, resembling a spider. Features bold geometric forms and vibrant color. Installed in 1976 at La Défense, contrasting with modern architecture.","Admiring the sculpture's scale and design, taking photos, exploring its interaction with La Défense's urban environment.","Awe-inspiring due to its size and artistry, though some note dissonance with its industrial surroundings. Mixes admiration for Calder's work with mild critiques of its setting.",48.89131949999999,2.2415787,644389.7271225742,6865968.050308729,532
Statue de Pierre-Augustin Caron de Beaumarchais,"Bronze statue of Pierre-Augustin Caron de Beaumarchais, depicted holding a quill and book. Features detailed craftsmanship, including firm stance and symbolic elements. Honors his literary legacy (plays like <>), social influence, and role as a playwright.","Admiring the sculpture's artistry, reflecting on Beaumarchais's literary works, photographing the statue, and contemplating historical quotes engraved nearby.","Intellectual and contemplative, with a focus on Beaumarchais's contributions to literature and social thought. Quiet, reflective vibe suitable for appreciating art and history.",48.8535601,2.3671306,653561.7915396407,6861688.365202678,533
Statue of Marie Emile Fayolle,"Imposing bronze statue of Marshal Marie Émile Fayolle, situated in front of the Army Museum and Hôtel des Invalides. Depicts a prominent French military figure with historical significance.","Photographing the statue, appreciating military history, and brief historical reflection while visiting nearby landmarks.","Dignified and traditional, with a focus on military heritage. Quiet and respectful due to its location near historic sites.",48.853651,2.3130917,649596.7503401287,6861731.6097506415,534
Fountain of Peace and the Arts,"Neoclassical fountain featuring elegant Greek-inspired design, thematic elements representing Sciences, Arts, and Agriculture. Classic architecture with decorative sculptures and structured aesthetics.","Sightseeing, architectural appreciation, photography. Brief stops to admire historical and artistic details.",Serene yet sophisticated ambiance with a refined historical vibe. Some visitors note visible wear requiring renovation.,48.849504,2.3329163,651047.4887191325,6861258.030750594,535
La Danse Triomphale de Pallas Athénée,"Statue depicting the Triumph of Pallas Athena through Greek mythology, located in a small park near the Eiffel Tower. Features resin craftsmanship and symbolic victory dance imagery.","Photography with Eiffel Tower views, admiring statue details, and reflecting on mythological themes.","Awe-inspiring and contemplative, blending artistic appreciation with a peaceful park setting near a major landmark.",48.8623005,2.2919861,648056.7499180748,6862707.032621804,536
Paris Urban Adventures,"Historic and artistic neighborhoods like Montmartre and the Left Bank, featuring local bistros, hidden streets, street art, cheese shops, and landmarks with cultural and historical storytelling.","Guided walking tours exploring art, history, and local life; cheese and beer tastings; interactive cultural experiences; visiting bistros and street art sites.","Friendly, immersive, and engaging vibe with knowledgeable guides, blending historical insights with local culture in a lively, enjoyable, and personalized setting.",48.8533675,2.3621824,653198.5411713469,6861669.871238643,537
Passage Bourg L'abbé,"Covered passage with 19th-century architecture, wood carvings, and historic details. Features artisan shops like a carpenter and antique dealer. Described as small, charming, and visually distinctive with old-world character.","Strolling through the passage, admiring architecture and carvings, exploring niche shops, and appreciating quiet historic charm in a bustling area.","Intimate, peaceful, and timeless with old-world charm. Blends quiet nostalgia and subtle neglect, offering a serene escape despite occasional underwhelming notes.",48.864537,2.350738,652369.0105897252,6862918.66860129,538
La Quatrième Pomme de Frank Scurti,"Large stainless steel apple sculpture (1m diameter) with a bite mark, referencing Charles Fourier's utopian ideals. Situated in a pedestrian-friendly, tree-lined area near Place de Clichy. Combines modern art with historical symbolism.","Walking, photographing the sculpture, contemplating its utopian symbolism, exploring Place de Clichy's lively surroundings.","Quirky and contemplative, blending artistic originality with a touch of whimsy. Vibrant yet relaxed due to its pedestrian setting and historical context.",48.884494,2.3297694,650849.5898737636,6865150.5961998375,539
Angel Bear,"A 7-10m-tall red bronze bear sculpture with wings by Richard Texier, described as peculiar yet impressive. Features abstract or weathered elements, sparking debate over its artistic merit versus decorative purpose.","Quick photo opportunities, brief appreciation while passing through Gare du Nord, or pausing to observe its unique design.","Polarizing yet intriguing; blends awe for its scale and artistry with lighthearted debate over its unconventional, whimsical appearance.",48.8801083,2.3548347,652683.6918341266,6864647.622935945,540
"Joan of Arc, liberator of France","Bronze statue depicting Joan of Arc standing with sword and flag, emphasizing her role as a warrior and national heroine. Features historical and artistic elements tied to French liberation.","Historical learning, art appreciation, photography. Visitors explore her legacy and admire the statue's details.","Reverent and proud, evoking admiration for Joan of Arc's bravery. Mixes artistic beauty with historical solemnity.",48.8383253,2.3570348,652807.2121951013,6860000.388537244,541
Terrain de Rugby de l'Hippodrome d'Auteuil,"Artificial turf field in a well-maintained sports area within a pleasant environment, though currently affected by post-Olympic closures and missing athletics track.","Playing football or rugby, participating in sports sessions, and watching rugby training.",Mixed: welcoming staff and pleasant environment contrast with safety concerns like thefts and indifferent security.,48.84983099999999,2.2554075,645360.1737995092,6861345.2324711,542
Fontaine du Bassin Soufflot,"Historic fountain with a bronze sculpture of a woman, children, and mythical creatures, surrounded by a tropical-like park near Luxembourg Gardens. Designed by Gabriel Davioud in 1862.","Leisurely walks, viewing sculptures from a distance, relaxing in the park, enjoying scenic overlooks.","Bustling yet scenic, blending urban energy with serene garden views. Crowded but visually captivating.",48.8474066,2.3405982,651609.2478023341,6861020.085221759,543
Square of Passy,Green space bordering woods with views of Auteuil racecourse. Features a café and proximity to swimming pool entrance.,"Swimming (Auteuil Longchamps pool), enjoying drinks at café, relaxing in scenic greenery near racecourse.","Mostly pleasant and friendly (café staff), but mixed with reports of drug presence and underwhelming energy for some visitors.",48.857433,2.2623498,645877.4965830358,6862185.716338825,544
Statue Auguste Comte,"Bronze statue of philosopher Auguste Comte, founder of positivism, located near Place de la Sorbonne and philosophical bookstores. Features detailed craftsmanship with historical and academic significance.","Taking photos, leisurely strolls, resting, exploring nearby academic landmarks, and brief philosophical reflection.","Intellectual and serene, with a contemplative vibe due to its scholarly surroundings and quiet, peaceful setting.",48.8487631,2.3420205,651714.878922454,6861170.044174706,545
Square Claude-Nicolas-Ledoux,"Small public square with shaded and sunny areas, greenery, surrounded by noisy avenues. Lacks amenities like toilets or Wi-Fi. Features benches and garden elements near the Catacombs.","Relaxing, reading, eating lunch, quiet sitting. Limited by dirty benches and lack of facilities.","Generally quiet and calm, offering a respite from city noise. Mixed reviews: some feel unsafe, others find it peaceful and undisturbed.",48.834366,2.3314248,650923.7889028213,6859575.768822804,546
Orangery,"Features stunning gardens with roses, peacocks, and large green spaces. Includes Monet's iconic water lily paintings in a beautiful building within Bagatelle Park.","Photography, relaxing walks, enjoying outdoor concerts, and viewing art exhibitions like Monet's works. Ideal for sunny afternoons and seasonal visits.","Peaceful, picturesque, and culturally enriching. Visitors describe it as relaxing, beautiful, and a pleasant escape with a mix of natural and artistic charm.",48.8684377,2.2455727,644658.263708426,6863420.965382999,547
Tour de l'horloge,"Historic clock tower integrated into Gare de Lyon station's architecture, featuring a prominent large clock. Surrounded by a grand train station with ornate design and public squares.","Photographing the clock tower and station facade, exploring transit connections, admiring architectural details, and observing bustling station activity.","Impressive and vibrant, blending awe for historic architecture with the lively energy of a major transportation hub. Described as 'superb' and 'magnificent' by visitors.",48.8446917,2.3729436,653980.493563458,6860698.87811201,548
Marshal Ney Monument,"Bronze statue of Marshal Michel Ney, a Napoleonic military leader, depicted dynamically with a raised sword. Historical significance as his execution site. Artistic design praised for imposing style and detailed representation.","Historical reflection, photography (especially at sunset), literary-inspired visits (Hemingway reference), appreciating artistic sculpture details.","Grand, solemn, and reverent. Inspires awe for bravery and history, with a dignified tribute to Ney's legacy.",48.8400288,2.3363706,651292.1145580019,6860202.348233148,549
Paroisse Saint Laurent,"Historic parish with a large parking lot, bright interiors, and notable organ. Features spiritual spaces and community-focused areas. Described as 'very pretty' with simple yet grand architectural elements.","Attending faith teachings, communal worship, Saturday gatherings, parking access, and participating in religious events like communion.","Lively, spiritual, and communal. Combines simplicity with vibrancy, frequented by diverse visitors. Clean environment with a mix of reverence and casual engagement.",48.8746866,2.358665,652959.7026283012,6864042.477082922,550
Pavillon de la trémoille,"Historic palace structure with stunning architecture, part of the Louvre complex. Features immense, spectacular design and iconic beauty tied to pre-Revolutionary France.","Admiring exterior views, photographing the grand entrance, visiting the museum, and appreciating architectural details.","Awe-inspiring, majestic, and steeped in historical grandeur, evoking fascination and admiration for its iconic presence.",48.8603836,2.333122,651072.8000906782,6862467.615571512,551
Statue équestre de Jeanne d'Arc,"Equestrian statue of Joan of Arc, noted for its beauty and historical symbolism as a representation of Lorraine. Features a striking bronze figure on horseback in a public space.","Walking past or discovering the statue during a stroll, observing details up close, reflecting on historical significance.","Inspirational and reverent, evoking a sense of historical connection and admiration for Joan of Arc's legacy through its dignified presence.",48.8638884,2.3321991,651008.3866824002,6862857.892111573,552
Notre-Dame d’Espérance,"Small church featuring beautiful stained-glass windows, part of the Villemomble parish. Described as having historical significance for some visitors, with mentions of childhood memories.","Scouting activities, community gatherings, parish events, and group worship. Suitable for scouts and those participating in local religious or community programs.","Warm, welcoming environment with a strong sense of community. Visitors highlight a friendly and traditional vibe, emphasizing its role as a gathering place for scouts and parish members.",48.8557668,2.3745335,654106.9280642091,6861929.402895168,553
L'Eau et les Rêves - Péniche Restaurant - Nature et Jardins,"Riverboat/barge with a library, indoor/outdoor spaces, seasonal decor, and greenery. Described as 'unique,' 'magnificent,' and 'pretty' by reviewers.","Dining (brunch, dinner), drinks, reading, attending author events. Suitable for casual meals, coffee, or relaxing with a book. Some mention 'decent service' but note 'disappointing brunch' costs.","Cozy, eclectic mix of vibrant and relaxed vibes. 'Happy and bright' with 'incredible atmosphere,' though some note inconsistent service. 'Timeless' and 'pleasant' for unwinding.",48.8258574,2.343135,651775.4763112164,6858622.495821287,554
Fontaine de la Place de l’Estrapade,"Small square featuring a historic fountain, garden, and courtyard near the Pantheon. Notable as a filming location for 'Emily in Paris', with mentions of its charming design and proximity to landmarks.","Relaxing in quiet surroundings, taking photos (especially for fans of 'Emily in Paris'), visiting nearby Pantheon, and enjoying peaceful moments.","Tranquil, quaint, and slightly touristy with a mix of local charm and pop culture relevance from its Netflix series association.",48.8453366,2.3447241,651910.113375816,6860787.401010868,555
Palais-Royal - Musée du Louvre,"Grand metro station near Louvre Museum and Palais-Royal, featuring magnificent architecture. Includes chic courtyards, sculptures, and historical ambiance. Some references to demonstrations and disruptions.","Tourist transit (Louvre access), sightseeing, leisurely strolls, exploring courtyards, attending events or demonstrations.","Mix of bustling tourist energy and serene elegance. Described as impressive, relaxing, yet occasionally chaotic with service complaints and disruptions.",48.86292599999999,2.33603,651288.5249991156,6862748.511123883,556
Fontaine de Diane,"A fountain with an elegant Diana sculpture, situated in a garden near Champs Elysees. Features include a central basin and lawn, though some note maintenance issues like non-functioning water or debris.","Relaxing, quiet strolls, enjoying nature, and unwinding in a peaceful garden setting away from urban bustle.","Tranquil and serene, offering a hidden respite in the city, though slightly diminished by occasional neglect or lack of upkeep.",48.8673566,2.3180107,649970.8450860003,6863252.424003356,557
Statue de Vauban,"Historic bronze statue of Vauban in Avallon's town center, designed by Auguste Bartholdi. Situated near medieval architecture and Promenade des Terreaux, blending artistic heritage with scenic town views.","Walking tours of medieval Avallon, photographing statues, dining at nearby restaurants like 'les cocottes', exploring Morvan gateway landscapes.","Quaint, historic charm with cultural significance. Mix of artistic appreciation and relaxed exploration, though some find it unremarkable. Generally peaceful with occasional crowds.",48.8575475,2.3513765,652409.466897741,6862141.109201814,558
Jardin Sauvage Saint Vincent,"Wild garden with native flora, naturally overgrown vegetation, historic vineyards, and a rustic, unmanicured aesthetic in central Paris.","Walking, climbing paths, exploring natural vegetation, and enjoying secluded green spaces near Montmartre.","Peaceful, authentic, and serene; a hidden natural retreat offering calm amidst urban surroundings.",48.8882491,2.3410938,651683.5135462115,6865561.151955993,559
Fontaine Molière,"Aesthetic marble fountain with a statue of Molière, featuring allegorical sculptures. Restored, well-maintained, and situated at a historic intersection near Comédie Française.","Sightseeing, photography, appreciating classical art and history, brief visits during walks in central Paris.","Reverent, artistic, and serene; blends historical significance with quiet admiration for Molière's legacy.",48.8655242,2.3366788,651338.5493619232,6863037.009755743,560
Fontaines Sphérades,"Modern artistic fountains with moving metal spheres in a baroque-style garden. Features Pol Bury's kinetic installations, contrasting with traditional architecture. Some reviews note construction disruptions or dry fountains.","Photography, selfies, and souvenir photos. Relaxing while observing kinetic art. Ideal for less crowded visits compared to major monuments.","Relaxing and artistic, with a mix of modern creativity in a historic setting. Peaceful yet occasionally disrupted by maintenance issues or crowds.",48.86397239999999,2.3369916,651360.0470982057,6862864.269427352,561
Viaduct des Arts,"Elevated walkway with greenery, historic pink brick vaults housing artisan ateliers, cafes, and craft workshops. Combines urban architecture with lush surroundings, showcasing French craftsmanship.","Leisurely strolls, exploring artisan workshops, coffee breaks, appreciating craftsmanship, and enjoying elevated views above bustling streets.","Serene, artistic, and slightly upscale. Mixes creative energy with tranquility, offering a unique escape from typical Parisian bustle.",48.84484459999999,2.3809199,654565.9933724711,6860711.260085462,562
Delicious Café,"Cozy café offering Indian food, paninis, couscous, and homemade fast food. Features a takeaway concept with ready meals and nutritious dishes at fair prices.","Quick lunches, takeaway meals, breaks during work hours, and affordable dining without breaking the bank.","Friendly, fast-paced, and welcoming with helpful staff, lively music, and a casual vibe ideal for on-the-go visitors.",48.8702742,2.3016049,648770.2540202371,6863587.356892585,563
