name,landscape and content,suitable activities,atmosphere,latitude,longitude,x,y,id
Institut de France,"Historic academic institution with an iconic dome, grand architecture, and France's oldest public library (Bibliothèque Mazarine). Features ornate interiors, two reading rooms, and houses five prestigious academies. Exterior admired for its imposing design.","Attending conferences or debates, studying/researching in quiet libraries, guided tours of historic spaces, admiring architecture, and exploring limited Saturday access to libraries. Ideal for academic or cultural events.","Scholarly, serene, and awe-inspiring. Visitors note a quiet, intellectual ambiance with reverence for history and excellence. Some describe it as 'Harry Potter-style' or 'mind-boggling' for its grandeur.",48.8572862,2.3371276,651363.7829308972,6862120.737058522,728
Canal Saint-Martin,"Historic canal with picturesque waterways, iron footbridges, and functioning locks. Features a mix of scenic views, quaint neighborhoods, and remnants of old Paris, blending industrial heritage with natural charm.","Walking, picnics, boat tours, jogging, and relaxing strolls. Ideal for socializing, people-watching, and enjoying ice cream or quiet moments by the water.","Peaceful yet vibrant, with a local, laid-back vibe. Combines cozy charm, lively crowds, and a wavy, artistic energy reflective of Parisian authenticity.",48.8651816301218,2.367339324250129,653587.4605116379,6862980.460421574,729
Paroisse Notre-Dame de Lorette,"Neoclassical church featuring intricate architecture, historical significance, and detailed interior decorations. Notable for its artistic frescoes and unique Roman-inspired design, though some areas require restoration. Combines religious elements with Parisian charm, located near a metro station.","Quiet reflection, attending mass, photography of neoclassical details, and neighborhood exploration. Ideal for art appreciation and discovering hidden gems while walking. Limited tourist crowds make it suitable for peaceful visits.","Tranquil and peaceful with a spiritual ambiance. Offers a mix of historic charm and artistic inspiration, though occasional renovation disruptions may affect serenity. Feels less touristy, creating an authentic local experience.",48.8762321,2.3389057,651511.8801883666,6864226.278415543,730
Cité de l’architecture et du patrimoine,"Features architectural exhibits including medieval to modern French designs, full-sized cathedral casts, scale models, and themed exhibitions. Located near Trocadéro with views of the Eiffel Tower. Focuses on design, heritage, and historical reproductions.","Exploring architectural history, viewing exhibitions, photography of Eiffel Tower vistas, interactive games (e.g., Viollet-le-Duc), and studying detailed models. Suitable for leisurely walks and educational visits.","Mostly peaceful, inspiring, and uncrowded. Described as a hidden gem with a relaxed vibe, though some mention strict security. Blends historical grandeur with modern curation.",48.8627013,2.2886617,647813.2642659845,6862753.790009424,731
Square de la Roquette,"Small, green park with playgrounds, sports facilities (basketball, football), circular paths, and floral displays. Surrounded by buildings, offering a protected urban oasis.","Children’s play, sports (basketball, football), relaxing on benches, picnics, and casual strolls. Ideal for families and casual visitors.","Lively yet calm, family-friendly, and safe. Mixes vibrant energy from kids with a peaceful, hidden-garden vibe in the city.",48.8594985,2.3844437,654837.3004117042,6862338.62291593,732
Parc Sainte-Périne,"Green park with well-maintained gardens, shaded/sunny areas, playgrounds, and historical estate elements. Features fitness equipment, dog-friendly zones, and scenic natural spaces nestled between urban buildings.","Picnics, playground play, fitness workouts, dog walking, family relaxation, quiet lunches, and resting on benches or grassy areas.","Peaceful, clean, and family-friendly with a secluded, uncrowded vibe. Quiet during most hours but occasionally noisy in afternoons; described as serene and sheltered.",48.8444425,2.269126,646361.2925039096,6860736.683530678,733
Jardin Catherine-Labouré,"Secluded garden with lush greenery, grapevines, flowerbeds, and shaded seating. Features a playground, grassy areas, and no-dog policy. Small, well-maintained green space hidden in the 7th arrondissement.","Picnics, children’s play, reading, relaxing on benches or grass, photography, quiet family time, and small gatherings.","Peaceful, tranquil, and family-friendly with a local neighborhood vibe. Offers a serene escape from city bustle while feeling welcoming and safe.",48.8510552,2.3209919,650173.9466947606,6861437.967659114,734
Square Sarah Bernhardt,"Manicured gardens, playgrounds with sand pits, and shaded green spaces. Features include a round playground, giant sand pit, trees, and well-maintained flower beds. Family-oriented with play areas for toddlers to older children.","Children's play (0-12 years), family activities, relaxing on benches, enjoying sunny afternoons. Ideal for toddlers and kids with playgrounds, sand pits, and open spaces.","Peaceful yet vibrant, blending urban energy with calm. Described as clean, lively, and family-friendly, though some note occasional smokers. Overall welcoming and playful.",48.8493447,2.4040196,656265.013707244,6861198.586925081,735
Tomb of Dalida,"A striking cemetery featuring Dalida's extravagant, well-maintained tomb adorned with flowers and sculptures. Includes other notable graves, Montmartre views, and artistic sepulchres. Combines historical reverence with visual grandeur.","Paying homage, photography, quiet reflection, self-guided cemetery tours, and combining visits with Montmartre exploration.","Emotionally resonant mix of reverence and curiosity. Peaceful yet occasionally crowded, blending tranquility with tourist buzz. Reflects Dalida's legacy through a mix of melancholy and admiration.",48.8862526,2.3324325,651046.5331006249,6865344.487494327,736
Passerelle Léopold-Sédar-Senghor,"Pedestrian bridge with views of the Seine, Eiffel Tower, and Musée d'Orsay. Features love locks on railings, sleek design, and historical significance (previously Solférino bridge). Connects Tuileries Garden to Musée d'Orsay.","Walking, photography, romantic gestures (placing love locks), sunset viewing, leisurely strolls between museums, and people-watching.","Romantic, vibrant, and nostalgic. Mixes calm river views with lively crowds. Emphasizes love and connection, with emotional vibes from couples, artists, and historic locks.",48.8618935,2.324697,650456.1293685386,6862640.756793562,737
agronomie tropicale - René Dumont Garden,"Tropical garden with abandoned structures, Asian-inspired elements, ruins, and overgrown vegetation. Features historical remnants like a human zoo and colonial-era buildings. Mixes decaying architecture with lush greenery and quiet ponds.","Quiet walks, photography, picnics, exploring ruins, historical reflection, and discovering hidden paths. Ideal for solitude seekers and nature lovers.","Serene yet eerie, blending calm with haunting decay. Mysterious, forgotten ambiance with a mix of tranquility and somber historical undertones. Peaceful but slightly rundown.",48.8346712,2.4683835,660977.1863199156,6859533.300951294,738
Jardin Atlantique,"Rooftop garden atop Montparnasse station with greenery, brutalist architecture, tennis courts, and children's areas. Features 90s design, high-rise surroundings, and occasional maintenance issues (rats, neglected spaces).","Relaxing, tennis, photography, short walks, escaping city noise, waiting for trains, and children's play (despite upkeep concerns).","Quiet, retro, and surprisingly peaceful urban oasis; hidden but occasionally intimidating. Mixes serene escape with slight neglect, offering calm amid bustling surroundings.",48.8398009,2.3188544,650006.3046797981,6860187.955646073,739
Carré Rive Gauche,"Historic streets with art galleries, antique shops, and elegant cafes. Features vibrant architecture, central Parisian charm near the Louvre, and romantic spots. Mentions of beautiful interiors and artistic collections.","Dining (crepes, escargots, coffee), exploring antique shops and galleries, strolling, people-watching, enjoying romantic evenings. Visiting cafes like Cafe Voltaire.","Vibrant, elegant, and romantic. Mixes lively energy with historic charm. Friendly service noted, though occasional mentions of rudeness. Described as atmospheric, fascinating, and bustling.",48.8565054,2.331759,650969.1530985695,6862037.239208655,740
Maison de Balzac,"Historic house with English-style gardens, Balzac's personal artifacts, artworks, and literary exhibitions. Features a café, hidden garden, and views of the Eiffel Tower. Focuses on La Comédie Humaine and 19th-century Parisian life.","Guided cultural tours, reading in the garden, café visits, viewing exhibitions, and photography. Ideal for Balzac enthusiasts or quiet afternoons.","Peaceful, intimate, and nostalgic. Blends cultural immersion with serene garden escapes. Described as magical, relaxing, and a hidden gem away from city bustle.",48.8554541,2.2809102,647237.2590326782,6861953.120044743,741
Auberge Nicolas Flamel,"Historic 15th-century building with elegant, intimate dining spaces. Combines medieval architecture (oldest house in Paris) with modern culinary artistry. Features thematic decor linked to alchemist Nicolas Flamel.","Michelin-star dining, wine pairings, multi-course meals, celebrating special occasions, cultural/historical exploration of occult-themed Paris landmarks.","Romantic, intimate, and upscale with warm hospitality. Blends medieval charm with contemporary elegance. Guests describe it as cheerful, sophisticated, and memorably serene with flawless service.",48.8635423,2.3531534,652545.2985049364,6862806.611605869,742
Pont d'Iéna,"Iconic bridge offering direct views of the Eiffel Tower, spanning the Seine with strategic positioning for photography. Features neoclassical design, pedestrian access, and picturesque surroundings blending urban and riverine elements.","Photography (especially of the Eiffel Tower), leisurely walks, nighttime visits for illuminated views, and relaxing while enjoying scenic panoramas.","Bustling yet romantic, with lively energy from tourists and serene moments at night. Combines awe for landmark vistas with a festive, occasionally crowded ambiance.",48.8596908,2.2924599,648088.9090250566,6862416.545922847,743
Le Passe-Muraille,"A bronze sculpture depicting a man emerging from a wall, inspired by Marcel Aymé's short story. Features a half-embedded figure, blending surrealism with Montmartre's artistic heritage.","Photographing the statue, exploring Montmartre's streets, reading the story beforehand, and discovering hidden artistic gems during walks.","Whimsical and literary, with a quirky charm. Evokes curiosity and imagination, enhanced by its tucked-away location and connection to local folklore.",48.8875533,2.3380417,651459.0647885073,6865485.654871426,744
Paroisse Saint-Paul Saint-Louis,"Baroque-style Catholic church with Roman Catholic heritage, featuring stunning architecture, stained glass, domes, and historical ties to Victor Hugo. Known for its ornate interiors and religious significance.","Free visits, photography, attending concerts, quiet reflection, exploring Le Marais neighborhood, and admiring architectural details.","Peaceful, reverent, and awe-inspiring ambiance with a mix of spiritual serenity and historical grandeur, described as calm yet majestic.",48.8544675,2.3614508,653145.8484772232,6861792.615330625,745
Bassin de la Villette,"Large basin connected to a canal, surrounded by restaurants and urban greenery. Features a seasonal beach area, swimming zones with lifeguards, and boat rentals. Mixes natural water elements with city infrastructure.","Swimming, running, biking, boating, picnicking, and family-friendly relaxation. Popular for outdoor exercise and water-based recreation.","Relaxed, lively urban escape with a mix of leisure and activity. Visitors note a cool vibe in hot weather, though some mention overcrowding or water quality concerns.",48.88582365912981,2.374368890233236,654121.330799537,6865271.609406524,746
Eglise de la Sainte Trinité,"Impressive Roman Catholic church with neo-baroque interiors, grand architecture, and murals. Undergoing renovations with visible scaffolding but retains striking details like stained glass and a speakeasy behind the altar.","Attending Sunday evening mass, enjoying free Thursday concerts, quiet reflection in public gardens, and admiring architectural details during visits.","Peaceful yet vibrant during services; mix of spiritual awe and renovation disruptions. Youthful energy at masses, serene ambiance for contemplation, and historical grandeur despite ongoing works.",48.8772871,2.3313627,650959.6435634051,6864348.245405853,747
Pont de la Tournelle,Stone three-arch bridge over the Seine offering panoramic views of Notre Dame Cathedral and the river. Features old architectural charm with scenic backdrops of Parisian landmarks.,"Walking, photography, picnics, sunset viewing, meeting friends, and enjoying river cruises or quiet relaxation by the Seine.","Calm, romantic, and picturesque. Peaceful ambiance with lively summer evening gatherings, ideal for unwinding or capturing Parisian beauty.",48.8505531,2.3554212,652699.8776211338,6861360.964363289,748
Fontaine des Innocents,"Historic Renaissance fountain with intricate stone carvings, reconstructed features, and surrounding square. Notable as Paris's oldest monumental fountain, blending classical architecture with a lively urban setting near cafés and markets.","Photography, relaxing by the fountain, attending markets or events, people-watching, using it as a meeting point, and exploring nearby shops and cafés.","Mix of historic charm and vibrant energy; sometimes peaceful for relaxation, other times bustling with markets, crowds, or street performers. Occasional critiques of cleanliness or maintenance.",48.860647,2.3480327,652166.978186513,6862487.767670773,749
Parc de la Butte-du-Chapeau-Rouge,"Hilly park with gardens, trees, flowers, and scenic views of Paris. Features hidden-gem qualities, natural beauty, and artistic elements like sculptures. Described as fairy-tale-like with well-maintained greenery.","Relaxing, picnics, outdoor sports, festivals (e.g., Silhouette), movie screenings, promenades, and enjoying views. Suitable for quiet walks or workouts.","Calm, peaceful, and uncrowded. Offers serenity with occasional lively events. Described as a hidden gem with a relaxing vibe, though some note crowds on sunny days.",48.8818522,2.3989611,655921.3253807573,6864815.99714959,750
Square Saint-Lambert,"Compact green space with blooming flowers, well-maintained gardens, water fountains, playgrounds, sandpits, and vegetable plots. Features shaded seating areas and seasonal floral displays.","Picnics, relaxing, children’s play, sunbathing, jogging (short loops), and enjoying outdoor concerts or events. Ideal for families and quiet downtime.","Tranquil, family-friendly urban oasis offering peace amidst the city. Lively yet calm, with a cozy, clean, and safe vibe even when crowded.",48.842244,2.2969347,648399.9362617903,6860473.702983974,751
Parc Kellermann,"Pond with ducks, diverse flora, trees, and flowers. Features play areas, a small lake, and an outdoor pool. Proximity to Paris ring road noted but still described as scenic with varied greenery.","Picnics, family outings, children's play, swimming, sports (street workout), walking, meditation, and relaxing on lawns. Ideal for quiet lunches or nature breaks.","Quiet, calm, and hidden-gem vibe. Peaceful despite occasional traffic noise. Described as serene, non-touristy, and family-friendly with a relaxed, natural ambiance.",48.8189004,2.3547092,652618.8693019546,6857841.955235016,752
White Garden - Vegetarian Artisan Kitchen,"Bright, classy vegetarian restaurant with artistic food presentation, modern decor, and refreshing aesthetic. Focuses on quality vegetarian/vegan dishes in a visually appealing setting.","Dining for lunch/dinner, family gatherings, romantic evenings, vegetarian culinary experiences, and special occasions like celebrations.","Welcoming, upscale yet calm ambiance with friendly service. Vibrant, cozy vibe blending sophistication with warmth for casual or refined outings.",48.8645351,2.3545852,652651.2398411804,6862916.143540287,753
Jardin du Ranelagh,"Green spaces with playgrounds, statues (like Jean de la Fontaine), benches, and open lawns. Features include pony rides, ping-pong tables, and well-maintained gardens. Family-oriented with areas for kids and adults.","Picnicking, playground play, pony rides, ping-pong, exercising, relaxing on benches, and ball games. Ideal for families and casual gatherings.","Peaceful, family-friendly, and clean. Quiet on weekdays, moderately busy weekends. Combines lively kid-friendly energy with serene, well-kept surroundings.",48.8588747,2.2687763,646350.4895189615,6862341.6338723255,754
Harry's New York Bar,"Historic cocktail bar with vintage decor: burgundy velvet, wooden panels, Hemingway memorabilia. Birthplace of Bloody Mary and French 75 cocktails. Iconic New York-style ambiance blended with Parisian charm.","Enjoying classic cocktails, experiencing jazz nights, appreciating cocktail history, and soaking in literary connections (Hemingway).","Cozy, legendary vibe with intimate seating. Lively yet nostalgic, blending old-world charm (rustic décor) with energetic crowds. Service ranges from attentive to slow during peak hours.",48.8692018,2.3320688,651003.8254328307,6863448.780711984,755
La Maison Rose,"Iconic pastel-pink café nestled in Montmartre’s cobblestone streets, known for historic charm, artistic legacy, and proximity to Sacré-Cœur. Features quaint architecture and vibrant exterior.","Dining, photography of the iconic façade, enjoying coffee/drinks, casual strolls in Montmartre, and soaking in romantic ambiance.","Charming, cozy, and touristy with a mix of lively energy and occasional crowdedness. Friendly staff, though service quality varies. Blends historic allure with relaxed, romantic vibes despite mixed food reviews.",48.8879815,2.3396449,651577.0217648152,6865532.283906445,756
"United Nations Educational, Scientific and Cultural Organization (UNESCO)","Architectural marvel blending modernist and historical elements, featuring a Japanese garden. Focuses on global cultural preservation, education, and international collaboration. Notable for its auditorium and symbolic design.","Guided tours (e.g., with Julie Durand), attending conferences/events, exploring gardens, visiting auditoriums, and engaging with cultural exhibitions.","Inspiring, intellectually stimulating environment with a mix of professional diplomacy and serene garden spaces. Emphasizes global unity but noted for occasional service inconsistencies.",48.8496782,2.306109,649080.5121885482,6861294.353063413,757
Stade Sébastien Charléty,"Modern stadium with evening lighting, open design, and athletic tracks. Features multiple sports arenas, squash courts, and a brand-new track. Situated near central Paris and Cité Universitaire.","Attending football matches, athletics events, volleyball, squash, and family-friendly sports performances. Participating in running or sports activities on the track.","Lively, energetic, and welcoming with a family-friendly vibe. Evening events enhance excitement, though some note occasional overcrowding or maintenance issues.",48.8185279,2.3466506,652026.8291512069,6857805.403639709,758
Passerelle Debilly,"Steel pedestrian bridge over the Seine with panoramic views of the Eiffel Tower and river. Features love locks, historical monument status, and a blend of industrial design with romantic elements.","Photography (especially of Eiffel Tower), romantic walks, placing love locks, enjoying sunrise/sunset views, and strolling between key landmarks like Trocadéro.","Romantic, picturesque, and slightly nostalgic. Combines urban charm with serene river views, enhanced by the presence of love locks and quieter crowds compared to busier bridges.",48.8626298,2.2969258,648419.4661018375,6862740.409773597,759
Cité Internationale Universitaire de Paris,"Diverse international architecture with 40+ country-themed houses, lush green spaces like parks and lawns, and historic academic buildings. Features multicultural themes and student-centric facilities.","Exploring architectural styles, attending cultural/scholarly events, relaxing in parks, student networking, and enjoying multicultural exchanges.","Peaceful, international, and intellectually vibrant. Combines academic energy with serene green spaces and a welcoming, community-oriented multicultural environment.",48.8199761,2.3387146,651445.4783890762,6857971.275981604,760
Seine,"Scenic river flowing through Paris, featuring historic bridges, iconic landmarks, and sunset views. Surrounded by pedestrian paths, green spaces, and architectural grandeur like the Torcar. Central to the city's identity with a mix of natural beauty and urban landmarks.","River cruises (day/evening/night), leisurely strolls, photography, jogging along paths, family sightseeing, and enjoying panoramic views. Boat tours recommended for city perspectives.","Romantic, enchanting, and lively. Combines historic charm with vibrant urban energy, offering a magical, picturesque vibe with both tranquility and bustling city life.",48.8862376,2.3736627,654069.9107738732,6865318.047886771,761
Jardin des Serres d’auteuil,"Botanical garden with tropical greenhouses, diverse flora, ponds, waterfalls, and historic architecture. Features exotic plants, themed greenhouses, and connections to Roland Garros. Some areas noted as slightly dilapidated but rich in botanical variety.","Walking, photography, reading, relaxing, exploring greenhouses, picnics, and nature appreciation. Ideal for quiet visits, plant enthusiasts, and family outings.","Peaceful, serene, and tranquil with a hidden-gem vibe. Described as calm, magical, and slightly rustic, offering an escape from urban noise.",48.8463076,2.2521865,645120.1065174055,6860955.702197778,762
Stade Jean-Bouin,"Modern rugby stadium with striking architecture, a beautiful pitch, and compact design. Features proximity to PSG's Parc des Princes. Some reviews note accessibility challenges and closed stores during opening hours.","Attending rugby matches (e.g., Stade Francais, Paris Rugby 7’s), stadium tours, and sports events. Ideal for experiencing live games or combining visits with nearby attractions.","Electric during matches with passionate, rowdy fans; friendly local supporters. Vibrant during derbies but quieter compared to larger stadiums. Described as lively and engaging for sports enthusiasts.",48.8433145,2.2529449,645172.6129906827,6860622.375993288,763
Aquarium Tropical,"Compact tropical aquarium featuring diverse exotic species like seahorses, Madagascan wildlife, and colorful fish. Themed tanks, touch pools, and educational displays in a small, manageable space. Some tanks noted as outdated or needing maintenance.","Family-friendly visits with kids, educational exploration of marine life, interactive touch pools, leisurely viewing of aquatic exhibits, and affordable family outings.","Lively, child-friendly vibe with a mix of excitement and relaxation. Cozy and charming but occasionally crowded. Some visitors find it underwhelming due to its small size.",48.83552599999999,2.4092536,656637.5991277862,6859659.192710447,764
Square des Batignolles,"Charming park with lush greenery, old trees, a canal with ducks, flower beds, rocky waterfall, and grassy lawns. Features include birdlife, playgrounds, and a mix of natural elements within an urban setting.","Leisurely walks, picnics, jogging, relaxing on benches, birdwatching, children's play, and enjoying breakfast. Ideal for family outings and quiet contemplation.","Peaceful, tranquil, and magical oasis with a calm, family-friendly vibe. Feels like a hidden gem offering escape from urban bustle.",48.8875,2.3164794,649877.904104723,6865493.199195195,765
Baguett's Café,"Quaint, small cafe with modern/boho decor, offering trendy dishes like avocado toast, crazy croissants, matcha, and vegetarian options. Features cozy seating and vibrant presentation.","Brunch, breakfast, or quick lunch; enjoying specialty coffee/cappuccino; trying Instagram-worthy dishes; casual dining in a snug setting.","Cozy, lively, and welcoming with friendly staff. Combines charm with a social media-friendly vibe, though occasionally crowded with limited seating.",48.8652825,2.3365246,651327.0116468475,6863010.229694693,766
The Lion of Bartholdi,"Massive 22x11m lion sculpture by the Statue of Liberty's creator, integrated into a mountain. Offers panoramic views of Belfort and surroundings. Features historical significance tied to the Franco-Prussian War and sculptor Bartholdi.","Climbing to the terrace for views, exploring the citadel/museum, historical tours, photography, and enjoying city vistas. Access via stairs (challenging for some).","Awe-inspiring blend of historical reverence and natural grandeur. Peaceful yet monumental, with educational undertones from its symbolic wartime legacy and artistic heritage.",48.8575475,2.3513765,652409.466897741,6862141.109201814,767
