name,landscape and content,suitable activities,atmosphere,latitude,longitude,x,y,id
Museum of Hunting and Nature,"Eclectic mix of taxidermy, medieval armor, hunting artifacts, and contemporary art. Features dark, atmospheric displays, historical weaponry, and surreal installations like feathered caves. Combines natural history with artistic curation.","Exploring unconventional exhibits, attending themed events (e.g., BEAR party), interactive installations, and appreciating temporary art displays. Suitable for curious travelers and families.","Quirky, thought-provoking, and slightly macabre. Blends historical solemnity with surreal whimsy. Described as captivating, strange, and not for the faint-hearted.",48.8614056,2.3587005,652950.312628494,6862565.708406995,253
Wall of I Love You,"A wall featuring 'I love you' in 300+ languages, set in a small park with colorful tiles. Themed around love, multilingual expressions, and romantic visuals within Montmartre’s charming, artistic neighborhood.","Photo opportunities, sitting in the park, romantic moments, quick visits while exploring Montmartre, and Instagram/TikTok content creation.","Romantic, whimsical, and slightly crowded; blends charm with touristy energy, evoking warmth and universality of love in a bustling yet intimate setting.",48.8848037,2.338578,651495.8293116973,6865179.58605302,254
Musee Carnavalet,"Museum showcasing Paris' history through artifacts, medieval sections, and everyday life across centuries. Features art, historical objects, and well-maintained exhibits in a grand setting. Free entry with extensive collections spanning prehistory to modern eras.","Exploring historical exhibits, self-guided tours, reading detailed displays, photography of artifacts and architecture, budget-friendly cultural immersion, and leisurely discovery of Parisian heritage.","Calm, uncrowded, and engaging. Serene environment with a mix of awe (impressive collections) and relaxation (minimal crowds), fostering historical curiosity without rush.",48.8570669,2.3628579,653251.4257445491,6862080.812008487,255
Grevin Museum,"Features lifelike wax figures of global and French celebrities, historical figures, and interactive visual effects. Includes themed areas like a mirror light show and over 200 statues. Some outdated figures noted, but praised for its immersive, century-old Parisian charm.","Family-friendly photo ops with wax celebrities, interactive exhibits, and short visits. Combines well with city passes. Best for casual exploration, humor-driven engagement, and light entertainment rather than in-depth historical experiences.","Lively and entertaining with playful, crowded spaces. Mixes awe at realism with occasional disappointment in unrecognizable figures. Friendly staff enhance the experience, but queues and pricing may dampen moods. Generally fun, though divisive compared to Madame Tussaud’s.",48.8446069,2.3488422,652211.6596695536,6860703.765483039,256
Passage Jouffroy,"Historic covered passage with 19th-century glass ceilings, boutique shops (antiques, stamps, books), galleries, and nostalgic architecture blending past and present. Features elegant storefronts and artistic details.","Shopping for unique items, exploring galleries, dining in cafes, taking photos, and leisurely strolling through boutique-lined pathways.","Charming, nostalgic, and elegant with a mix of lively and tranquil vibes. Combines retro charm with a peaceful, old-world Parisian ambiance.",48.8723694,2.3421357,651745.2013767142,6863794.794888913,257
Conciergerie,"Gothic halls, royal palace remnants, and historical exhibits on the French Revolution. Features Marie Antoinette's cell and interactive tablet-guided tours showcasing medieval architecture and revolutionary history.","Guided historical tours, exploring revolutionary-era exhibits, combining visits with Sainte-Chapelle or Notre-Dame, and attending temporary exhibitions like Benin artifacts.","Immersive, somber, and historically rich. Blends awe for Gothic grandeur with haunting echoes of its prison past, creating a reflective yet educational environment.",48.8560114,2.3454953,651976.548012918,6861973.869039126,258
Pont Neuf,"Oldest stone bridge in Paris with iconic Seine River views, nearby parks, and historic features like the Henri IV statue. Features scenic vistas of landmarks like Notre Dame and Eiffel Tower.","Walking, river cruises, photography, sunset viewing, sightseeing landmarks, and boarding Vedettes tour boats.","Historic yet vibrant, blending romantic charm with lively crowds. Offers peaceful spots for relaxation amid bustling artistic and cultural energy.",48.8565827,2.3408875,651638.9946117416,6862040.20475953,259
Place de la Bastille,"Historic square featuring the July Column monument, open spaces, and occasional markets. Known for French Revolution significance, with remnants of historical context and urban greenery. Dominated by a grand column and surrounded by cafes.","Walking, relaxing on benches, exploring markets, enjoying street food (oysters, wine), evening gatherings, and observing street performances.","Lively yet relaxed mix of historical weight and casual urban energy. Vibrant during evenings and weekends, with a blend of authenticity, occasional crowds, and laid-back charm.",48.8525007,2.3694154,653728.4995587892,6861569.22806357,260
The Centre Pompidou,"Iconic avant-garde building with exposed pipes and color-coded systems. Houses modern art exhibitions, surrealism displays, comic art, and a library. Features panoramic Paris views from upper floors. Eclectic mix of installations and rotating collections.","Exploring modern art exhibits, photographing architecture, enjoying city views, attending themed exhibitions (e.g., surrealism), visiting the library, evening visits with nightlife access, pre-booking tickets to avoid queues.","Vibrant, creative energy with a mix of tourists and locals. Modern, eclectic vibe; sometimes crowded but inspiring. Subjective for art enthusiasts—dynamic yet occasionally overwhelming due to avant-garde aesthetics. Evening visits offer quieter, immersive experiences.",48.860642,2.352245,652476.0113694756,6862484.6682741605,261
Eiffel Tower,"Iconic iron lattice structure offering panoramic Paris views, illuminated at night. Described as a 'man-made miracle,' 'magnificent,' and 'historic monument' with glittering lights and seasonal decorations like winter illuminations.","Ascending via lift or stairs, guided tours, photography, nighttime visits, exploring levels, and seasonal experiences (e.g., winter night visits). Activities include booking timed tickets, enjoying city vistas, and attending light displays.","Breathtaking, magical (especially at night), busy yet awe-inspiring. Visitors describe it as 'unforgettable,' 'a childhood dream fulfilled,' and 'a symbol of Paris,' with a mix of wonder, occasional crowds, and seasonal charm like rainy-day or festive December visits.",48.85837009999999,2.2944813,648235.8998567155,6862268.369208708,262
Musee des Arts et Metiers,"Historic science and technology exhibits in a mid-century building, featuring machinery, scientific instruments, Foucault's pendulum, and industrial artifacts. Focuses on technological evolution with rare inventions and engineering displays.","Exploring interactive exhibits, attending workshops, guided tours, extended Friday hours, learning about engineering history, and engaging with hands-on experiments.","Intellectually stimulating and awe-inspiring, with curiosity-driven energy. Appeals to tech enthusiasts; some find it niche or average. Quiet, organized spaces mixed with hidden-gem excitement.",48.8660399,2.3556152,652728.166252471,6863082.848403666,263
Coulee Verte Rene-Dumont,"Elevated linear park on a repurposed railway viaduct, featuring lush greenery, flowers, and city views. Inspired NYC's High Line. Combines industrial history with gardens, arches, and quiet pathways.","Walking, jogging, photography, relaxing, or escaping city bustle. Ideal for strolling, dog-friendly walks, or enjoying seasonal blooms.","Peaceful, hidden oasis with a serene, non-touristy vibe. Quiet, magical ambiance blending urban charm and natural tranquility. Feels like a secret escape.",48.8418664,2.3894009,655185.8368704088,6860375.266502056,264
Luxembourg Palace,"Sprawling gardens with statues, fountains, and manicured lawns surrounding the 17th-century French Senate palace. Features thematic sections, historical architecture, and seasonal floral displays. Combines formal landscaping with open green spaces.","Strolling, picnicking, jogging, relaxing on chairs, photography, exploring historical structures, and people-watching. Free entry for casual visits.",Tranquil yet lively urban oasis with a mix of peaceful relaxation and cultural grandeur. Family-friendly with both shaded calm areas and vibrant gathering spots.,48.84827110000001,2.3372934,651367.5347287061,6861118.239531602,265
Jardin du Palais Royal,"Lush gardens with well-trimmed trees, historic galleries, fountains, and art galleries. Features Parisian architecture, floral arrangements, and photo spots. Surrounded by cafes and shaded seating areas.","Strolling, relaxing on benches, photography, people-watching, quiet reflection, visiting nearby cafes, and exploring art galleries.","Tranquil, serene, and peaceful with occasional crowds. Blends historic charm with quiet retreat vibes, offering both relaxation and cultural immersion in central Paris.",48.8649723,2.3378061,651420.731856214,6862974.948786851,266
Musee Cognacq-Jay,"Small museum in a historic mansion with 18th-century art, furniture, porcelain, and Grand Tour paintings. Features decorative arts, temporary exhibitions, and a courtyard. Compact layout with 13 rooms.","Quick 30-60 minute visits, exploring niche art collections, spontaneous stops, viewing temporary exhibitions, and enjoying quiet cultural immersion.","Quiet, intimate, and charming. Peaceful ambiance with occasional critiques about entry fees or outdated displays. Feels like a hidden gem in Le Marais.",48.8582019,2.3615056,653153.2270589543,6862207.815799619,267
Medici Fountain,"Italian-style fountain with elegant statues and water features, surrounded by lush gardens in Luxembourg Park. Features historical restoration, shaded paths, and proximity to landmarks like the Pantheon.","Relaxing, reading, picnicking, photography, walking garden paths, visiting nearby attractions, and enjoying tranquil breaks.","Serene, peaceful, and poetic ambiance offering calmness amidst the city. Combines natural beauty with historical charm, ideal for unwinding.",48.8480667,2.339308,651515.181740859,6861094.273345724,268
Champ de Mars,"Expansive greenspace with iconic Eiffel Tower views, featuring gardens, open lawns, and occasional construction zones. Dominated by the tower's lattice structure and seasonal event setups like Olympic installations.","Strolling, picnicking, photography (especially night shots), attending events, and enjoying panoramic views of the Eiffel Tower.","Vibrant and bustling with tourists, lively during events; occasionally disrupted by construction but maintains a magical vibe through daytime relaxation and nighttime illumination.",48.85580470000001,2.2983766,648519.1568901648,6861980.574129261,269
Place Georges Pompidou,"Modern architecture with iconic red elevator, surrounded by gardens. Features open-air exhibitions, museum collections (including Carpaccios), and panoramic views of Paris. Mixed reactions to architectural style.","Sightseeing, museum visits, relaxing on slopes with drinks, night photography of lit stairs, observing exhibitions. Catering options nearby.","Bustling and vibrant with crowds, occasionally crowded with long queues. Mix of lively energy and occasional staff rudeness. Pleasant for evening views and socializing.",48.8608613,2.351717,652437.4745434735,6862509.370519224,270
Musee de la Magie,"Underground cellar-like museum featuring historical magic artifacts, automatons, optical illusions, and quirky exhibits. Includes props, posters, and interactive displays focused on magic history and trickery. Combines whimsy with educational elements.","Attending magic shows (some in English), interacting with automatons, exploring optical illusions, family visits with kids, and hands-on exhibits. Ideal for educational fun and playful engagement.","Intimate, quirky, and family-friendly with a cozy, whimsical vibe. Mixes charm and playfulness; some find it delightfully offbeat, while others note its small size or slightly dated exhibits.",48.8531361,2.361217,653127.4959307463,6861644.714262531,271
Eugene Delacroix Museum,"Small museum in Delacroix's former residence and studio, featuring his paintings, personal items, and a tranquil garden. Focuses on his life and lesser-known works rather than major masterpieces.","Exploring intimate galleries, relaxing in the garden, brief art appreciation (1-hour visit), and quiet reflection away from crowds.","Peaceful, intimate, and calm. Offers a serene escape with personal artistic vibes and historical charm in a quiet neighborhood.",48.8544557,2.3355825,651247.7703811531,6861806.96372046,272
Archaeological Crypt of the Ile de la Cite,"Underground site featuring ancient Roman ruins, medieval structures, and stone foundations beneath Notre Dame. Includes Gallo-Roman ramparts, historical exhibits, and archaeological remnants. Focuses on Parisian urban evolution and layered history.","Guided historical tours, self-guided exploration with informational plaques, educational visits for history enthusiasts, and combining with Notre Dame viewing. Ideal for rainy days or cathedral closures.","Quiet, immersive, and reflective. Offers an intimate connection to ancient history with subdued lighting and minimal crowds. Some find it underwhelming without context, but enthusiasts appreciate its educational depth.",48.8536504,2.3477148,652137.228633825,6861709.999419108,273
Cathedrale Notre-Dame de Paris,"Iconic Gothic architecture with stained glass, vaulted ceilings, and ongoing reconstruction post-2019 fire. Features religious art, historical significance, and visible scaffolding, blending medieval grandeur with modern restoration efforts.","Guided tours, admiring stained glass, photography of exterior/scaffolding, attending ceremonies, and observing reconstruction progress. Advance booking recommended for limited access.","Awe-inspiring, solemn, and spiritually uplifting. Combines reverence for history with emotional resilience, heightened by reconstruction efforts and the cathedral’s enduring cultural significance.",48.85296820000001,2.3499021,652297.0981248184,6861632.821376461,274
Zadkine Museum,"Small museum with sculptures, a garden, and artist's studio. Features works by Ossip Zadkine, temporary exhibitions (e.g., Chana Orloff), and outdoor art. Combines intimate indoor galleries with greenery.","Exploring compact galleries, strolling in the garden, viewing temporary exhibitions, and combining visits with nearby attractions like Jardin du Luxembourg.","Charming, intimate, and peaceful. Quiet, hidden gem with a warm, authentic studio vibe. Feels tranquil and unpretentious, enhanced by the garden.",48.8430811,2.333994,651120.5478335471,6860543.200741795,275
Montmartre,"Historic hilltop neighborhood with panoramic Paris views, cobblestone streets, and the Basilica of Sacré-Cœur. Features bohemian charm, artistic heritage, and iconic staircases like the John Wick stairs.","Walking tours, exploring streets, photography, visiting Sacré-Cœur, climbing stairs, and enjoying panoramic city views.","Romantic, magical, and artistic vibe blending old-world charm with lively energy. Described as enchanting, bohemian, and occasionally overcrowded yet deeply atmospheric.",48.8867148,2.3388895,651520.4512747745,6865391.897704792,276
Stravinsky Fountain,"Modern fountain with colorful, quirky sculptures and water features. Features include abstract art, graffiti murals, and mechanical elements. Contrasts vibrant hues with surrounding architecture. Integrated into an urban square near Centre Pompidou.","Relaxing, people-watching, photography, enjoying nearby cafes, quick visits. Ideal for art appreciation and casual breaks. Avoid during renovations or non-working fountain periods.","Lively, creative, and slightly chaotic. Vibrant daytime energy with open-air museum vibes; occasionally crowded. Fun yet occasionally unsettling due to bold sculptures. Seasonal bustle from skateboarders and tourists.",48.859478,2.351546,652423.6659274879,6862355.662163103,277
Square du Temple - Elie Wiesel,"Small, well-maintained park with green areas, flower beds, a sand playground, ping pong/chess tables, and a bandstand. Features a memorial theme (Holocaust survivor Elie Wiesel) and water elements. Includes shaded seating and occasional construction zones.","Relaxing on benches, playground for kids, ping pong/chess, picnics, people-watching, casual strolls, and enjoying snacks/coffee. Popular for family outings and local gatherings.","Lively yet peaceful oasis with a local, community vibe. Combines calm relaxation (quiet seating areas) with playful energy (children, games). Crowded at times but retains a serene, urban retreat feel.",48.86448739999999,2.3607212,653101.3347250973,6862907.177795524,278
Colonnes de Buren Les Deux Plateaux,"Modern outdoor art installation featuring black-and-white striped columns in Palais Royal courtyard, blending contemporary design with historic architecture. Contrasts geometric patterns with surrounding gardens and classical buildings.","Photography (especially creative shots), relaxing in the garden, people-watching, exploring geometric art, and climbing columns for playful interactions.",Vibrant yet peaceful; artistic and Instagrammable. Mixes lively tourist energy with quiet moments for reflection. Feels both whimsical and culturally significant.,48.863612,2.3370336,651362.7917867389,6862824.170026348,279
Arenes de Lutece,"Ancient Roman amphitheater blending ruins and reconstructed elements, featuring stone terraces, grassy areas, and archaeological remnants. Combines historical preservation with public park integration.","Relaxing, picnicking, casual games (e.g., pétanque), exploring history, photography, quiet reflection, and enjoying peaceful downtime.","Tranquil, serene, and uncrowded; a hidden-gem vibe blending ancient history with local community calm.",48.8235001,2.3657501,653433.6490363865,6858346.8178624585,280
Palais Garnier,"Grandiose 19th-century architecture with opulent interiors: marble, gilded details, frescoed ceilings, and a monumental chandelier. Thematic focus on opera history and artistic excellence, featuring iconic spaces like the grand staircase and auditorium.","Guided tours (including after-hours), self-exploration of ornate rooms, attending opera performances, photography of architectural details, and purchasing advance tickets to avoid queues.",Awe-inspiring grandeur with a mix of bustling crowds and hushed reverence. Visitors describe it as majestic yet occasionally overwhelming due to its scale and tourist density.,48.8719697,2.3316014,650972.1453260133,6863756.840372682,281
Deyrolle,"Multi-floor taxidermy shop featuring preserved animals, insects, scientific specimens, and curiosities. Combines natural history displays with gardening items downstairs. Known for surreal dioramas and educational exhibits in a gallery-like setting.","Exploring taxidermy displays, photography, educational browsing, shopping for unique naturalist items, admiring insect collections, and experiencing surreal visual storytelling.","Magical yet slightly eerie blend of curiosity and nostalgia. Enchanting, intellectually stimulating, and occasionally unsettling due to preserved specimens. Feels like a timeless cabinet of curiosities.",48.8565331,2.3264245,650577.7805601978,6862043.644816349,282
Museum of the Art and History of Judaism,"Museum showcasing Jewish art, artifacts, and history from 1200 onwards. Features diverse collections of relics, photos, and exhibits on Parisian Jewish heritage. Housed in a historic building, with some exhibits lacking translations.","Guided audio tours, exploring permanent and temporary exhibitions, historical walks in Le Marais district, using museum passes for entry.","Mostly peaceful and well-managed, but mixed due to reports of discriminatory entry practices, occasional staff rudeness, and sparse crowds. Some visitors feel immersed in history, others frustrated by language barriers.",48.8610102,2.3556112,652723.3087476938,6862523.588369168,283
Pont de l'Archeveche,"Stone bridge spanning the Seine with views of Notre Dame Cathedral (including reconstruction), remnants of removed love locks, and scenic river vistas.","Photographing Notre Dame, walking along the Seine, enjoying views, visiting nearby coffee shops, and observing historical elements.","Scenic and historic, with nostalgic undertones from removed locks and Notre Dame's reconstruction; mixes tourist bustle with serene river charm.",48.8575475,2.3513765,652409.466897741,6862141.109201814,284
Galerie Vivienne,"Historic covered shopping arcade with preserved 19th-century architecture, glass roofs, decorative mosaics, and elegant staircases. Features boutique shops, bookstores, cafés, and upscale restaurants. Known for twinkling lights and Christmas decorations.","Shopping for unique items, dining in cafés/restaurants, exploring architectural details, photography, and enjoying seasonal decorations.","Magical, elegant, and cozy with a nostalgic charm. Mix of bustling energy during peak times and tranquil moments. Described as captivating, slightly hidden, and less crowded than other Parisian attractions.",48.8666928,2.3397458,651564.6267115357,6863165.063119093,285
Mineralogy Museum MINES ParisTech,"Vast collection of minerals, gems, and rare specimens displayed in historic rooms. Features thousands of gems, diamonds, and world-class minerals, including unique geological treasures. Exhibits are visually stunning and scientifically significant.","Educational exploration for geology enthusiasts, family visits with kids, photography of exhibits, interactive learning about minerals, and guided tours for detailed insights.","Intimate, quiet, and welcoming. Friendly staff, uncrowded spaces, and a scholarly vibe that encourages awe and curiosity about natural history.",48.8454487,2.3395614,651531.3422724168,6860803.021994419,286
Shakespeare and Company,"Historic English-language bookstore with labyrinthine shelves, cozy reading nooks, and literary charm. Features a café, eclectic décor, and views of Notre-Dame. Known for its iconic status and ties to literary history.","Browsing books, attending readings, exploring hidden corners, café relaxation, purchasing unique editions, and photo opportunities.","Enchanting, cozy, and intellectually vibrant with a nostalgic, magical vibe. Crowded yet intimate, blending tourist energy with serene literary inspiration.",48.8525632,2.3471303,652093.3411918014,6861589.467163505,287
Arab World Institute,"Striking modern architecture with intricate facade designs; features temporary exhibitions (e.g., fragrances, Samarkand, LGBT themes), a library, and a rooftop terrace offering panoramic Paris views. Combines cultural displays with architectural innovation.","Visiting rooftop for views, exploring temporary exhibitions, appreciating architecture, cultural learning in the library, and attending themed displays.","Mixed: culturally vibrant with artistic exhibitions, but some visitors report rudeness, racism, or poor organization, contrasting with others praising its uniqueness and courageous themes.",48.8489257,2.3572313,652831.2294213033,6861178.929945922,288
Le Defenseur du Temps,"A 4m-tall mechanical clock featuring an automaton warrior battling creatures, located in a hidden courtyard. Recently repaired (2024), it combines street art with intricate mechanics. Surrounded by a passageway near Centre Pompidou, often described as extravagant and original.","Watching the hourly automaton show, photographing the sculpture, exploring the secluded courtyard, and combining visits with nearby Centre Pompidou.","Intriguing and slightly eerie, with mechanical clangs during shows. Peaceful yet mysterious due to its hidden location. Mixes excitement when operational with occasional disappointment from malfunctions.",48.86223529999999,2.3526629,652508.1232583929,6862661.578674256,289
Pont de Sully,"Iron bridge with statues, offering views of the Seine, Île Saint-Louis, and Île de la Cité. Features surrounding old houses and seasonal skating performers. Partially noted as architecturally simple by some.","Sightseeing, photography (especially sunset), picnics, strolls, boat cruises, watching performances, and playground visits for kids.","Picturesque, charming, and relaxing with romantic sunset vibes. Mixes historic charm with lively river energy and occasional melancholy mentions.",48.8500783,2.3589517,652958.5164911654,6861306.061959472,290
Point zero des routes de France,"Bronze marker in front of Notre-Dame Cathedral, symbolizing France’s road system origin. Currently under restoration with partial metal plate coverage. Historic and visually tied to cathedral views.","Taking photos with the marker, reflecting on history, waiting for Notre-Dame entry, and participating in the 'return to Paris' stepping tradition.",Historic and magical but partially obstructed by construction. Mix of quiet reflection and crowded tourist energy near Notre-Dame.,48.8534095,2.348792,652216.0477014047,6861682.561124115,291
